id,isbn,title,author,publisher,image_url,content,genre_detail_dict_id
13727,9788961567282,포이온 =최창환 퓨전 판타지 장편소설.Poion ,지은이: 최창환,영상노트,https://image.aladin.co.kr/product/453/13/cover/8961567284_1.jpg,삼류무공을 수련한 지 50년. 친수를 다한 그에게 새로운 삶의 기회가 찾아왔다. 눈을 뜬 새로운 세상에서 황자로서의 삶을 살게 된 헤론. 그러나 권력의 다툼을 관망하고 평생의 염원인 무인으로서의 길을 걷고자 환궁을 벗어나는데 …. 최창환의 퓨전 판타지 장편소설 제 4권.,14
13728,9788961567596,포이온 =최창환 퓨전 판타지 장편소설.Poion ,지은이: 최창환,영상노트,https://image.aladin.co.kr/product/477/13/cover/8961567594_1.jpg,『포이온』제5권. 삼류무공을 수련한 지 50년. 친수를 다한 그에게 새로운 삶의 기회가 찾아왔다. 눈을 뜬 새로운 세상에서 황자로서의 삶을 살게 된 헤론. 그러나 권력의 다툼을 관망하고 평생의 염원인 무인으로서의 길을 걷고자 환궁을 벗어나는데.,14
13729,9788961568005,포이온 =최창환 퓨전 판타지 장편소설.Poion ,지은이: 최창환,영상노트,https://image.aladin.co.kr/product/587/56/cover/6000368531_1.jpg,삼류무공을 수련한지 50년. 천수를 다한 그에게 새로운 삶의 기회가 찾아왔다.눈을 뜬 새로운 세상에서 황자로서의 삶을 살게 된 헤론.그러나 권력의 다툼을 관망하고 평생의 염원인 무인으로서의 길을 걷고자 황궁을 벗어나는데……마도제국 포이온의 황제 테설론.현존하는 신들과 신화시대의 종말을 갈망하는... ,14
13730,9788961568456,포이온 =최창환 퓨전 판타지 장편소설.Poion ,지은이: 최창환,영상노트,https://image.aladin.co.kr/product/621/49/cover/8961568450_1.jpg,『포이온』제7권. 삼류무공을 수련한 지 50년. 친수를 다한 그에게 새로운 삶의 기회가 찾아왔다. 눈을 뜬 새로운 세상에서 황자로서의 삶을 살게 된 헤론. 그러나 권력의 다툼을 관망하고 평생의 염원인 무인으로서의 길을 걷고자 환궁을 벗어나는데....,14
13731,9788961568876,포이온 =최창환 퓨전 판타지 장편소설.Poion ,지은이: 최창환,영상노트,https://image.aladin.co.kr/product/656/47/cover/8961568876_1.jpg,최창환 퓨전 판타지 장편소설『포이온』제8권. 삼류무공을 수련한 지 50년. 친수를 다한 그에게 새로운 삶의 기회가 찾아왔다. 눈을 뜬 새로운 세상에서 황자로서의 삶을 살게 된 헤론. 그러나 권력의 다툼을 관망하고 평생의 염원인 무인으로서의 길을 걷고자 환궁을 벗어나는데....,14
13732,9788961569668,포이온 =최창환 퓨전 판타지 장편소설.Poion ,지은이: 최창환,영상노트,https://image.aladin.co.kr/product/711/74/cover/896156966x_1.jpg,최창환 퓨전 판타지 장편소설『포이온』제 9권. 삼류무공을 수련한 지 50년. 친수를 다한 그에게 새로운 삶의 기회가 찾아왔다. 눈을 뜬 새로운 세상에서 황자로서의 삶을 살게 된 헤론. 그러나 권력의 다툼을 관망하고 평생의 염원인 무인으로서의 길을 걷고자 환궁을 벗어나는데....,14
13733,9788925829500,시즈루와 끝없는 밀실들 :the bottomless closed-rooms in the limited world,카도노 코헤이 지음 ;김수현 옮김,학산문화사,https://image.aladin.co.kr/product/408/48/cover/8925829509_1.jpg,"국내에서 '부기팝 시리즈'의 작가로 알려진 카도노 코헤이의 '시즈루 시리즈'. 오로지 병실 안에 머무르면서 밖에 일어나는 기괴한 사건들을 해결해나가는 시즈루와 그녀에게 사건을 설명해주는 또 하나의 소녀, 요짱을 중심으로 이야기가 진행되어 나가는 미스터리 추리소설이다.",38
13734,9788988537015,천년의 금서 :김진명 장편소설 ,지은이: 김진명,새움출판사,http://image.aladin.co.kr/product/367/21/cover/8988537017_2.jpg," 의 작가 김진명의 장편소설. 고대사 문제를 새롭게 조명한 작품이다. 핵융합 발전의 획기적인 발전을 주도했던 ETER의 물리학자 이정서는 대통령의 초청으로 프랑스에서 귀국한다. 그는 대통령 초청만찬에서 공적을 치하 받지만 기쁨도 잠시, 며칠 후 친구의 충격적인 죽음을 접하게 되는데…",28
13735,9788961566551,유광 :유익 신무협 장편소설,지은이: 유익,영상노트,https://image.aladin.co.kr/product/413/84/cover/8961566555_1.jpg,"[표지글]사내는 한탄(恨歎)한다. 심연(深淵)과도 같은 깊은 내면에 지옥의 불길이 자리하고 있었다. 지독한 암흑의 시간들이 불꽃이 되어 타올랐고, 타오른 불꽃은 재가 되어 그의 가슴에 새겨졌다. 그것은 증오심과 복수심으로… 천녀의 풍고를 겪는 절벽과도 같았다.",157
13736,9788961566568,유광 :유익 신무협 장편소설,지은이: 유익,영상노트,https://image.aladin.co.kr/product/413/84/cover/8961566563_1.jpg,"[표지글]사내는 한탄(恨歎)한다. 심연(深淵)과도 같은 깊은 내면에 지옥의 불길이 자리하고 있었다. 지독한 암흑의 시간들이 불꽃이 되어 타올랐고, 타오른 불꽃은 재가 되어 그의 가슴에 새겨졌다. 그것은 증오심과 복수심으로… 천녀의 풍고를 겪는 절벽과도 같았다.",157
13737,9788961566919,유광 :유익 신무협 장편소설,지은이: 유익,영상노트,https://image.aladin.co.kr/product/431/82/cover/8961566911_1.jpg,"사내는 한탄(恨歎)한다. 심연(深淵)과도 같은 깊은 내면에 지옥의 불길이 자리하고 있었다. 지독한 암흑의 시간들이 불꽃이 되어 타올랐고, 타오른 불꽃은 재가 되어 그의 가슴에 새겨졌다. 그것은 증오심과 복수심으로… 천년의 풍고를 겪는 절벽과도 같았다. 고련(苦練)… 고련. 점차 다가갈수록 그의 가슴은... ",157
13738,9788961567176,유광 :유익 신무협 장편소설,지은이: 유익,영상노트,https://image.aladin.co.kr/product/446/55/cover/8961567179_1.jpg,유익의 신무협 장편소설 『유광』제 4권. 사내는 한탄한다. 심연과도 같은 깊은 내면에 증오심과 복수심으로 가득 차있다. 점차 그의 가슴은 황무지처럼 메말라만 갔다. 모든 것을 끝낸 그에게 하늘은 한 줌의 숨을 남겨 하나의 인연으로 이어지고 그의 가슴은 점차 평온을 찾아가는데….,157
13739,9788925832548,대역 백작의 모험 ,글: 세이케 미모리 ;옮긴이: 정경옥,학산문화사,https://image.aladin.co.kr/product/407/50/cover/8925832542_1.jpg,사건은 평소와 다를 바 없는 오후에 일어났다. 서민풍의 빵집 마스코트로 싱글 생활 16년째를 보내고 있던 미레이유의 앞에 느닷없이 수수께끼 청년이 나타난다. 그리고 그에게서 쌍둥이 오빠의 민망한 소행과 그녀의 운명을 급변시킬 계획에 대해 듣게 되는데…,38
13740,9788993789485,GM퀘스트 :공민배 게임판타지 장편소설,지은이: 공민배,어울림출판사,https://image.aladin.co.kr/product/418/22/cover/8993789487_1.jpg,"공민배의 게임 판타지 장편소설. 불법적인 버그 플레이를 하다가 GM들에게 딱 걸린 고르. 6년 간의 노력이 담긴 아이템 초기화에 더불어 레벨 다운, 게임 내의 문제들을 해결하는 강제 퀘스트까지. 고생 끝에 '오토 캐릭터'를 생성, 망할 퀘스트 해결했다. 그러나, 그 와중에 GM들과의 계약에 대한 더러운 진실이 드러나는데…",14
13741,9788993789492,GM퀘스트 :공민배 게임판타지 장편소설,지은이: 공민배,어울림출판사,https://image.aladin.co.kr/product/418/22/cover/8993789495_1.jpg,"공민배의 게임 판타지 장편소설. 불법적인 버그 플레이를 하다가 GM들에게 딱 걸린 고르. 6년 간의 노력이 담긴 아이템 초기화에 더불어 레벨 다운, 게임 내의 문제들을 해결하는 강제 퀘스트까지. 고생 끝에 '오토 캐릭터'를 생성, 망할 퀘스트 해결했다. 그러나, 그 와중에 GM들과의 계약에 대한 더러운 진실이 드러나는데…",14
13742,9788993789683,GM퀘스트 :공민배 게임판타지 장편소설,지은이: 공민배,어울림출판사,https://image.aladin.co.kr/product/431/6/cover/8993789681_1.jpg,"공민배의 게임 판타지 장편소설. 불법적인 버그 플레이를 하다가 GM들에게 딱 걸린 고르. 6년 간의 노력이 담긴 아이템 초기화에 더불어 레벨 다운, 게임 내의 문제들을 해결하는 강제 퀘스트까지. 고생 끝에 '오토 캐릭터'를 생성, 망할 퀘스트 해결했다. 그러나, 그 와중에 GM들과의 계약에 대한 더러운 진실이 드러나는데…",14
13743,9788993789393,지노귀 :장준우 퇴마소설,지은이: 장준우,어울림출판사,https://bookthumb-phinf.pstatic.net/cover/060/355/06035525.jpg?type=m1&udate=20151015,"장준우의 퇴마소설. 어느 순간 퇴마사로의 운명에 휩쓸려버린 평범한 사람들의 이야기이다. 어느 날 갑자기 귀신을 보게 되고, 자신조차 몰랐던 힘을 자각한 그들 중 누구 하나 자신의 운명을 선택할 수조차 없었다. 하지만 그들은 절망하지는 않는다. 오히려 힘을 내어 자신들이 가야 할 '길'을 걸어가겠다고 다짐한다.",135
13744,9788993789409,지노귀 :장준우 퇴마소설,지은이: 장준우,어울림출판사,https://bookthumb-phinf.pstatic.net/cover/060/355/06035526.jpg?type=m1&udate=20151015,"장준우의 퇴마소설. 어느 순간 퇴마사로의 운명에 휩쓸려버린 평범한 사람들의 이야기이다. 어느 날 갑자기 귀신을 보게 되고, 자신조차 몰랐던 힘을 자각한 그들 중 누구 하나 자신의 운명을 선택할 수조차 없었다. 하지만 그들은 절망하지는 않는다. 오히려 힘을 내어 자신들이 가야 할 '길'을 걸어가겠다고 다짐한다.",135
13745,9788996206552,참 서툰사랑 :이정하 에세이 ,지은이: 이정하 ;사진: 서수연,SJ소울,http://image.aladin.co.kr/product/412/90/cover/8996206555_1.jpg,시집   등을 펴낸 이정하 시인의 치유 에세이. 인터넷으로 한 사람을 만나 마음을 나누고 사랑에 대해 꿈 꾸어왔던 로망을 이루어가는 과정들을 이정하 시인만의 세심한 감성으로 그린다. 이별과 그리움의 과정을 통해 다친 마음을 토닥여주기도 한다.,6
13746,9788996009054,그린버드 =꽃과의 아름다운 만남 /Green bud ,지은이: 정혜인,주노아트,http://image.aladin.co.kr/product/397/40/cover/8996009059_1.jpg,"[표지글]아이들의 정서함양에 도움이 되는 초간단 플라워 데코레이션. 생명이 있는 다양한 꽃과 식물을 이용한 꽃놀이는 아동의 오감 발달 및 전인적인 성장 발달에 미치는 영향(집중력, 자아개념 실현)이 큽니다. 또한 정서에 미치는 영향, 취학전 유아의 창의성 발달에도 기여합니다.",88
13747,9788959192489,큐브릭 =강도하 만화.Kubrick : the hybrid generation ,지은이: 강도하,애니북스,http://image.aladin.co.kr/product/335/33/cover/8959192481_1.jpg,"방주를 만들고 싶어요... 이렇게 예쁜 세상에 좋은 사람 나쁜 사람 같이 산다는 게 화나고 무서웠어요 『위대한 캣츠비』,『로맨스 킬러』 청춘에 관한 단상을 그린 만화가 강도하의 '청춘' 3부작 완결편『 KUBRICK(큐브릭)』. 미디어 다음 만화속 세상에서 연재한 청춘의 한 가운데에 서 있는 10대들의 이야기를... ",117
13748,9788959192496,큐브릭 =강도하 만화.Kubrick : the hybrid generation ,지은이: 강도하,애니북스,http://image.aladin.co.kr/product/335/34/cover/895919249x_1.jpg,은 웹상의 스크롤 연출을 종이에 그대로 옮겨 담는 것이 아니라 단행본에 최적화된 감상을 위해 전 분량 재연출을 거쳐 탄생시킨 완전판이다.,117
13749,9788959192502,큐브릭 =강도하 만화.Kubrick : the hybrid generation ,지은이: 강도하,애니북스,http://image.aladin.co.kr/product/335/34/cover/8959192503_1.jpg,"방주를 만들고 싶어요... 이렇게 예쁜 세상에 좋은 사람 나쁜 사람 같이 산다는 게 화나고 무서웠어요 『위대한 캣츠비』,『로맨스 킬러』 청춘에 관한 단상을 그린 만화가 강도하의 '청춘' 3부작 완결편『 KUBRICK(큐브릭)』. 미디어 다음 만화속 세상에서 연재한 청춘의 한 가운데에 서 있는 10대들의 이야기를... ",117
13750,9788959192519,큐브릭 =강도하 만화.Kubrick : the hybrid generation ,지은이: 강도하,애니북스,http://image.aladin.co.kr/product/335/34/cover/8959192511_1.jpg,"방주를 만들고 싶어요... 이렇게 예쁜 세상에 좋은 사람 나쁜 사람 같이 산다는 게 화나고 무서웠어요 『위대한 캣츠비』,『로맨스 킬러』 청춘에 관한 단상을 그린 만화가 강도하의 '청춘' 3부작 완결편『 KUBRICK(큐브릭)』. 미디어 다음 만화속 세상에서 연재한 청춘의 한 가운데에 서 있는 10대들의 이야기를... ",117
13751,9788963270227,자은션생과 옥슌문생 ,엮은이: 김일렬교수정년기념사은문집간행위원회,글누림출판사,http://image.aladin.co.kr/product/381/24/cover/896327022x_1.jpg,"전 경북대학교 국어국문학과 교수인 김일렬 교수의 퇴임을 기념하기 위해 발간된 수필집. 책은 2부로 구성되었다. 1부에는 김일렬 교수의 글을 '국어국문학과 학문', '개인적인 추억들', '일반 수필'의 세 부분으로 나눠 실었다. 2부에는 김일렬 교수를 선배, 또는 스승으로 모신 후배, 제자들의 글을 모았다.",72
13752,9788992984409,블루 샤콘느 :지상에서 가장 슬픈 노래 : 와타나베 준이치 장편소설,와타나베 준이치 지음 ;황선종 옮김,형설라이프,https://bookthumb-phinf.pstatic.net/cover/060/011/06001120.jpg?type=m1&udate=20100414,가질 수 없는 사랑의 허무함...&lt;실낙원&gt;의 작가 와타나베 준이치의 소설『블루 샤콘느』제1권. 남녀가 사랑의 행위를 통해 하나가 되어가는 과정을 섬세하고 아름답게 그려내는 것으로 유명한 작가 와타나베 준이치의 미학적 에로티시즘이 돋보인다. 영화로도 제작되어 큰 화제를 불러일으켰던 이 작품은... ,13
13753,9788992364331,달을 쏘다 :윤동주 시집 ,지은이: 윤동주 ;[엮은이]: 배용파,온북스,http://image.aladin.co.kr/product/350/28/cover/8992364334_1.jpg,불명의 저항시인 윤동주의 시집 『달을 쏘다』. 시대의 고통을 안고 치열한 삶을 살았던 윤동주의 서정적인 시를 이서지 화백의 컬러 그림과 함께 엮었다. 누구나 한 번쯤 들어봤을 법한 「별 헤는 밤」을 비롯해 저항적이지만 때 묻지 않은 순수한 시들을 담았다.일제강점기를 짧게 살다간 젊은 시인 윤동주의... ,3
13754,9788949192154,1001초 살인 사건 :온다 리쿠 단편소설집 ,지은이: 온다 리쿠 ;옮긴이: 권영주,까멜레옹·비룡소,http://image.aladin.co.kr/product/381/76/cover/8949192152_1.jpg," 이후 오 년 만에 선보이는 온다 리쿠의 단편집. 미스터리, 판타지, 호러, SF 등 다양한 장르의 단편 열네 편이 수록되어 있다. 특히 온다 리쿠가 쓴 최초의 아동 문학 '그 뒷이야기'와 스플래터 호러 '졸업'처럼 이전에는 볼 수 없었던 장르들이 포함되어 있다.",13
13755,9788973621699,(아리스토텔레스의) 레토릭 :설득의 변론기술 ,[아리스토텔레스 지음] ;전영우 옮김,민지사,http://image.aladin.co.kr/product/397/39/cover/8973621696_1.jpg,"[표지글]아리스토텔레스는 레토릭을 &quot;어떤 경우에든 각 사례에 적응할 수 있는 설득 방법을 창출해 내는 능력&quot;이라 정의하고, 방법을 기술과 비기술로 나누었다. 기술은 논자의 인품 ETHOS, 한 쪽으로 모아지는 청중의 정서 PATHOS, 논자의 언론 LOGOS 등 3요소이고, 비기술은 증인, 자백, 물증 등... ",8
13756,9788957941379,한강의 지평 :韓國空間詩人協會 2008 ,지은이: 한국공간시인협회,한강출판사,http://image.aladin.co.kr/product/375/38/cover/8957941371_1.jpg,"[표지글]나는 한강변에서 나서, 한강물을 마시며, 한강과 함께 살아온 사람이다. 그러기에 『한강의 지평』이라는 우리 한국공간시인협회의 대표시선에 더욱 애착을 느끼고 있는지도 모르겠다. 한강이 우리 민족의 젖줄이듯이 우리도 한강과 함께 살아갈 것이고, 우리 한국공간시인협회도 한강과 같이 끝없이... ",3
13757,9788901094069,엄마는 친절한 영어 선생님 ,글쓴이: 홍현주,웰북,http://image.aladin.co.kr/product/358/74/cover/8901094061_1.jpg,"엄마와 함께하는 첫 영어~.영어 집에서 배우자!우리 아이 첫 영어 엄마와 함께 즐겁게 배울 수 있는 교재『엄마는 친절한 영어 선생님』. 공간과 상황에 따른 영어 회화 표현을 정리했으며, 집 안 어디서든 일어날 수 있는 상황들을 대화로 수록했다. 엄마와 함께 하면서 영어를 생활의 일부로... ",19
13758,9788992984416,블루 샤콘느 :지상에서 가장 슬픈 노래 : 와타나베 준이치 장편소설,와타나베 준이치 지음 ;황선종 옮김,형설라이프,http://image.aladin.co.kr/product/358/74/cover/8992984413_1.jpg,"나오키 상, 요시카와 에이치 문학상 수상작가 와타나베 준이치의 장편소설. 한때 인기 작가였던 기쿠지는 어느 날 자신의 열렬한 팬이란 후유카를 만난다. 하지만 후유카는 남편을 둔, 아이가 셋 있는 가정주부다. 도덕과 법 앞에 용납되지 않는 사랑이지만, 대지에 새싹이 돋듯 각자의 가슴에 조심스레 움트게 되는데…",13
13759,9788996227250,붉은리본 =Red ribbon ,Kenzi 지음,다인북스,http://image.aladin.co.kr/product/358/28/cover/8996227250_1.jpg,"금기된 사랑을 시작한 남자, 원기. 부정하면 부정 할수록 그의 가슴속을 파고드는 한 소녀. 거부할 수도 멈출 수도 없는 지독한 사랑. 그리고 한 남자를 죽도록 미워하고 사랑한 소녀, 은오. 그녀가 사랑을 시작할 때 떠나버렸던 남자. 단 하루를 가슴에 묻고 살았던 긴 시간. 애증의 끝에서 다시 만난 날의 이야기.",30
13760,9788996227267,꽃피는 춘삼월 ,이선영 지음,다인북스,http://image.aladin.co.kr/product/361/47/cover/8996227269_1.jpg,혹독한 겨울을 인내하면 따땃한 봄날이 온다는 건 자연의 섭리. 과연 그들에게 꽃피는 춘삼월은 찾아올 것인가? 사랑을 기다리는 처녀의 가슴이 완연한 봄기운에 두근두근! 꽁꽁 얼어붙은 사내의 심장이 얄궂은 봄바람에 간질간질! 따뜻한 봄 햇살 아래 사랑의 열병을 시작하는 두 사람의 행로는?,30
13761,9788961458276,멘탈리스트 =김병기 퓨전 판타지 장편소설.Mentalist ,지은이: 김병기,디앤씨미디어,https://image.aladin.co.kr/product/365/8/cover/8961458272_1.jpg,"김병기의 퓨전 판타지 장편소설. 눈을 떴을 땐 하늘 아래, 오직 혼자였다. 그리고 깨어나는 혼돈과 재앙의 시대. 오로지 생존을 목적으로 살아남기 위해 깬 금기는 그를 제왕의 길로 인도하였으니. 정신을 지배하는 자, 그의 앞에 무릎을 꿇어라. 그가 걷는 발자욱은 전설을 창조한다.",14
13762,9788961458283,멘탈리스트 =김병기 퓨전 판타지 장편소설.Mentalist ,지은이: 김병기,디앤씨미디어,https://image.aladin.co.kr/product/365/8/cover/8961458280_1.jpg,"김병기의 퓨전 판타지 장편소설. 눈을 떴을 땐 하늘 아래, 오직 혼자였다. 그리고 깨어나는 혼돈과 재앙의 시대. 오로지 생존을 목적으로 살아남기 위해 깬 금기는 그를 제왕의 길로 인도하였으니. 정신을 지배하는 자, 그의 앞에 무릎을 꿇어라. 그가 걷는 발자욱은 전설을 창조한다.",14
13763,9788961458290,멘탈리스트 =김병기 퓨전 판타지 장편소설.Mentalist ,지은이: 김병기,디앤씨미디어,https://image.aladin.co.kr/product/409/98/cover/8961458299_1.jpg,"김병기의 퓨전 판타지 장편소설. 눈을 떴을 땐 하늘 아래, 오직 혼자였다. 그리고 깨어나는 혼돈과 재앙의 시대. 오로지 생존을 목적으로 살아남기 위해 깬 금기는 그를 제왕의 길로 인도하였으니. 정신을 지배하는 자, 그의 앞에 무릎을 꿇어라. 그가 걷는 발자욱은 전설을 창조한다.",14
13764,9788925533018,너는 나의 ,이치가와 다쿠지 지음 ;맹보용 옮김,랜덤하우스코리아,http://image.aladin.co.kr/product/409/5/cover/8925533014_1.jpg," 의 작가 이치카와 다쿠지의 데뷔작. 두 편의 중편소설이 수록되어 있다. 두 편 모두 독특한 설정을 가지고 있는데, 첫 번째 작품 '너는 나의'는 사랑하는 아내가 어느 날 갑자기 어려지기 시작한다는 설정이고, 두 번째 작품 'VOICE'는 사랑하는 여자의 마음 속 목소리가 들린다는 설정이다.",41
13765,9788963300290,조금 다른 내 아이 특별하게 키우기 :현명한 부모의 자녀코칭 ,"Stanley I. Greenspan,김성준 공역",학지사,http://image.aladin.co.kr/product/415/30/cover/8963300293_1.jpg,키우기 어려운 다섯 가지 자녀 유형의 기질 및 심리 특징에 대해서 자상하게 소개한 양육서. 특히 자녀의 입장을 이해하고 그들의 성장을 돕기 위해서 부모가 주의를 기울여야 할 부분과 부모의 행동 지침을 구체적으로 소개하고 있다.,39
13766,9788993103199,"엄마, 내겐 당신이 세상입니다 ","이숙희,박수영 그림",새롬주니어,http://image.aladin.co.kr/product/388/33/cover/8993103194_1.jpg,작가 박수영이 전하는 행복과 희망의 메시지. 오늘을 살아가는 엄마와 딸을 위해 따뜻한 사랑이 담긴 에세이를 수록했다.,4
13767,9788925243832,이웃집 801양,저자: Ajico Kojima ;김진수,대원씨아이,http://image.aladin.co.kr/product/366/20/cover/8925243830_1.jpg,"이웃집801양        글/그림 : 아지코 코지마  오타쿠인 제가 2년을 사귀고 있는 여친은, 애니 이야기를 해도 웃으며 들어주는 정말 착한 친구입니다.  근데 뭐야? 등에 달린 그 지퍼는?  !!!!  '그리고 도대체 801이 뭐야?'  ▶일본 블로그 계를 놀래킨 한 오타쿠 샐러리맨의 여자친구 801양.  남자친구보다 '디아카... ",25
13768,9788925246536,이웃집 801양,저자: Ajico Kojima ;김진수,대원씨아이,http://image.aladin.co.kr/product/418/64/cover/8925246538_1.jpg,"[표지글]남친의 애정어린(?) 눈으로, 가장 가까운 시점에서 부(腐)녀자를 파헤친초특급 리얼리티 관찰 일지 2권 등장!웃음이 빵 터지면서 동시에 등줄기가 오싹~한 당신은이미 801양의 매력에 빠지신 겁니다~!",25
13769,9788925250816,이웃집 801양,저자: Ajico Kojima ;김진수,대원씨아이,http://image.aladin.co.kr/product/464/96/cover/8925250810_1.jpg,"‘오타쿠인 내가 만화 얘기를 해도 웃으면서 들어주던 착한 그녀. 알고보니 제 여자친구는 부녀자(腐女子)였습니다!’ &#x0D;충격적인 고백과 함께 시작되는 화제의 블로그가 만화화! &#x0D;남자친구에게 수트 데이트를 요구하고, 건담의 캐릭터 디아카에게 모에~를 외치는 못 말리는 동인녀와 이런 동인녀를... ",25
13770,9788925264493,이웃집 801양,저자: Ajico Kojima ;김진수,대원씨아이,https://image.aladin.co.kr/product/742/53/cover/8925264498_1.jpg,"『이웃집 801양』제4권. ‘오타쿠인 내가 만화 얘기를 해도 웃으면서 들어주던 착한 그녀. 알고보니 제 여자친구는 부녀자(腐女子)였습니다!’ 충격적인 고백과 함께 시작되는 화제의 블로그가 만화화! 남자친구에게 수트 데이트를 요구하고, 건담의 캐릭터 디아카에게 모에~를 외치는 못 말리는 동인녀와 이런... ",25
13771,9788925297316,이웃집 801양,저자: Ajico Kojima ;김진수,대원씨아이,https://image.aladin.co.kr/product/1697/74/cover/8925297310_1.jpg,"AJIKO KOJIMA 만화『이웃집 801양』제5권. ‘오타쿠인 내가 만화 얘기를 해도 웃으면서 들어주던 착한 그녀. 알고보니 제 여자친구는 부녀자(腐女子)였습니다!’ 충격적인 고백과 함께 시작되는 화제의 블로그가 만화화! 남자친구에게 수트 데이트를 요구하고, 건담의 캐릭터 디아카에게 모에~를 외치는 못... ",25
13772,9791156253532,이웃집 801양,저자: Ajico Kojima ;김진수,대원씨아이,https://image.aladin.co.kr/product/3995/82/cover/1156253535_1.jpg,"AJIKO KOJIMA 만화 『이웃집 801양』 제6권. ‘오타쿠인 내가 만화 얘기를 해도 웃으면서 들어주던 착한 그녀. 알고보니 제 여자친구는 부녀자(腐女子)였습니다!’ 충격적인 고백과 함께 시작되는 화제의 블로그가 만화화! 남자친구에게 수트 데이트를 요구하고, 건담의 캐릭터 디아카에게 모에~를 외치는 못... ",25
