id,isbn,title,author,publisher,image_url,content,genre_detail_dict_id
1502,9791187716501,초저출산 터널을 탈출하는 법 :ultra-low birthrate Q&A 5 ,남충우 지음,글나무,https://image.aladin.co.kr/product/25975/32/cover/k582737225_1.jpg,"『초저출산 터널을 탈출하는 법』 은 〈초超저출산은 얼마나 심각한 일인가〉, 〈초超저출산, 누가 죄인인가〉, 〈저출산을 극복한 국가는 없는가〉, 〈초超저출산, 정말 대책이 없을까〉, 〈2020년 저출산 예산 32조원으로도 부족한가〉 를 수록하고 있는 책이다.",56
1503,9791197230806,안녕하세요 동물변호사 대표입니다 ,글쓴이: 문경복,알,https://image.aladin.co.kr/product/25784/11/cover/k392736715_1.jpg,"저자는 유기견 눈빛에서 자신이 보인다고 했다. 여덟 살, 엄마에게 버려진 때부터. 저자의 어린 시절부터, 동물의 슬픔에 감응하고, 동물변호사를 설립하고, 자신을 철장에 가두는 데까지 이야기를 일기 문학 형식으로 담담하게 풀어놓은 책이다.",4
1504,9788946069855,"청소년을 위한 매체 이야기 =유튜브, SNS, 게임, 영화 등 Z세대의 미디어 길라잡이 /Introduction to media for teens ",한국방송학회 엮음 ;최진호 지음,한울(한울엠플러스),https://image.aladin.co.kr/product/26411/57/cover/8946069856_1.jpg,"한국방송학회가 기획하고, 7인의 미디어 커뮤니케이션 학자들이 집필한 이 책은 매체의 개념과 특성·기능·효과뿐 아니라 뉴스 프레임, 게임의 함정, 유튜브 알고리즘, SNS상의 관계, 매체 윤리 등 다양한 시각으로 비판적 사고 능력을 향상시킬 수 있는 내용을 균형감 있게 담아냈다.",76
1505,9791190635080,유르스나르의 구두 :스가 아쓰코 에세이 ,지은이: 스가 아쓰코 ;옮긴이: 송태욱,한뼘책방,https://image.aladin.co.kr/product/25754/80/cover/k522736108_1.jpg,"61세에 낸 첫 책 『밀라노, 안개의 풍경』으로 여류문학상과 고단샤 에세이상을 동시에 수상하며  데뷔한 스가 아쓰코. 뒤늦게 에세이스트의 길을 걷기 시작해 활발히 글을 썼으나 69세에 세상을 떠나고 만다. 『유르스나르의 구두』는 스가 아쓰코가 생전에 펴낸 마지막 에세이다.",49
1506,9791187756224,분홍의 시작 :남길순 시집 ,지은이: 남길순,함께하는출판그룹파란,https://bookthumb-phinf.pstatic.net/cover/139/875/13987588.jpg?type=m1&udate=20180901,"남길순의 첫 시집에는 ‘분홍’의 감각이 도처에 널려 있다. 그러나 남길순 시의 ‘분홍’은 소녀취미는 물론 산뜻하고 당당한 분홍과도 거리가 멀다. 그것은 생명의 절정을 품은 말랑말랑함과 당도, 물기를 지닌 잘 익은 복숭아의 분홍빛을 연상시키면서 동시에 그런 생명에 필연적으로 꼬이는 벌레마저 한 몸에 품은 분홍에 가깝다.",3
1507,9788988164099,滿月紅顔 :經洲 柳赫仁 遺稿集 ,엮은이: 유석춘,전통과현대사,http://image.aladin.co.kr/product/24/71/cover/6000014968_1.gif,"책은  '경제적 성공'에 관한 논의를 넘어, 태국, 베트남, 싱가포르 등 동남아시아 6개국 화인사회의 변화와 다양성을 역사적 맥락에서 자세히 그려낸다. 또한 토착사회로의 '동화'와 '중국적인 정체성'간의 갈등을 겪고 있는 오늘날 화인사회를 객관적으로 분석하고 경제의 중심에 있는 화인사회의 미래에 대해 전망을 제시한다.",34
1508,9788989324003,양반 동네 소동기 =A riot in the Yangban village ,尹學準 著,효리,http://image.aladin.co.kr/product/25/50/cover/8983324007_1.gif,자신들이 양반의 후예라는 특권의식에 사로잡혀 살고 있는 우리 국민 대다수에게 재출간된 이 책은 매우 불편한 느낌을 줄 수 있다. 하지만 저자가 태어나고 자란 경북 안동을 대상으로 양반문화를 비판적으로 리뷰한 내용들은 새천년을 맞은 지금까지 우리 사회에 상당한 영향력을 미치고 있는 양반문화와 유교 이데올로기를 이해하는데 도움을 준다. -문화일보,35
1509,9791196137045,어떤 새는 모음으로만 운다 :차주일 시집 ,지은이: 차주일,포지션,https://bookthumb-phinf.pstatic.net/cover/129/835/12983519.jpg?type=m1&udate=20180104,차주일이라는 사람은 시에 있어서만큼은 매우 진지하다. 요즘 젊은이들의 말투로 하자면 ‘궁서체’다. 이때 그것은 ‘옛날 사람’을 대표하는 말이다. 어딘지 꼿꼿하고 타협이 없으며 모든 것을 진지하게 받아들이는 것이 우리 시대와 어울리지 않을 때 ‘궁서체’라고 한다. 또한 그는 “마음을 척추 삼은”... ,3
1510,9791158964245,우리는 점점 모르는 사이가 되어가고 :송영희 시집 ,지은이: 송영희,문학의전당,https://image.aladin.co.kr/product/19390/8/cover/k432635117_1.jpg,서울에서 태어나 1968년 「여원」 신인문학상을 수상하며 작품 활동을 시작한 송영희 시인의 시집. 눈앞의 거리에서 '감응(感應)'을 요청하는 진실한 신호로 언어를 써내려 온 송영희 시인의 이번 신작 시집은 담담한 어조로 우리에게 '이후'를 내미는 현재에 대해 이야기한다.,3
1511,9788936463052,문학의 귀환 :최원식 평론집 ,지은이: 최원식,창작과비평사,http://image.aladin.co.kr/product/28/90/cover/8936463055_1.gif,계간  주간으로 있는 최원식 교수가  이후 4년만에 출간한 평론집. 주로 90년대 후반에 씌어진 글들을 5부로 구획지어 묶었다. 저자는 '문'학과 문'학'을 넘어 '문학'으로! 라는 캐치프레이즈를 내걸고 있다.,72
1512,9788965112792,八八의 노래 :미수기념최승범단시집 ,저자: 최승범,시간의물레,https://image.aladin.co.kr/product/19339/99/cover/8965112796_1.jpg,고하 최승범 시백의 미수 기념 시집. 시조는 최승범 시인이 일생을 두고 짓고 연구한 시가로 시조시의 정수인 단시조(평시조) 형식을 취하고 있다. 八八에 읊는 노래들은 인간의 원초적인 욕망인 먹거리를 새삼스럽게 노래하고 일생동안 고락을 같이 한 안해를 끔직이 생각하는 상념이 녹아 있다.,3
1513,9791189092139,윤리와 무한 :필립 네모와의 대화 ,지은이: 에마뉘엘 레비나스 ;옮김·해설: 김동규,100,https://image.aladin.co.kr/product/25712/68/cover/k612736775_1.jpg,"에라스무스 총서 4권. 프랑스 공영 라디오 방송에서 에마뉘엘 레비나스와 필립 네모가 나눈 대담을 엮은 것이다. 네모가 레비나스 철학의 주요 주제를 레비나스에게 묻고, 레비나스가 간략하게 풀어 설명한다.",8
1514,9791161754680,의사결정을 위한 데이터 과학 :데이터 과학 총론 ,"Luiz Paulo Fávero,크라스랩 옮김",에이콘,https://image.aladin.co.kr/product/25565/67/cover/k762735387_1.jpg,"명목 및 서열 변수의 정의에서 출발해 최적화와 선형계획법에 이르기까지 데이터 과학에 관한 거의 모든 부분을 설명한다. 모든 설명은 예제를 제공하고, 예제는 이론을 설명한 다음 SPSS나 Stata, 엑셀 프로그램의 해 찾기 등을 사용해 해결책을 친절히 설명한다.",102
1515,9791187756231,눈송이에 방을 들였다 :한영수 시집 ,지은이: 한영수,함께하는출판그룹파란,http://image.aladin.co.kr/product/16608/53/cover/k712534168_1.jpg,2010년 [서정시학]을 통해 등단한 한영수 시인의 세 번째 시집.,3
1516,9791189298043,잠을 굽다 :지하선 시집 ,지은이: 지하선,미네르바,https://image.aladin.co.kr/product/16477/75/cover/k322533858_1.jpg,"지하선 시집 [잠을 굽다]. 《괭이잠》, 《초저녁잠》, 《시위잠》, 《쇠별꽃 꿈 밖으로》, 《그랜드캐니언, 잠을 읽다》등 다양한 작품을 감상할 수 있습니다.",3
1517,9788937489105,불온한 검은 피 :허연 시집 ,지은이: 허연,민음사,http://image.aladin.co.kr/product/4036/86/cover/8937489104_1.jpg,"허연의 첫 시집 &lt;불온한 검은 피&gt;가 출간 20년 만에 부활했다. '누구와도 닮지 않았고, 그 어떤 유(類)도 아니며, 자기만의 공화국'을 가지고 '자기부정을 통한 자기긍정의 정공법으로 '무의미의 의미'라는 두려우리만치 아름다운 미학을 창출해 냈다.'라는 극찬을 받은 시집이다.",3
1518,9788960212497,나무 무덤 :서정화 시조집 ,지은이: 서정화,천년의시작,http://image.aladin.co.kr/product/7110/10/cover/8960212490_1.jpg,"천년의시조 1002권. 2014년, 배우식의 시조집 &lt;인삼반가사유상&gt;에 이어 두 번째로 출간되는 시조집이다. '무덤'이라는 말을 시집 제목에 넣기란 쉽지 않다. '죽음, 끝, 구렁텅이' 등을 연상시키는 무덤이 이 시집에는 아주 빈번하게 그리고 친밀하게까지 보인다. 과연 시인이 무덤을 통해 보여주고자 하는 것은 무엇일까.",3
1519,9788960213982,풀밭의 철학 :최동희 시집 ,지은이: 최동희,천년의시작,https://image.aladin.co.kr/product/17458/14/cover/8960213985_1.jpg,천년의시 89권. 최동희 시인의 첫 시집. 1996년 「시대문학」으로 등단하여 작품 활동을 시작한 시인의 첫 시집은 결핍으로부터 생겨난 상흔의 기록이자 생활에서 터득한 지혜와 생존법을 서정적 문체로 풀어낸 한 권의 일기장이기도 하다.,3
1520,9788998047184,나는 내가 낳는다 ,지은이: 유안진,시인생각,https://bookthumb-phinf.pstatic.net/cover/071/465/07146534.jpg?type=m1&udate=20150720,"오래도록 우리의 가슴에 남는 명시를 만나다!오랜 역사와 더불어 꽃피워온 얼ㆍ말ㆍ글의 아름다움을 만나볼 수 있도록 구성된 「한국대표 명시선 100」 유안진 시인의 시집 『나는 내가 낳는다』. 정지용문학상, 소월문학상특별상, 한국시인협회상, 윤동주문학상 등을 수상하며 자신만의 작품세계를 펼쳐온... ",3
1521,9788990369321,한국의 정치사회적 저항담론과 민주주의 동학 =The politico-social opposite discourses and dynamics of democracy in Korea ,조희연 편,함께읽는책,http://image.aladin.co.kr/product/51/97/cover/8990369320_1.jpg,"이 책은 민주주의와 파시즘, 자본주의와 현실사회주의와 미국/북한, 변혁주체와 전선운동과 진보정치세력화 등 한국의 정치사회적 저항담론의 주요 쟁점에 대해, 운동진영 내부의 논쟁 구성과 그 역사적 궤적, 그리고 효과를 민주주의와의 연관성을 중심으로 분석하고 있다.",51
1522,9791197173929,퇴계 편지 백 편 :퇴서백선(退書百選) ,이황 지음 ;박상수 번역,수류화개,https://image.aladin.co.kr/product/25854/14/cover/k592737360_1.jpg,"&lt;퇴서백선&gt;은 퇴계의 숙부 송재 이우의 후손인 소은 이정로가 정조의 명으로 편집한 &lt;주서백선&gt;의 선례에 따라 1,000여 통의 퇴계 편지에서 100편을 골라 6권 3책으로 편집하였고, 이를 소은의 손자인 이종무李鍾武가 이후익에게 발문을 받아 간행하였다.",57
1523,9788946072572,법정에 선 페미니스트 :페미니스트 법 이론 ,"지음: 낸시 레빗,소은영",한울엠플러스,https://image.aladin.co.kr/product/25694/19/cover/8946072571_1.jpg,"미국 페미니즘 법 이론의 흐름과, 과거부터 지금까지 법제도의 변천 및 법원 판결의 내용을 소개하는 것은 물론이고, 입법안과 개정안을 추적하고, 문학 작품·기사를 인용하며, 가상 사례를 통해 이해를 돕기도 한다.",79
1524,9788982811920,"당신의 마당 :詩로 다시 태어나는 월하 김달진의 고향, 진해 ",김종길 외 지음 ;김달진문학제 운영위원회 엮음,문학동네,http://image.aladin.co.kr/product/19/54/cover/8982811923_1.gif,"은 박태일 이하석 송재학씨 등 김달진문학상 수상자들을 비롯해 시인 51명이 월하와 그의 고향을 읊은 시 모음이다. 이 책은 선배와 후배의 만남, 지역과 문학의 만남을 증거한 아름다운 기록이다.",3
1525,9788958593461,어느 마루턱까지 :유승우 시집 ,지은이: 유승우,시문학사,https://bookthumb-phinf.pstatic.net/cover/128/785/12878511.jpg?type=m1&udate=20180413,유승우의 시집 『어느 마루턱까지』. 이 시집은 유승우의 시 작품을 엮은 책이다. 크게 4부로 나뉘어 있으며 책에 담긴 주옥같은 시편을 통해 독자를 시인의 시 세계로 안내한다.,3
1526,9788996752769,한밤에 쓴 위문편지 :아픈 이웃에게 ,이승하 지음,KM(케이엠),https://bookthumb-phinf.pstatic.net/cover/134/834/13483410.jpg?type=m1&udate=20180404,"세상의 모든 아픈 이웃들에게 보내는 시인 이승하 교수의 따뜻한 위문편지이다. 육체와 정신의 상처와 아픔으로 힘든 귀하에게 드리는 용기와 희망의 선물이다. 시인이자 소설가, 평론가이자 대학교수로 활동하고 있는 작가 이승하의 진심을 다해 정성껏 쓴 자전적 에세이이다.",4
1527,9788996752776,나무 앞에서의 기도 :이승하 시집 ,지은이: 이승하,KM(케이엠),https://image.aladin.co.kr/product/15539/18/cover/8996752770_1.jpg,케이엠(KM) 시인선 10권. 이승하 시집. 지난 10년 동안 시인은 두세 달에 한 번은 반드시 요양병원에 갔다고 한다. 서너 달에 한 번은 교도소나 구치소에 갔다고 한다. 인간에 대한 연민의 정을 담아 &lt;감시와 처벌의 나날&gt;을 냈고 이번에는 생태환경에 대한 시를 모아서 시집을 묶어냈다.,3
1528,9788954656344,봄이고 첨이고 덤입니다 :정끝별 시집 ,지은이: 정끝별,문학동네,https://image.aladin.co.kr/product/19473/55/cover/895465634x_1.jpg,"문학동네 시인선 123권. 정끝별 시집. 1부 '먼눈이 멀어진 눈빛을 노래한다', 2부 '여럿이 부르는 신음을 우리는 화음이라 한다', 3부 '젠더의 새벽은 아직 춥다', 4부 '밥알과 알밥을 찾아다녔다'로 구성되었다.",3
1529,9791157769551,노을빛 치마에 쓴 시 :한시와 함께 읽는 우리나라 역사 ,고승주 편역,책과나무,https://image.aladin.co.kr/product/25677/10/cover/k882735243_1.jpg,"2019년 중국 한시 120수를 발췌하여 &lt;꽃인 듯 꽃이 아닌 듯&gt;을 엮은 저자가, 이번에는 한국인들이 좋아하는 대표 한시를 엮었다. 꾀꼬리를 보고 노래한 유리왕의 「황조가」, 이별을 노래한 정지상의 「대동강」 등 당대 역사에 한 획을 그은 학자와 문장가들의 걸출한 한시들이 담겨 있다.",57
1530,9791186668320,나는 아직 괜찮습니다 :한화숙 시집 ,지은이: 한화숙,포엠포엠,https://image.aladin.co.kr/product/25697/6/cover/k462736566_1.jpg,포엠포엠 시인선 30권. 한화숙의 첫 시집. 우선 시집에서 감지되는 점은 아버지에 대한 사랑과 연민으로 따뜻한 시선이 함축되어 있다는 것이다. 대상을 파고드는 깊은 속에는 섬세하면서도 한없이 정갈한 언어들이다.,3
1531,9788982121500,미당 서정주 시선집 ,지은이: 서정주 ;엮은이: 김화영,시와시학사,http://image.aladin.co.kr/product/30/62/cover/8982121501_1.gif,미당 서정주의 64년 詩作생활을 통해서 남긴 900편의 작품 중에서 95편의 시를 선별하여 시대순으로 배열하였다. &lt;내 마음 우리님의 고운 눈섭을 즈문밤의 꿈으로 맑게 씻어서 하늘에다 옴기어 심어 놨더니 동지 섣달 나르는 매서운 새가 그걸 알고 시늉하며 비끼어 가네&gt;-,3
1532,9788957331842,"유교 가부장제와 가족, 가산 ",박미해 지음,아카넷,http://image.aladin.co.kr/product/764/13/cover/8957331840_1.jpg,"조선의 가부장제는 어떻게 완성되었을까?16세기 전후 한국의 가부장제를 21세기의 공간에서 살펴보는 연구서 『유교 가부장제와 가족, 가산』. 16세기 전후 조선에서 가부장제가 확립되어 가는 과정을 고문서 원전을 통해 살펴본다. 원전 사료들에서 찾아낸 유교의 통치이념이 실생활에서 어떻게 구현되는지를... ",89
1533,9788970759098,내가 나에게 :이태수 시집 ,지은이: 이태수,문학세계사,https://image.aladin.co.kr/product/18987/57/cover/8970759093_1.jpg,"문단 등단 45년차의 중진시인 이태수의 열다섯 번째 시집. 시집 &lt;거울이 나를 본다&gt;에 이어 1년 만에 나온 이 시집에는 '옛 우물', '물, 또는 내려가기', '별, 또는 올라가기', '눈이 내릴 때', '초봄의 화엄' 등 67편이 실려 있다.",3
1534,9788975601064,PC 튜닝 & 홈시어티 만들기 :무작정 따라하기 ,"양재봉,정지오",길벗,https://bookthumb-phinf.pstatic.net/cover/001/118/00111806.jpg?type=m1&udate=20160925,"PC 튜닝을 시작하고 싶지만 기본적인 지식이나 기술 등을 몰라 어디서부터 시작해야 할지 망설이고 있는 초보자들을 위한 PC튜닝 입문서다. 또한, PC 튜닝뿐만 아니라 홈시어터 PC에 대한 내용도 다루었다.",132
1535,9788964620663,Small urban manufacturers :artisans of our times that Chun Soon-ok has ever met ,"Chun Soon-ok, Kwon Eun-jeong ;translated by Chun Soon-ok",뿌리와이파리,https://image.aladin.co.kr/product/8226/27/cover/8964620666_1.jpg,"의류봉제, 수제화, 가방, 액세서리, 주얼리 등 각 분야를 대표하는 장인들을 인터뷰하고 책으로 묶어 냈다. 이 아홉 명의 장인들은 그가 유학을 마치고 한국으로 돌아와 창신동을 중심으로 활동한 11년과 국회로 들어온 3년 동안, 직접 만나서 그 진가를 발견한 이들이다.",83
1536,9791197064425,"다시, 봄 :유병연 시집 ",지은이: 유병연,삼사재,https://bookthumb-phinf.pstatic.net/cover/175/490/17549088.jpg?type=m1&udate=20201211,"자연을 시의 소재 중심에 놓고 꾸준하게 시작 활동을 하면서 자연을 벗삼아 시를 써왔던 청록파 시인을 가슴 깊이 동경하는 유병연 시인의 자연에 대한 따뜻한 시선이 한 편 한 편의 시로 빚어졌다. 유병연 시인의 『다시, 봄』은 꾸밈없고 진솔한 시어로 자연의 아름다움을 노래한다.",3
1537,9791197195310,북알프스 백패킹 ,지은이: 박춘영 ;나유나,[덴버],https://bookthumb-phinf.pstatic.net/cover/176/936/17693639.jpg?type=m1&udate=20201224,"2019년 북알프스를 다녀와서 4일간의 기록을 책으로 엮었습니다.  여행을 준비하면서 제대로 된 정보를 얻을 수 없다는 점이 참 불편하고 안타까웠습니다. &#8203; 이 책은 불필요한 정보는 최대한 줄이고, 때로는 필요한 정보도 과감히 줄였습니다. 간단한 기본 정보만 제공해 대략적인 방향만 짚어주고... ",133
1538,9791197249006,(알파(R과 python)를 활용한) 인공지능 챗봇 14 ,"황윤찬,이현 지음",Storyjoa,https://image.aladin.co.kr/product/25967/32/cover/k862737126_1.jpg,"빅데이터 기획부터 데이터 수집, 데이터 분석, 데이터 정제, 데이터 시각화, 데이터 해석에 이르기까지의 전 과정을 빅데이터 분석 무료 프로그램인 R 과 Python을 활용하여 쉽고 빠르게 분석할 수 있는 방법을 소개 한다.",106
1539,9788937407024,공놀이하는 달마 :최동호 시집 ,지은이: 최동호,민음사,http://image.aladin.co.kr/product/34/51/cover/8937407027_1.gif,고려대 교수(국문학) 최동호 선생이  이후 7년 만에 내는 시집이다. 이번 시집은 정신의 평정과 고요에 이르는 길을 보여준다.,3
1540,9788932023007,내가 원하는 천사 :허연 시집 ,지은이: 허연,문학과지성사,http://image.aladin.co.kr/product/1686/34/cover/893202300x_1.jpg,"1991년 「현대시세계」 신인상으로 등단한 허연의 세번째 시집. 시인은 삶의 무기력과 폐허, 몰락을 응시하며 천국은 없다고 말하면서도, 실망과 절망이라는 희망의 흠집을 통해 이를 기억하고 증언해줄 자들이 있다고 기대한다.",3
1541,9788957492079,정지용 시의 리듬 양상 ,정민나 지음,청동거울,https://image.aladin.co.kr/product/16877/67/cover/8957492070_1.jpg,한국문학연구총서 3권. 정지용 시가 지닌 리듬적 특성을 본격적으로 탐구한 연구서. 정지용 초기 시에서 후기 시에 이르기까지 그의 창작의 기저로 꾸준히 작동된 현대시의 리듬적 특성을 밝히고 있다.,72
1542,9791189205362,"바다, 내 언어들의 희망 또는 그 고통스러운 조건 :오태환 시집 ",지은이: 오태환,황금알,https://image.aladin.co.kr/product/19623/79/cover/k442635526_1.jpg,"황금알 시인선 196권. 오태환 시집. 오태환의 이번 시집은 역사의 허위와 야만, 존재의 공성空性, 인간의 기원과 실종을 동시에 탐색하는 종교적 성찰이자 고해다. 숭고와 희생, 존엄과 순수가 사라진 인류 문명사에 대한 뼈아픈 탄식이다.",3
1543,9791161754666,마이크로카피 :UX 디자이너의 글쓰기 ,킨너렛 이프라 지음 ;변상희 옮김,에이콘,https://image.aladin.co.kr/product/25629/18/cover/k422735211_1.jpg,"디지털 인터페이스를 위한 스마트하고 유용한 마이크로카피를 작성하는 데 필요한 지식과 도구를 제공한다. 여기에는 실제 사이트와 앱에서 제공되는 수십 개의 스크린샷이 포함돼 있다. 2판에서는 18장, ‘마이크로카피와 접근성’이 추가됐으며, 전체적인 스크린샷을 업데이트했다.",1
1544,9791196969684,생각보다 잘 살고 있어 :이 시대 2인 가족의 명랑한 풍속화 ,박산호 지음,지와인,https://image.aladin.co.kr/product/25661/90/cover/k002735241_1.jpg,꾸준한 글쓰기와 따뜻한 시선으로 SNS 독자들을 사로잡은 박산호 작가가 그린 이 시대 2인 가족의 이야기. 완벽하지 않은 여자와 아직 자라고 있는 여자 두 사람이 엄마와 딸이라는 이름을 넘어 사람 대 사람으로 만나는 이야기가 담겨 있다.,4
1545,9791170431497,"심리학의 쓸모 :일, 사랑, 관계에 서툰 당신을 위한 아주 특별한 심리학 수업! ",이경민 지음,믹스커피,https://image.aladin.co.kr/product/25688/0/cover/k662735154_1.jpg,크고 작은 마음의 혼란과 진통을 안고 사는 현대인에게 필요한 심리이론을 체계적이면서도 쉽고 재미있게 풀어낸 심리학 입문서다.,40
1546,9791160404449,해방촌의 채식주의자 :전범선 산문집 ,지은이: 전범선,한겨레출판,https://image.aladin.co.kr/product/25708/10/cover/k112736770_1.jpg,"밴드 '양반들' 보컬이자 성대 앞 사회과학서점 '풀무질' 대표인 전범선의 첫 산문집. 2019년 초, 전범선은 폐업 위기를 맞은 33년 된 책방 '풀무질'을 인수해 화제를 모았다. 그는 왜 빚더미에 쌓인, 쓰러져가는 책방을 이어받기를 결심한 걸까.",4
1547,9788965964155,중국 문화를 읽는 6가지 키워드 ,리어우판 지음 ;신의연 옮김,흐름출판,https://image.aladin.co.kr/product/25745/39/cover/8965964156_1.jpg,우리는 중국에 대해 얼마만큼 알고 있을까? 하버드대학 교수로서 명성을 떨친 세계적인 석학 리어우판 교수가 중국이라는 나라의 문화를 형성한 근본적 원리에 대해 눈부신 통찰을 보여준다.,27
1548,9791161754789,쿠버네티스 오퍼레이터 :쿠버네티스에서 애플리케이션 추상화를 위한 도구 ,"제이슨 도비스,임성일 옮김",에이콘,https://image.aladin.co.kr/product/25515/56/cover/k522633220_1.jpg,"쿠버네티스 오퍼레이터는 쿠버네티스에서 애플리케이션을 패키징, 배포, 관리하는 방법이다. 이 책에서는 구체적인 예시를 통해 오퍼레이터가 작동하는 방식과 오퍼레이터 프레임워크 및 SDK를 사용해 구축하는 방법을 보여준다.",102
1549,9788990853547,희생,도주희 지음,드림박스,https://bookthumb-phinf.pstatic.net/cover/001/416/00141645.jpg?type=m1&udate=20130629,&quot;내게 다가온 그 발걸음 한 걸음만 뒤로 물러나 주십시오. 가까워지는 그 발걸음 한 걸음만 뒤로 물러나 주십시오. 가까워지는 그 발걸음에 목을 놓으며 울 수 밖에 없는 나를 불쌍히 여기시어 다가오셨던 발걸음을 다시 돌려주십시오.&quot;저자 특유의 서정적 문체로 슬픈 로맨스를 펼쳐냈다.,30
1550,9788957337066,"존 스튜어트 밀의 윤리학 논고 :「벤담」, 「콜리지」, 「'자연을 따르라'는 윤리」 ",지은이: 존 스튜어트 밀 ;옮긴이: 박상혁,아카넷,https://image.aladin.co.kr/product/25696/35/cover/8957337067_1.jpg,"존 스튜어트 밀의 「벤담」, 「콜리지」, 「'자연을 따르라'는 윤리」를 엮어 번역한 책이다. 역자가 이들을 엮어 번역한 이유는, 이 에세이들이 공리주의의 선구자인 제러미 벤담의 공리주의와 공리주의의 개혁자인 밀의 공리주의의 차이를 잘 보여줌으로써, 밀의 공리주의의 특징을 잘 파악할 수 있도록 해주기 때문이다.",8
