id,isbn,title,author,publisher,image_url,content,genre_detail_dict_id
6725,9791161570280,깔때기 포트 :김이수 장편소설 ,지은이: 김이수,나무옆의자,http://image.aladin.co.kr/product/13545/67/cover/k932532919_1.jpg,2015년 악의 심연과 폭력의 밑바닥을 섬뜩하게 그린 첫 장편소설 &lt;가토의 검&gt;으로 만만치 않은 필력을 보여주었던 작가 김이수의 두 번째 장편소설. 인천의 '깔때기 포트'라는 재개발 지구를 중심으로 냉혹한 세상에서 폼 나게 살고 싶은 삼류 인생들의 꿈과 현실을 누아르풍으로 그렸다.,28
6726,9791130812595,(2018) 오늘의 좋은 시 ,"이은봉,맹문재 엮음",푸른사상,http://image.aladin.co.kr/product/13501/1/cover/k402532506_1.jpg,현대시를 전공한 교수들이 2017년 한 해 동안 발표된 시 작품 가운데 좋은 시를 선정해서 엮은 &lt;2018 오늘의 좋은 시&gt;. 엮은이들은 시의 다양성을 존중하는 가운데 작품의 완성도와 독자와의 소통에 중점을 두어 105편의 시를 선정하고 작품마다 독자의 감상과 이해에 도움이 될 수 있는 해설을 붙였다.,3
6727,9791130812618,모과를 선물로 받는다면 ,"지은이: 김명렬,정재서",푸른사상,http://image.aladin.co.kr/product/13420/17/cover/k592532401_1.jpg,"숙맥 11집으로, 남풍회의 산문집이다. 서울대학교 출신 노교수들로 이루어진 이 모임에서는 해마다 심오한 사색과 연륜에서 우러나온 글들을 모아 수필집을 발간하고 있다.",4
6728,9791130812571,(정본) 탁류 :채만식 장편소설 ,지은이: 채만식,푸른사상,http://image.aladin.co.kr/product/13407/21/cover/k762532309_1.jpg,"오늘의 한국문학 11권. 채만식 장편소설. '가족'이라는 식민지 시대의 소집단의 세대 간의 이해와 갈등을 다룬 것으로 화폐의 폭력성에 의해 마모되어가는 인간성과 인격, 그들의 삶이 함께 부침하는 30년대의 초상을 보여준다.",28
6729,9791159253195,"카프카, 권력과 싸우다 ",박홍규 지음,푸른들녘,https://bookthumb-phinf.pstatic.net/cover/133/782/13378263.jpg?type=m1&udate=20180712,"박홍규의 호모 크리티쿠스 5권. 카프카는 새롭게 사유될 필요가 있다. 이 책은 카프카의 일대기로 돌아가 그의 반권위주의적 행보를 되짚어보고, 그의 작품을 정치사회적 연관선상에서 재발견해내는 데 있다.",168
6730,9788925563206,아름다운 흉기 :히가시노 게이고 장편소설 ,지은이: 히가시노 게이고 ;옮긴이: 민경욱,RHK(알에이치코리아),http://image.aladin.co.kr/product/13866/91/cover/8925563207_1.jpg,1등이 아니면 살아남을 수 없는 스포츠 세계에서 금메달리스트가 되기 위해 인간의 존엄성마저 외면한 선수들의 뒤틀린 욕망을 그린 히가시노 게이고의 스릴러 소설. 올림픽 시즌이면 논란이 되는 '도핑'을 소재 삼아 인간의 욕망을 심도 깊이 다룬 작품이다.,94
6731,9791196158743,"천치(天痴), 시간을 잃은 :손용상 韻文集 ",지은이: 손용상,도훈,http://image.aladin.co.kr/product/14005/69/cover/k212532832_1.jpg,공감 시인선. 1973년에 「조선일보」 신춘문예에 단편 '방생'으로 등단한 소설가 손용상의 두 번째 시집이다. 2018년 현재 미국 달라스에 거주하고 있으며 그동안 쓴 시 와 시조를 묶어 발표하게 되었다. 어머니와 고국에 대한 그리움이 간절하게 물든 작품들이다.,3
6732,9788925563343,드롭 :위기의 남자 ,마이클 코넬리 지음 ;한정아 옮김,RHK(알에이치코리아),https://bookthumb-phinf.pstatic.net/cover/134/155/13415593.jpg?type=m1&udate=20180329,"마이클 코넬리의 '형사 해리 보슈 시리즈' 열다섯 번째 작품. 22년 전 살인사건에서 발견된 의문의 DNA, 그리고 시의원 아들의 알 수 없는 죽음. 동시에 두 사건을 좇는 형사 해리 보슈의 대활약이 펼쳐진다.",94
6733,9791125444282,"하루가 끝나면, 따뜻하게 안아주세요 :작지만 확실한 행복의 순간들 ",지은이: 박새봄,시대인,http://image.aladin.co.kr/product/13670/75/cover/k162532414_1.jpg,"소소한 행복의 순간들을 사랑스럽고 따뜻한 그림으로 담아낸 그림 에세이. 귀엽고 통통한 얼굴의 색연필 초상화로 소문난 일러스트 작가 봄사무소의 그림 속에는 찡그린 사람도, 화내는 사람도 없다. 그저 서로를 향해 미소 짓는 얼굴이나 아주 작은 것 하나에도 흡족하게 웃고 있는 사람들이 있을 뿐이다.",6
6734,9791158160777,"베개는 필요 없어, 네가 있으니까 ",글·그림: 봉현,달,http://image.aladin.co.kr/product/13839/25/cover/k982532328_1.jpg,저자 봉현은 글을 쓰고 그림을 그린다. 자신의 감정을 여러 형태로 표현할 줄 아는 봉현은 자신이 사랑을 하고 여행을 할 때에 가장 빛난다고 말한다. 그리고 그녀의 끊임없는 사랑을 이 책에 기록했다.,4
6735,9791187292951,길 위에서 샤우팅! 노뮤직 노트래블 =차가운 길바닥 위에서 가장 뜨거웠던 날들의 기록 /No music no travel ,에이칸 지음,북로그컴퍼니,http://image.aladin.co.kr/product/13791/86/cover/k272532020_1.jpg,"우여곡절 끝에 빚을 정리하던 날, 에이칸은 “길 위에서 음악을 만들고 연주하며 여행하는 히피로 살아보겠어!”라고 선언한다. 그것도 이미 40만 km나 달린 중고차를 타고 말이다. 이 무모한 여행에 대학 밴드 동아리 후배 빽껸이 동참해 좌충우돌 ‘시트콤’ 같은 여정이 시작되는데…. 이건 100% 리얼! 이제부터 실사판 ‘비긴 어게인’이 펼쳐진다.",124
6736,9791187292913,겨울 가면 봄이 오듯 사랑은 또 온다 :노희경이 전하는 사랑과 희망의 언어 ,글: 노희경 ;사진·캘리그라피: 배정애,북로그컴퍼니,http://image.aladin.co.kr/product/13685/22/cover/k422532619_1.jpg,"인간의 진성성을 들여다보고 사랑의 가치를 어루만지는 작가 노희경의 명작 세 권이 '한정판 MINI 에디션'으로 출간되었다. &lt;지금 사랑하지 않는 자, 모두 유죄&gt;, &lt;세상에서 가장 아름다운 이별&gt;, &lt;겨울 가면 봄이 오듯 사랑은 또 온다&gt; 3종으로 구성되었다.",54
6737,9788967220235,케임브리지 세계사 콘사이스 :글로벌 시대 새로운 세계사를 위하여 ,메리 위스너 행크스 지음 ;류형식 옮김,소와당,http://image.aladin.co.kr/product/13657/90/cover/8967220235_1.jpg,"케임브리지 대학교에서는 전 세계 200여 명의 선두적인 학자들이 참여하는 방대한 세계사 시리즈를 기획했다. 이 책은 그 시리즈의 개요로서, 시리즈 총괄 편집자가 저술한 개론이다. 그래서 제목에 '콘사이스'라는 말이 붙었다.",90
6738,9788931010787,1984 ,조지 오웰 지음 ;김병익 옮김,문예출판사,http://image.aladin.co.kr/product/13657/80/cover/8931010788_1.jpg,'에디터스 컬렉션'은 시의성이 있는 책 그리고 오래 사랑받은 고전 작품들을 독자에게 소개한다는 의미로 기획되었다. 시리즈 1권으로 출간되는 &lt;1984&gt;는 터키 일러스트레이터 Utku Lomlu와 함께 표지를 작업해 보다 현대적인 감각을 살렸다.,9
6739,9791158135133,망각에 관한 일반론 ,주제 에두아르두 아구아루사 지음 ;이지민 옮김,구민사,http://image.aladin.co.kr/product/13224/17/cover/k882532698_1.jpg,"주제 에두아르두 아구아루사 소설. 2016년 맨부커 인터내셔널 후보작으로 한강의 &lt;채식주의자&gt;와 마지막까지 경합하다 아쉽게 수상을 하진 못했지만, 2017년 국제 더블린 문학상을 수상하며 다시금 주목 받은 작품이다.",86
6740,9791196063573,동행 :시화집 ,글: 김동식 ;그림: 이명원,부카,http://image.aladin.co.kr/product/13401/55/cover/k312532205_1.jpg,"오랜 지기인 시인과 화가 두 작가가 서로의 작품에 기대어 시를 쓰고 그림을 그렸다. 의기투합하여 출판한 시화집. 시와 그림, 그림과 시의 아름답고 황홀한 동행을 느낄 수 있을 것이다.",3
6741,9791160072037,심리죄 :레이미 장편소설 ,지은이: 레이미 ;옮긴이: 박소정,한즈미디어,http://image.aladin.co.kr/product/12866/67/cover/k752532025_2.jpg,"희대의 연쇄 살인마들의 범죄 수법을 모방해 살인을 저지르는 범인. 그의 마음이 뒤틀린 것일까, 아니면 사회를 증오하는 것일까? 현직 경찰학교 교수 레이미가 저술한 범죄심리 스릴러. 중국 인기 웹드라마 및 영화 원작소설이다.",12
6742,9791188990009,(정본) 발해고 ,유득공 지음 ;김종복 옮김,책과함께,http://image.aladin.co.kr/product/13911/4/cover/k262532423_1.jpg,"&lt;발해고&gt; 4권본은 초고본의 학문적 한계를 극복하여 &lt;발해고&gt;를 근대 역사학의 수준으로 올려놓았다는 평가를 받는 고전이지만, 그동안 전문성을 갖춘 제대로 된 수정본 번역은 이뤄지지 않았다. 김종복 교수는 10년에 걸쳐 4권본 연구에 매진하여, 원전의 의미를 충실히 옮겨낸 번역본을 내놓았다.",42
6743,9788925563626,풀꽃들의 조용한 맹세 :미야모토 테루 장편소설 ,지은이: 미야모토 테루 ;옮긴이: 송태욱,RHK(알에이치코리아),http://image.aladin.co.kr/product/14229/96/cover/k492532633_1.jpg,"아쿠타가와상 수상 작가, 현대 일본 서정의 진수, 미야모토 테루의 장편소설. 일본 현지 신문에서 호평 속에 연재된 후 바로 단행본으로 출간된 이 작품은 죽은 고모에게서 막대한 유산을 상속받게 된 남자가 감추어져 있던 비밀을 마주하게 되는 이야기를 담고 있다.",13
6744,9788990840431,산림청장의 귀촌 일기 ,조연환 지음,뜨란,http://image.aladin.co.kr/product/14465/44/cover/8990840430_1.jpg,"최말단 산림공무원으로 출발해서 산림청장으로 공직을 퇴임한 조연환 청장. 그가 충남 금산 양지녘으로 귀촌하여 생활한 13년간의 이야기를 책으로 펴냈다. 산촌에 땅을 마련하여 작은 집 '녹우정'을 짓고, 사계절을 온몸으로 누리는 풍경이 따뜻하게 묘사되어 있다.",4
6745,9791185057477,워디 가슈? :김영우가 걸은 예산 풍경 ,김영우 지음,기역,http://image.aladin.co.kr/product/14429/31/cover/k912532145_1.jpg,"오랫동안 환경운동을 한 김영우가 분례숲길과 예산의 311개 마을을 답사하며 쌓은 인연과 풍경에 관한 이야기를 담고 있다. 저자는 소설 &lt;분례기&gt;의 이야기가 펼쳐졌던 곳이자, 윤봉길의 고향, 예산을 두 발에 의지해 걸었다.",4
6746,9791104917011,하늘에 영광 :전은정 장편소설 ,지은이: 전은정,청어람,http://image.aladin.co.kr/product/14232/2/cover/k942532635_1.jpg,"전은정 장편소설. 평범한 제빵사 민영, 변태 살인마에게 쫓겨 죽기 직전 차원이동으로 다른 세상에 떨어진다. 말 그대로 하늘에서 뚝 떨어진 곳에서 민영은 판고를 만난다. 생에 처음 유유자적하고 마음 편한 삶을 살던 민영은 어느 날 자신처럼 하늘에서 떨어진 남자를 줍는다.",30
6747,9791127235635,네 생각이 나를 바래다주는 밤 :김가영 시집 ,저자: 김가영,부크크,http://image.aladin.co.kr/product/14462/23/cover/k062532343_1.jpg,3년 만에 펴내는 두 번째 시집.,3
6748,9791161570303,스페이스 보이 :박형근 장편소설 ,지은이: 박형근,나무옆의자,http://image.aladin.co.kr/product/13940/13/cover/k302532730_1.jpg,제14회 세계문학상 대상 수상작. 모든 것을 지우고 새로 시작하기 위해 우주로 떠난 남자의 기묘한 우주 체험과 귀환 후의 드라마틱한 인생을 그린 박형근의 장편소설. '날렵하고 감각적인 문장이 돋보인다' 등의 찬사를 받으며 222편의 경쟁작을 물리치고 수상의 영예를 안았다.,28
6749,9791188140244,세븐이브스 ,지은이: 닐 스티븐슨 ;송경아,북레시피,https://bookthumb-phinf.pstatic.net/cover/135/602/13560233.jpg?type=m1&udate=20180607,"오바마와 빌 게이츠가 휴가지에 가져간 책으로, 빌 게이츠가 권한 '반드시 읽어야 할 과학도서 11권' 중 유일한 소설이다. 달의 붕괴, 노아의 방주가 된 우주선, 살아남은 단 일곱 명의 인간, 그리고 5000년 후 시작되는 또 다른 인류 이야기이다.",74
6750,9791188140299,세븐이브스 ,지은이: 닐 스티븐슨 ;송경아,북레시피,https://image.aladin.co.kr/product/14944/45/cover/k342533860_1.jpg,"세븐이브스 시리즈 두번째 이야기. 다양한 분야에 걸친 학문과 교양을 씨줄과 날줄로 엮어 SF서사로 빚어내는 스티븐슨의 장기가 유감없이 발휘된 또 하나의 역작. 출간된 뒤 곧장 최고의 권위를 지닌 SF문학상인 '휴고 상' 후보에 올랐으며, 뛰어난 자유주의 SF문학에 수여하는 '프로메테우스 상'을 받기도 했다.",74
6751,9791127233563,타바코 페이퍼 =Tabaco paper ,저자: 위지수,Bookk(부크크),http://image.aladin.co.kr/product/13823/49/cover/k942532228_1.jpg,"열일곱일 때 썼던 글들이 대부분이고, 그 전후로 썼던 몇 편의 글들이 수록되어 있어요. 시가 깃든 낱장들이 이 책을 읽는 분들의 타바코 페이퍼가 되어 멀리 날아간다면 더 이상 여한이 없겠습니다.",3
6752,9791188140367,세븐이브스 ,지은이: 닐 스티븐슨 ;송경아,북레시피,https://bookthumb-phinf.pstatic.net/cover/139/769/13976907.jpg?type=m1&udate=20180829,"세븐이브스 시리즈 완결편. 다양한 분야에 걸친 학문과 교양을 씨줄과 날줄로 엮어 SF서사로 빚어내는 스티븐슨의 장기가 유감없이 발휘된 또 하나의 역작이다. 출간된 뒤 곧장 최고의 권위를 지닌 SF문학상인 '휴고 상' 후보에 올랐으며, 뛰어난 자유주의 SF문학에 수여하는 '프로메테우스 상'을 받기도 했다.",74
6753,9788934980872,식빵 고양이의 비밀 ,최봉수 글·그림,김영사,https://bookthumb-phinf.pstatic.net/cover/134/093/13409353.jpg?type=m1&udate=20180311,"토실토실한 뱃살, 의외로 작은 얼굴, 앙증맞은 발, 웃을 때 가늘어지는 눈. 몰랑몰랑한 매력으로 집사들의 마음을 온통 사로잡았으며, 카카오톡 이모티콘으로도 출시된 '뚱냥이' 캐릭터가 그림책 &lt;식빵 고양이의 비밀&gt;로 출간된다.",6
6754,9791187795575,(셀프트래블) 오키나와 =나 혼자 준비하는 두근두근 해외여행 /Okinawa ,"정꽃나래,정꽃보라 지음",상상출판,https://bookthumb-phinf.pstatic.net/cover/134/462/13446260.jpg?type=m1&udate=20180721,"셀프트래블 시리즈, 2018-2019 최신판 오키나와 가이드북.  ‘나 혼자 준비하는 두근두근 해외여행’이라는 콘셉트로 각 지역의 볼거리, 먹거리, 쇼핑, 숙소 등 스폿별 여행 정보를 친절하게 소개한다.",133
6755,9791162203545,프랑스 남자의 사랑 :에릭 오르세나 장편소설 ,지은이: 에릭 오르세나 ;옮긴이: 양영란,위즈덤하우스 미디어그룹,http://image.aladin.co.kr/product/14312/48/cover/k392532747_1.jpg,"공쿠르상 수상작가 에릭 오르세나의 장편소설. 2000년대에서 시작해 두 세기를 거슬러, 프랑스부터 카리브해 건너 쿠바까지 시간과 공간을 넘나들며 사랑과 인생의 의미를 탐색하는 독특한 소설이다.",10
6756,9791187928218,나르치스와 골드문트 ,헤르만 헤세 지음 ;배수아 옮김,그책,https://bookthumb-phinf.pstatic.net/cover/135/529/13552950.jpg?type=m1&udate=20180619,"헤르만 헤세 컬렉션. 소설가 배수아의 새 번역으로 만나는 헤르만 헤세의 &lt;나르치스와 골드문트&gt;. 인간 본성의 극단적 양면을 철저하게 육화한 두 주인공이 나누는 정신적 관계의 이야기이자, 아버지와 어머니로 대표되는 두 세계의 대립과 융합에 관한 이야기이다.",22
6757,9791185136417,히틀러의 매니저들 :이들이 없었다면 전쟁은 훨씬 더 빨리 끝났을 것이다! ,귀도 크놉 지음 ;신철식 옮김,울력,http://image.aladin.co.kr/product/14331/35/cover/k752532946_1.jpg,"히틀러의 독일이 그런 역량을 가질 수 있도록 한 여섯 명의 인물들, 이를테면 히틀러의 매니저들을 다룬 책이다. 여섯 명의 인물들의 삶을 통해 히틀러가 벌인 정복 전쟁의 참상을 보여준다.",131
6758,9788959064984,광장의 노래는 세상을 어떻게 바꾸는가 :대통령 찬가에서 하야가까지 ,이영미 지음,인물과사상사,http://image.aladin.co.kr/product/14333/97/cover/895906498x_1.jpg,"노래는 왜 대중을 뜨겁게 하는가? 우리는 왜 광장에서 민주주의를 외치는가? 1980년 서울과 광주 금남로에서 대중은 가장 쉽게 따라 부를 수 있는 &lt;훌라송&gt;을 부르며, 정권 타도를 외쳤다. 2016년 겨울 박근혜·최순실 국정농단이 터졌을 때 대중은 광장에 모여 &lt;하야가&gt;를 불렀다.",115
6759,9791188708000,시간의 이면에서 :전홍범 장편소설 ,지은이: 전홍범,케포이북스,http://image.aladin.co.kr/product/14413/60/cover/k582532046_1.jpg,"전홍범 장편소설. 눈사람 보름달이 떠오르는 낯선 별에서 보낸 3년 6개월의 시간, 존재하나 존재하지 않는, 그 마지막 날의 기록. 서로 알지 못하는 서른여덟 명의 사람들이 사차원의 출구를 통해 다른 시공간으로 이동한다.",74
6760,9791188810208,리의 별 :강태식 장편소설 ,지은이: 강태식,은행나무,http://image.aladin.co.kr/product/14326/1/cover/k472532941_2.jpg,논산시가 주최하고 (주)은행나무.경향신문이 주관하는 제4회 황산벌청년문학상 수상작. 인간이 만든 유원지 행성 플랜A가 정체불명의 바이러스 때문에 사람이 찾지 않는 곳이 된다는 설정 속에 플랜A에 홀로 남게 된 '리'라는 인물의 이야기를 그려낸 작품이다.,28
6761,9791159921445,사탄탱고 ,지은이: 크러스너호르커이 라슬로 ;옮긴이: 조원규,Alma(알마 출판사),http://image.aladin.co.kr/product/13133/29/cover/k492532946_1.jpg,"크러스너호르커이 라슬로의 장편소설. 크러스너호르커이는 고골, 멜빌과 같은 대문호와 자주 비견되며 매년 유력한 노벨상 후보로 거론되는 작가다. &lt;사탄탱고&gt;는 그의 대표작 가운데서도 가장 널리 알려진 작품이다.",86
6762,9788954641135,문 뒤에서 ,지은이: 조르조 바사니 ;옮긴이: 김운찬,문학동네,https://bookthumb-phinf.pstatic.net/cover/135/605/13560532.jpg?type=m1&udate=20180605,인문 서가에 꽂힌 작가들 - 조르조 바사니 소설 선집 4권. 1964년작. 바사니가 자신의 '가장 깊은 암흑기'라 부른 사춘기를 스케치한 성장소설. 소년들 간의 우정과 배신의 격랑이 '나'의 회상과 독백으로 되살아난다.,86
6763,9788983926982,인민의 이름으로 =In the name of the people ,저우메이썬 지음 ;정세경 옮김,문학수첩,http://image.aladin.co.kr/product/14333/84/cover/8983926988_1.jpg,2017년 중국 최고의 화제 드라마 [인민의 이름으로]의 원작 소설. 방영 내내 최고의 화제를 뿌리며 지난 10년간 방영된 드라마 중 최고의 시청률을 기록하였다. 여러 반부패 소재 드라마의 원작자로 중국인들에게 친숙한 정치 사회 소설 일인자 저우메이썬이 8년의 침묵 끝에 내놓은 작품이다.,141
6764,9788936424206,없는 영원에도 끝은 있으니 :박철 시집 ,지은이: 박철,창비,http://image.aladin.co.kr/product/14415/41/cover/8936424203_1.jpg,창비시선 420권. 2018년 올해로 시력 서른한해째를 맞은 박철 시인의 아홉번째 시집. &lt;작은 산&gt; 이후 5년 만에 펴내는 이번 시집은 지난 30년의 작품활동을 가다듬고 되짚어보고 있다는 데 한층 의미를 더한다.,3
6765,9788946420847,폴레폴레 아프리카 =새내기 특파원의 좌충우돌 아프리카 여행기 /Pole pole Africa ,김수진 지음,샘터사,http://image.aladin.co.kr/product/14324/82/cover/8946420847_1.jpg,"아프리카 특파원으로 반년 동안 아프리카 8개국(에티오피아, 남수단공화국, 르완다, 우간다, 케냐, 탄자니아, 짐바브웨, 남아프리카공화국)을 취재, 여행하며 겪은 희로애락을 담았다. 아프리카에서 '폴레폴레(천천히)' 마주한 일상이 낯선 모든 것들을 친숙하게 만들었다.",4
6766,9788932918792,"블랙 어스 :홀로코스트, 역사이자 경고 ",티머시 스나이더 지음 ;조행복 옮김,열린책들,http://image.aladin.co.kr/product/13141/95/cover/8932918791_1.jpg,홀로코스트는 무엇이었을까? 그것은 어떻게 가능했을까? 동유럽사와 홀로코스트 연구의 권위자인 티머시 스나이더는 이 책 &lt;블랙 어스Black Earth&gt;를 통해 완전히 새로운 해석을 제시한다.,131
6767,9791188331277,코카-콜라 쿠바 =정열과 낭만의 이름 /Coca-cola Cuba ,정용 지음,Snowfox(스노우폭스북스),http://image.aladin.co.kr/product/14412/46/cover/k042532045_1.jpg,"시간이 멈춰버린 나라, 쿠바를 여행한 저자가 포착한 사진과 여행지에서 느꼈던 감정과 경험을 바탕으로 쿠바의 역사적 사실을 연대순으로 풀었다. 쿠바는 북한과 함께 코카콜라가 정식 수입되지 않는 나라다. ‘전시형 국가’인 북한과 분명히 다른 미지의 나라, 쿠바. 여행자들의 환상 속에 있는 쿠바를 있는 그대로 담았다.",145
6768,9788925563114,코리아 :a photographic album ,로저 허드슨 글 ;정미우 옮김,RHK(알에이치코리아),http://image.aladin.co.kr/product/13350/63/cover/8925563118_1.jpg,"외국인들에게 한국은 어떤 나라로 비쳐질까? ‘삼성’이나 ‘한류’처럼 단편적으로 소비되는 한국이 아니라, 경제 성장과 민주화라는 두 가지 기적을 동시에 이루어낸 한국, 역동적이며 활기 넘치는 한국의 진짜 얼굴을 보여준다.",66
6769,9788925563428,"지금, 만나러 갑니다 ",이치카와 다쿠지 지음 ;양윤옥 옮김,RHK(알에이치코리아),http://image.aladin.co.kr/product/13543/43/cover/8925563428_1.jpg,"소지섭, 손예진 주연의 동명의 영화 원작 소설. 순수한 사랑의 이야기로 기억되는 소설 &lt;지금, 만나러 갑니다&gt;가 13년 만에 완전히 새로운 모습으로 돌아왔다. 더 이상 볼 수 없게 된 그리운 사람과의 기적 같은 재회를 그린 작품이다.",13
6770,9788994820347,멀어지는 풍경 :최수경 다섯 번째 시집 ,지은이: 최수경,현자,http://image.aladin.co.kr/product/13661/77/cover/8994820345_1.jpg,"최수경 시집. 멀어지는 풍경 속의 숨은 빛을 찾아 나선다. 시집은 1부 '풀잎의 밤', 2부 '멀어지는 풍경', 3부 '벚나무 아래서', 4부 '5월의 가출'로 구성되었다.",3
6771,9788964361399,회사를 해고하다 :도시 바깥에서 시장 너머를 꿈꾸며 ,명인 지음,삼인,http://image.aladin.co.kr/product/13929/18/cover/8964361393_1.jpg,명인 에세이. 「말과 활」이라는 잡지에 연재했던 '남쪽으로 튀어'라는 제목의 글들을 모은 책이다. 잘 다니던 회사를 때려치우고 아이들이 다니던 학교도 때려치우고는 저 남쪽 고흥으로 내려가 시골살이 생활을 하며 도시의 삶이 잃어버린 질문을 되새기는 내용이다.,4
6772,9788958271154,하냥 살응게 이냥 좋아 :부여 송정마을 이야기 ,그림책미술관시민모임 글,한울림,http://image.aladin.co.kr/product/13929/94/cover/8958271159_1.jpg,사단법인 그림책미술관시민모임이 충남 부여군 양화면 송정마을 사람들의 삶 이야기와 마을의 이야기를 채록하여 정리한 책이다. 그림책미술관시민모임이 한국의 전형적인 농촌 마을인 송정마을의 이야기에 주목한 이유는 이야기의 힘을 믿기 때문이다.,97
6773,9791170221456,소설 어떻게 읽고 써야 하는가? :볼품 없는 초고를 명작으로 만드는 비법 ,산드라 스코필드 지음 ;임현택 옮김,처음북스,http://image.aladin.co.kr/product/13732/8/cover/k642532826_1.jpg,"매력적인 책을 쓰고 싶은 사람, 단 한 명의 독자도 소중한 사람, 글쓰기라는 가장 하고 싶은 일을 하면서 성취감을 느끼고 싶은 사람을 위한 책. 초보 작가가 가진 수많은 고민을 해결해줄 책이다.",72
6774,9788998079260,노루똥 :큰글씨책 ,지은이: 정형남,해피북미디어,http://image.aladin.co.kr/product/13935/89/cover/8998079267_1.jpg,"&lt;감꽃 떨어질 때&gt;, &lt;진경산수&gt; 등을 발표하며 긴 세월을 옹이에 새긴 고목의 여유로움을 보여준 작가 정형남 소설집. 전작에서 일관되게 보여준 산천의 사계와 고향의 정경, 그리고 그 속의 사람들이 그려내는 지난 세월의 풍경들은 본작에서도 이어진다.",28
