id,isbn,title,author,publisher,image_url,content,genre_detail_dict_id
1699,9791190938938,첫사랑이 슬픈 이유 ,조윤성 지음,상상출판,https://image.aladin.co.kr/product/25792/22/cover/k042736812_1.jpg,"많은 공감을 불러일으킨 브런치 베스트 로맨스 소설을 묶은 소설집이다. 조윤성 작가는 누구나 러브 스토리의 주인공이 될 수 있다는 확신으로 사소하지만 소소한 사랑을 '나쁜 남자 증후군', '첫사랑', '을의 연애' 등을 통해 이야기하고 있다.",30
1700,9791197020131,진 달래 아리 :그래서 고양이 집사로 산다 ,지은이: 윤성의,Yeondoo,https://image.aladin.co.kr/product/25811/54/cover/k422736334_2.jpg,윤성의 에세이. 어느 결에 저자에게는 고양이와 여행 사이에 뗄레야 뗄 수 없는 연결고리가 생겨버렸다. 이제는 함께 살고 있는 고양이들을 보고 있으면 여행지에서 만났던 녀석들까지 덩달아 연상된다고 한다. 단숨에 여행의 조그마한 순간들까지 뻗어나가 생생한 추억으로 되살아나곤 하는 것이다.,4
1701,9791188836819,"예일, 사계 =전통, 자본, 능력주의가 지배하는 미국 명문대의 빛과 그늘 /Yale, the four seasons ",지은이: 이시철,윤성사,https://image.aladin.co.kr/product/25662/31/cover/k482735241_1.jpg,"예일대에 관한 모든 것을 샅샅이 보여주는 책이다. 예일의 삶, 문화, 역사, 학문, 미션, 도전 그리고 그 이상을 풀브라이트 학자의 시선으로 구술하는 신나는 읽을거리다.",21
1702,9788984310834,악역을 맡은 자의 슬픔 ,홍세화 지음,한겨레신문사,http://image.aladin.co.kr/product/39/5/cover/8984310832_2.jpg,"사회귀족의 나라 한국에서 아웃사이더로 살면서 어떻게 '사회귀족의 성채'를 부술 것인지, 특히 지식인들이 해야할 일은 무엇인지 탐색한 책. 홍세화의 세 번째 에세이다. (한겨레신문사, 1999)가 '사회정의'를 외쳤다면, 이 책은 '앵똘레랑스는 앵똘레랑스로'라는 기치를 높이 쳐든다.",35
1703,9788989938316,갈라파고스 :커트 보네거트 장편소설 ,지은이: 커트 보네거트 ;옮긴이: 박웅희,아이필드,http://image.aladin.co.kr/product/42/33/cover/8989938317_2.jpg,"커트 보네거트 특유의 시니컬한 유머감각과 날카로운 독설이 돋보이는 소설. 우리가 살고 있는 세상을 통렬하게 풍자하는 작가의 입담이 유감없이 발휘된다. 다윈의 '진화론'을 키워드로 잡아, 1백만년 후 인류의 미래를 그리고 있다.",74
1704,9788996841906,통일시대 가치창출이 기대되는 북한의 산업시설 공장 기업소 ,북한경제산업연구소 [편],북한산업경제연구소,http://image.aladin.co.kr/product/1554/77/cover/8996841900_1.jpg,"2011년 12월. 북한의 최고지도자 김정일 사망을 기점으로 북한에 점차적인 변화의 바람이 불어오고 있다. 평양에 ‘광복지구상업중심’이라는 이름의 중국자본이 투입된 대형할인마트 개점으로 향후 북한에 많은 변화를 가져올 것으로 예상된다. 북한의 산업시설, 공장, 기업소 등은 북한지역에 풍부하게 부존·매장되어 있는 각종 금속 및 비금속 광물, 또는 희소금속자원 등(약 7,000조원 가치)을 활용하여 외국의 자본과 선진화된 기술을 도입. 새롭게 개건 또는 확장함으로써 새로운 도약을 시도하고 있다.",108
1705,9791162335062,시시한 사람이면 어때서 ,유정아 지음,북폴리오,https://bookthumb-phinf.pstatic.net/cover/135/517/13551720.jpg?type=m1&udate=20180619,"'소비에 실패할 여유'라는 글로 2017년 큰 화제가 됐던 유정아 작가의 첫 번째 에세이. 저자는 지금 당신이 그토록 꼬이고 좁아지고 화나는 건 이상한 일이 아니라고, 막다른 골목에 몰리면 많은 사람들이 그렇게 되고, 나 역시 그랬으며, 자신의 괴롭고 못난 시간들이 누구나 겪을 수 있는 평범한 것이었다고 말한다.",4
1706,9788954609616,올페는 죽을 때 나의 직업은 시라고 하였다 :남진우 문학수첩 ,남진우 지음,문학동네,https://bookthumb-phinf.pstatic.net/cover/062/598/06259863.jpg?type=m1&udate=20141122,"중견 시인이자 문학평론가로 활동하고 있는 남진우의 문학수첩. 시인의 시적 감성과 평론가의 논리적 면모가 적절히 조화를 이룬 책. 지난 10여년간 국내외 시, 소설, 산문을 넘나들며 기록한 독서일기. 노시인 서정주에서 젊은 영화평론가 김용호까지, 또 가브리엘 마르케스, 미셸 투르니에에서 무라카미... ",72
1707,9791187521136,국민이 묻는다 :국가란 무엇인가 ,월명 지음,희망꽃,http://image.aladin.co.kr/product/10841/83/cover/k832531862_1.jpg,"『국민이 묻는다』는 정치, 경제, 사회, 외교, 통일, 청년실업, 노인문제로 각각의 챕터를 나눈 뒤 우리 사회에 산적해 있는 문제점을 되짚어보고, 해결방법을 제안한다. 이는 월명스님이 만들고 싶은 대한민국이자 우리가 꿈꾸는 대한민국의 모습이기도 하다.",4
1708,9791130464671,동시 ,지은이: 서른 명의 시인,커뮤니케이션북스,http://image.aladin.co.kr/product/6132/74/cover/k512433615_2.jpg,'지만지 한국동시문학선집' 100종에 실린 111인의 작품 9940편 가운데 가슴 찡한 느낌을 피할 수 없는 아름다운 시를 골라 모았다. 31명 작가의 작품 35편이다. 시를 읽고 사유하는 시간을 위해 시와 시 사이에 긴 여백을 두었다.,3
1709,9791160543988,낙엽 따라 가버린 사랑 ,김종은 지음,렛츠book(렛츠북),https://image.aladin.co.kr/product/25320/20/cover/k502633508_1.jpg,"김종은 소설. 운명처럼 내게 다가온 그녀 은미. 그녀로 인해 내가 아직 살아 있음을, 세상이 여전히 아름다움을 다시 느꼈다. 육체와 영혼의 교감을 넘나들며 완전한 하나가 되었던 나와 은미. 그러나 가혹한 운명은 우리 사이를 떨어트려 놓으려 한다.",28
1710,9791190277952,"삼국지평화 :삼국지 이전의 삼국지, 민간전래본 ",김영문 옮김,교유당,https://image.aladin.co.kr/product/25733/10/cover/k702736877_1.jpg,"중국 남부 복건성 건안에서 발간된 지은이 미상의 『삼국지평화』를 우리말로 옮긴 완역본이다. 현존하는 소설 『삼국지』의 최초 텍스트로, 『삼국지연의』보다 170여 년 앞선다. ‘평화’라는 제목에서 알 수 있듯이 묘사가 다소 거친 감이 있지만 스토리 전개가 빠르고 간략하다.",27
1711,9791196467661,경혜씨와 함께 쓰는 백일의 꿈 :꿈을 이루어주는 기적의 일기 ,지은이: 임경혜와 나,땡스앤컴퍼니,https://image.aladin.co.kr/product/25761/95/cover/k682736101_3.jpg,저자는 제주도 서귀포에 자리하고 있는 ‘평화의마을’에서 일하는 자폐인 제빵사다. 경혜씨가 일기를 쓰기 시작한 건 2019년 5월 19일. 그날 이후 경혜씨는 단 하루도 거르지 않고 매일 저녁 8시면 일기장을 펼친다. 날마다 비슷하면서도 날마다 다른 이야기를 그림일기에 담았다.,4
1712,9791158082871,과학기술혁명 :과학혁명과 4차 산업혁명 ,김유신 지음,자유아카데미,https://image.aladin.co.kr/product/25746/95/cover/k022736000_1.jpg,이 책은 2부로 구성된다. 1부는 어떻게 근대과학이 서구에서 탄생하였는지 그 역사를 다룬다. 2부에서는 다가올 기술 혁명인 4차 산업혁명에 관한 이해를 다룬다.,52
1713,9791187332572,"배움이 빛나는 프로젝트학습 :개념부터 설계 방법, 실천 사례까지 우리 실정에 맞는 프로젝트학습의 모든 것 ","지은이: 어수선,조제우",사우,https://image.aladin.co.kr/product/25734/92/cover/k662736970_2.jpg,어수선이 정립한 프로젝트학습의 이론과 실천 사례가 모두 담겨 있다. 프로젝트학습을 실천하고자 하는 교사들에게 든든한 나침반이 되어 줄 것이다.,21
1714,9788983719140,생태학 ,유진 오덤 지음 ;장현정 옮김,사이언스북스,https://bookthumb-phinf.pstatic.net/cover/000/667/00066721.jpg?type=m1&udate=20130628,생태학계의 대부인 오덤 교수는 이 책에서 본래 자연과학의 전문분야인 생태학의 이론과 실제를 문외한도 이해할 수 있게 쉽게 풀어 설명한다. 오덤 교수의 생태학은 만물과 더불어 살아가고자 하는 따뜻한 마음의 발로로서 그 궁극적 취지는 동양의 노장사상과도 상통하는 바가 있다．사실 생태학이라는 학문자체가 자연을 줄곧 대상화해 온,62
1715,9788930037501,동굴 속의 독백 ,저자: 李泳禧,나남출판,https://bookthumb-phinf.pstatic.net/cover/002/017/00201757.jpg?type=m1&udate=20130629,"74년 펴낸 첫 저서 에서부터 올해 출간한 에 이르기까지 그의 저작에서 인간 리영희의 열정과 향기, 아픔이 아로새겨진 고백체의 글들이 모였다. - 한겨레신문 고명섭기자",56
1716,9788908033139,마음의 파수꾼 ,F. 사강 지음 ;방곤 옮김,범우사,http://image.aladin.co.kr/product/52/93/cover/8908033130_1.jpg,"프랑스의 소설가이며, &lt;슬픔이여 안녕&gt;의 저자 F. 사강의 책. 젊음을 유지하면서 나이와 세월을 의식하는 40대 여성 도로시와 그녀와의 정신적 사랑을 갈망하는 20대 젊은 남자 루이스를 통해, 사랑이란 미명하에 살인을 하고도 죄의식을 느끼지 않는 오늘날의 젊은이들이 행하는 무분별하고도 즉흥적인 삶의... ",10
1717,9788977190818,노무현과 안티조선 :김동민의 언론시평 ,지은이: 김동민,시와사회,http://image.aladin.co.kr/product/34/61/cover/8977190819_1.gif,언론개혁운동의 최전선에서 맹활약 중인 한일장신대 김동민 교수의 언론비평 모음집. 대안매체로 주목을 끌고 있는 『오마이뉴스』(www.ohmynews.com)에 '김동민의 언론시평'이란 이름으로 연재되었던 글들을 엮은 것이다.,115
1718,9788970126951,진짜 좋은게 뭐지? :닉 혼비 장편소설 ,지은이: 닉 혼비 ;옮긴이: 김선형,문학사상,http://image.aladin.co.kr/product/57/63/cover/8970126953_1.jpg,"영화화되어 국내에서도 많은 사랑을 받은 &lt;어바웃 어 보이&gt;, &lt;하이 피델리티&gt; 의 원작자 닉 혼비의 세번째 장편소설. 도덕의 기준이 사라진 현대에 어떻게 사는 것이 중요한지 보여주는 작품. 평범한 중산층 가정의 유부녀 케이티의 입을 빌려 작가는 진정 풍요롭고 아름다운 삶이 가능한지 묻는다.... ",9
1719,9788987519265,반세기의 신화 :리영희 비평집 ,지은이: 리영희,삼인,http://image.aladin.co.kr/product/20/64/cover/8987519260_1.gif,"우리에게 `통일`은 얼마나 가까이 있을까. 우리는 통일논의에서 얼마나 자유로울까. 휴전선을 사이에 두고 마치 자신은 `천사`요, 상대방은 `악마`인양 반세기를  지내온 남북한. 금세기가 끝나가는 이 시점에서도 여전히 세계  유일의 분단국으로 남아있는 우리의 현실을 매섭게 비판한 비평집이 출간됐다.--정운현기자(대한매일신문)",108
1720,9788973810055,"크눌프, 그 삶의 세 이야기 ",헤르만 헤세 지음 ;송은실 옮김,소담출판사,https://bookthumb-phinf.pstatic.net/cover/000/358/00035885.jpg?type=m1&udate=20150715,"헤르만 헤세의 &lt;크눌프, 그 삶의 세 이야기&gt;. 초봄, 크눌프에 대한 회상, 종말의 세 편으로 이루어질 작품으로서, 제1차 세계 대전이 한창이던 1915년에 간행되었다. 각각의 작품이 따로따로 발표된 적이 있을 정도로 한 편 한 편이 완결된 구조를 이루고 있는, 독특한 구성을 지닌 작품.",22
1721,9788955614268,"그 남자의 뇌, 그 여자의 뇌 :뇌과학과 심리 실험으로 알아보는 남녀의 근본적 차이 ",사이먼 배런코언 지음 ;이승복 옮김,바다출판사,http://image.aladin.co.kr/product/196/49/cover/8955614268_1.jpg,"왜 남자들 대부분은 전화로 수다를 떨지 않고 용건만 말할까? 왜 여자들은 친구와의 관계나 감정에 대해 이야기하는 것을 좋아할까? 이러한 남녀 차이는 모두 양육, 교육에 의해 후천적으로 나타난 것일까? 심리학자 베런코언은 이 책에서 우리가 지금까지 어렴풋하게 느끼기만 했던 남녀 차이의 원인을 설명한다.",40
1722,9791160544039,(중국공산당의) 스파이 전쟁 :1927-1949 ,홍윤표 지음,렛츠북,https://image.aladin.co.kr/product/25541/37/cover/k012633326_1.jpg,"스파이로 읽는 중국 현대사. 현대 중국에서 최초의 정보 조직이 창설된 1927년부터 1949년까지의 역사를 다루지만, 실제 범위는 1840년 아편전쟁 이후의 100년이다. 현대 중국의 정보기관과 첩보전을 총망라한 책이다.",27
1723,9788992008853,"외로운 아이들 :자해하는 아이들, 그 다섯 가지 이야기 ",백선혜 지음,푸른나무,https://image.aladin.co.kr/product/25727/95/cover/8992008856_1.jpg,"자해하는 아이들을 깊이 이해하며, 그들을 보듬고 함께할 수 있도록 조언하는 책이다. 다섯 명의 자해 청소년을 상담하면서 자해가 무엇인지, 자해가 어떻게 일어나는지, 자해 경험이 어떤 의미가 있는지를 성찰한다.",40
1724,9788936478469,나를 닮지 않은 자화상 :화가 장호의 마지막 드로잉 ,글·그림: 장호,창비,https://image.aladin.co.kr/product/25784/44/cover/893647846x_2.jpg,2014년 타계한 화가 장호의 그림 에세이. 2013년 5월 구강암 판정을 받고 이듬해 6월 세상을 떠나기까지 화가가 일 년간 투병하며 그리고 쓴 드로잉 116점과 일기 16편을 선하여 시간순으로 모았다.,6
1725,9791190938112,길을 걷다 문득 떠오른 것들 :도보여행가 신정일이 길에서 배운 삶의 자세 ,신정일 지음,상상출판,https://image.aladin.co.kr/product/25792/25/cover/k152736812_1.jpg,"40여 년간 400여 곳의 산과 10대 강을 걸으며 순간순간의 단상을 기록한 작가 신정일. 역사서와 인문서, 에세이를 쓴 다작 작가로서 길 위에 놓인 개인의 고민과 사회 문제를 심도 있게 다뤘다.",4
1726,9791196267766,다낭 날씨는 당신의 기분 같아서 ,지은이: 이두리,꽃길,https://image.aladin.co.kr/product/26064/4/cover/k322737055_1.jpg,"여기, 누구보다도 솔직 담백한 목소리로 자신의 경험을 이야기하는 사람이 있다. 눈치 보지 않고, 자신을 속이지 않고, 스스로가 겪고 또 깨달은 것을 겉치레나 수식어 없이 또박또박 담담하게 풀어놓는 한 여성이 있다. 바로, 한국국제협력단 KOICA 해외봉사단원으로 베트남 다낭에서 2년간 한국어를 가르치고 돌아온 작가 이두리의 이야기다.",4
1727,9791185032535,페미니즘은 어떻게 괴물이 되었나 ,"오세라비,나연준 지음",글통,https://image.aladin.co.kr/product/25786/55/cover/k672736717_1.jpg,"어느덧 한국사회 주류 이데올로기의 자리를 넘보고 있는 ‘페미니즘’에 대한 전면 비판서. 책은 오늘날 K-페미니즘이 과도한 이념적 접근으로 젠더갈등의 근원이 되고 있으며, 페미니즘의 주체세력인 여성단체는 이를 하나의 수익사업으로 전락시켰다고 비판한다. 또한 종군위안부 문제로 대표되는... ",67
1728,9788956384177,지영희 피리 풍류 ,박승률 엮음,민속원,http://image.aladin.co.kr/product/88/87/cover/8956384177_1.jpg,"『지영희 민속음악 연구 자료집』에 실려 있는 악보 중에서 피리 연주곡만을 발췌한 책. 한국 전통음악의 귀중한 유산으로써 지영희가 직접 작곡한 피리 산조를 비롯하여 도살푸리, 영산회상 중 현악 영산회상, 관악영산회상, 대풍류 무용곡을 수정하고 정리하였다. 원본을 수정한 곳에는 주를 달아 수정한... ",17
1729,9788931671568,(서용석制) 한세현流 피리산조 ,편저자: 한세현,은하출판사,http://image.aladin.co.kr/product/226/23/cover/8931671563_1.jpg,"1984년 한세현 선생은 서용석선생과 공동작업으로 2년 여의 노력 끝에 이 산조를 완성하게 된다. 피리주법을 모르는 서용석선생(전 국립국악원 민속악단 예술감독, 대금, 아쟁, 작곡의 탁월한 연주자)이였기에 일러주는 구음을 피리주법에 맞게 정리하여 여러가지 표현들을 20여년간의 시행착오와 노력으로 인해 완성하였기에 이 산조를 '서용석제 한세현류 피리산조'라 부른다.",17
1730,9788973810413,목걸이 ,기 드 모파상 지음 ;서치헌 옮김,소담출판사,https://bookthumb-phinf.pstatic.net/cover/001/182/00118270.jpg?type=m1&udate=20150715,"기 드 모파상의 &lt;목걸이&gt;. 이 작품은 간결하면서도 정확한 모파상 특유의 문체가, 가짜 다이아몬드 때문에 진실한 행복을 잃는 허영에 찬 여인의 한순간의 실수라는 평범한 일상적 소재에 생동감을 불어넣는 작품이다.",10
1731,9788985982290,(주몽의 연인) 소서노 :최정주 장편소설,최정주 지음,세시,https://bookthumb-phinf.pstatic.net/cover/024/204/02420470.jpg?type=m1&udate=20060707,"고주몽을 도와 고구려를 건국하고, 두 아들 비류와 온조를 통해 십제국과 백제를 건국한 '소서노'의 일대기를 그린 소설이다. 부족국가 계로부의 공주로 태어나 광활한 대륙을 호령하는 여제가 되기까지, 소서노의 파란만장한 삶을 흥미진진하게 그려냈다.",121
1732,9788908060104,목마른 계절 ,전혜린 지음,범우사,http://image.aladin.co.kr/product/5/0/cover/8908060103_3.jpg,문고판 전문회사 범우사의 범우문고 시리즈. 범우문고는 고객만족도를 위해 저렴한 가격에 양질의 문학 컨텐츠를 제공한다.,4
1733,9791189660093,군주론 ,니콜로 마키아벨리 지음 ;이시연 옮김,더클래식,https://image.aladin.co.kr/product/17391/30/cover/k412534696_1.jpg,"더클래식 서양고전 시리즈 미니북 1권. 한 국가를 책임지는 지도자라면, 평소에는 전통적 윤리에 충실하더라도 비상시에는 필요에 따라 비도덕적인 수단도 행사할 수 있어야 한다고, 그래야 결국 정의와 평화가 온다는 역설을, 정확한 현실 정치 경험에 근거해서 펼치고 있다. 현대를 사는 우리들도 곰곰이 새겨봐야 할 묵직한 진실이 담겨 있다.",51
1734,9788981630492,(한완상의) 다시 한국의 지식인에게 ,한완상 지음,당대,http://image.aladin.co.kr/product/22/79/cover/8981630496_1.gif,"그간 비판적 사회학자로서 한국 사회의 모순을 비판하고 몸소 실천해왔던 한완상 상지대 총장의 시대에 대한 단상을 모은 책이다. 이 책에서 저자는 우리 민족의 생존과 번영, 우리 사회의 열림과 발전, 우리 시민사회의 활력과 성공, 21세기의 전망을 이야기한다.",69
1735,9791160544077,엿장수로 온 하나님 :이치현 詩集 ,지은이: 이치현,렛츠book(렛츠북),https://image.aladin.co.kr/product/25513/69/cover/k132633228_1.jpg,"이치현의 첫 번째 시집이다. ‘희미한 전설들’, ‘석공의 일생’, ‘홀로 사는 죄’를 포함한 아름다운 시 119편과 산문 3편이 담겨 있으며, 자연, 사랑 등 일상에서 흔히 마주칠 수 있는 것들을 소재로 하고 있어 깊은 내적 공감을 자아내고 있다.",3
1736,9788975551970,(역사의 향기가 흐르는) 여수 ,지은이: 박종길,지영사,https://image.aladin.co.kr/product/25842/33/cover/8975551970_2.jpg,"역사, 섬, 해안, 산, 풍경, 오늘의 여수로 나뉜 101개의 역사의 향기가 흐르는 이야기를 통해 보여주는 여수 인문지리지이다.",89
1737,9791196267773,우리 함께 살아갑니다 지금 이곳에서 ,지은이: 오충현 외 10인,꽃길,https://image.aladin.co.kr/product/26063/97/cover/k052737055_1.jpg,"생명과 사랑을 찾아 전 세계로 떠난 사람들이 있다. '나의 환자의 건강과 생명을 첫째로 생각하겠노라'는 히포크라테스 선서를 가슴에 안고 바다를 건너고 산을 넘어 이방인을 자처한 사람들, 바로 코이카 글로벌협력의료진들의 이야기다.",4
1738,9788946030909,김대중 정부 5년 평가와 노무현 정부 개혁과제 ,"경향신문사,참여연대 엮음",한울,http://image.aladin.co.kr/product/40/34/cover/8946030909_1.gif,각계의 전문가들이 언론개혁 재벌개혁 대북정책 분야 등 10여 개 핵심 개혁대상 분야를 중심으로 김대중 정부 5년간 추진된 개혁의 성공과 실패를 평가한다. 나아가 노무현 정부의 개혁과제를 제시했다.,97
1739,9788984311015,빨간 신호등 ,홍세화 지음,한겨레신문사,http://image.aladin.co.kr/product/42/59/cover/8984311014_1.gif,"1999년 5월부터 2003년 4월까지 「한겨레」에 실은 칼럼을 엮었다. 2년 반은 프랑스에서 1년 반은 한국 사회에서 쓴 글로, 역사, 사회, 이웃, 그리고 나에 대한 성찰이 진보의 첫걸음이라는 생각을 피력하고 있다.",56
1740,9788908032309,벙어리 삼룡이 (외) ,나도향 지음,범우사,https://bookthumb-phinf.pstatic.net/cover/002/174/00217414.jpg?type=m1&udate=20141122,1922년 &lt;백조&gt; 동인으로 문학활동을 하다가 25세의 젊은 나이로 요절한 작가 나도향의 작품집. 외형적으로는 일종의 추물이었으나 속마음은 누구보다도 진실하고 충성스러우며 부지런한 삼룡이라는 이름의 벙어리를 통해 학대받는 정직한 불구자의 인간적인 자각과 마지막 반항을 극적으로... ,28
1741,9791187262046,신국가론 :이남(以南)을 구(救)할 이남구(李南九)의 21세기(世紀) 한국책략(韓國策略) ,저자: 이남구,좋은기업위드,https://bookthumb-phinf.pstatic.net/cover/106/346/10634603.jpg?type=m1&udate=20160603,"저자는 우리나라가 살아나갈 책략을 적어 놓고, 어떻게 해서 저자의 제안을 실행할 수 있는지 구체적인 Action plan을 단락마다 설정하여 정책입안자들에게 그 방향을 제시하였다. 그리고 국가의 대경영전략을 항목별로 열거하였다.",56
1742,9791189930653,혼자 떠난 유럽 여행 :나는 혼자가 아니었다 ,한그루 지음,Harmonybook(하모니북),https://image.aladin.co.kr/product/25575/54/cover/k172735484_1.jpg,"&lt;서른, 진짜 이루고 싶은 꿈이 생겼다&gt; 저자 한그루 에세이. 혼자 여행하기를 결심하는 순간부터 여행하는 동안 세상을 경험하고, 평소 알던 나와 다른 나를 마주하며 재점검하고 '나'다운 삶을 찾아나가는 것을 이야기했다.",100
1743,9791197151439,꽃 진 자리 모로 눕다 :양선 시집 ,지은이: 양선,북치는소년,https://image.aladin.co.kr/product/25973/19/cover/k962737224_1.jpg,매혹시편 2권. 양선 시인은 시인으로서는 새내기이면서도 시력으로는 오래된 미래를 살아온 사람이다. 2020년 계간 『동안』 신인 문학상을 받으며 시인으로서 세상에 이름을 알렸으니 이제 막 싹을 틔운 시인이다.,3
1744,9791188253203,나와 개의 시간 ,글·그림: 카예 블레그바드 ;옮김·해설: 위서현,콤마,https://image.aladin.co.kr/product/23616/34/cover/k842638520_1.jpg,"작가 카예 블레그바드가 '블랙독'과 함께 살아가는 삶을 통해 자신이 오랜 기간 겪어온 우울증에 대해 이야기한다. 담담한 산문과 심플한 흑백화로 된 책은, 마음 속 깊은 곳에 있는 어두운 문제들을 드러내 보이고 그것들과 화해해 가는 과정을 그린다.",6
1745,9791196791018,아서 매켄 단편선,지은이: 아서 매켄 ;옮긴이: 이미경,Wide Mouth(와이드마우스),https://image.aladin.co.kr/product/24045/74/cover/k982639623_1.jpg,"코스믹 호러의 진정한 선구자로 평가받는 아서 매켄의 단편선 첫 번째. 아서 매켄이 1890년대에 집필한 「위대한 신, 판」과 함께 「내면의 빛」, 「붉은 손」이 수록되어 있다. 아서 매켄의 초기 작품 세계를 살펴 볼 수 있다.",135
1746,9791185851075,절대 말하지 않을 것 ,캐서린 맥켄지 지음 ;공민희 옮김,미래지향,https://image.aladin.co.kr/product/24043/59/cover/k652639620_1.jpg,"20년 전 맥알리스터 가족의 캠프 마코에서, 아만다 홈즈가 몽둥이에 맞은 채 보트 안에서 발견되었다. 하지만 아무도 그 범죄로 인해 기소되지 않는다. 그들은 다 함께 진실을 밝혀낼 수 있을까?",94
1747,9791188652198,캐나다 서부 :Canada ,"글: 신수경,강승일",샬레트래블앤라이프,https://image.aladin.co.kr/product/21766/94/cover/k412636002_1.jpg,"FIT 여행의 선두주자인 샬레트래블앤라이프의 캐나다 전문 컨설턴트가 집필한 가이드북이다. 다양한 교육 프로그램과 출장 및 현지 답사, 호텔 인스펙션을 통해 축적한 지식과 오랜 시간 고객과의 소통으로 쌓은 노하우가 그대로 담겨 있다.",137
