id,isbn,title,author,publisher,image_url,content,genre_detail_dict_id
13276,9788961457286,소드 레전드 =장백산 퓨전 판타지 장편소설.Sword legend ,지은이: 장백산,디앤씨미디어,https://bookthumb-phinf.pstatic.net/cover/060/001/06000199.jpg?type=m1&udate=20151031,"[표지글]중간계는 물론이고 신계, 심지어 마계에서조차 존재치 않는 물질로 만들어진 백색 철궤! 이로 인해 모든 이야기가 시작되었다. 그리고― 지도상에 존재하지 않는 절해고도 최남단…. 다시금 손에 땀을 쥐게 할 또 하나의 영웅 전기! 검의 전설이 되어 라일랜드 대륙을 울릴 전사의 신화가 시작된다!",14
13277,9788961457293,소드 레전드 =장백산 퓨전 판타지 장편소설.Sword legend ,지은이: 장백산,디앤씨미디어,https://bookthumb-phinf.pstatic.net/cover/060/105/06010536.jpg?type=m1&udate=20151031,"[표지글]중간계는 물론이고 신계, 심지어 마계에서조차 존재치 않는 물질로 만들어진 백색 철궤! 이로 인해 모든 이야기가 시작되었다. 그리고― 지도상에 존재하지 않는 절해고도 최남단…. 다시금 손에 땀을 쥐게 할 또 하나의 영웅 전기! 검의 전설이 되어 라일랜드 대륙을 울릴 전사의 신화가 시작된다!",14
13278,9788961457309,소드 레전드 =장백산 퓨전 판타지 장편소설.Sword legend ,지은이: 장백산,디앤씨미디어,https://bookthumb-phinf.pstatic.net/cover/060/245/06024561.jpg?type=m1&udate=20151031,"[표지글]중간계는 물론이고 신계, 심지어 마계에서조차 존재치 않는 물질로 만들어진 백색 철궤! 이로 인해 모든 이야기가 시작되었다. 그리고― 지도상에 존재하지 않는 절해고도 최남단…. 다시금 손에 땀을 쥐게 할 또 하나의 영웅 전기! 검의 전설이 되어 라일랜드 대륙을 울릴 전사의 신화가 시작된다!",14
13279,9788961457316,소드 레전드 =장백산 퓨전 판타지 장편소설.Sword legend ,지은이: 장백산,디앤씨미디어,https://bookthumb-phinf.pstatic.net/cover/060/392/06039202.jpg?type=m1&udate=20151031,"중간계는 물론이고 신계, 심지어 마계에서조차존재치 않는 물질로 만들어진 백색 철궤!이로 인해 모든 이야기가 시작되었다.그리고― 지도상에 존재하지 않는 절해고도 최남단……다시금 손에 땀을 쥐게 할 또 하나의 영웅 전기!검의 전설이 되어 라일랜드 대륙을 울릴 전사의 신화가 시작된다!- 출판사 제공",14
13280,9788926701157,소드 레전드 =장백산 퓨전 판타지 장편소설.Sword legend ,지은이: 장백산,디앤씨미디어,https://bookthumb-phinf.pstatic.net/cover/060/544/06054433.jpg?type=m1&udate=20151031,"「더 라스트」「초월자의 검」「제왕」「대천공」말이 필요 없는 작가, 장백산의 다섯 번째 이야기!다시금 손에 땀을 쥐게 할 또 하나의 영웅 전기!- 출판사 제공",14
13281,9788926701164,소드 레전드 =장백산 퓨전 판타지 장편소설.Sword legend ,지은이: 장백산,디앤씨미디어,https://bookthumb-phinf.pstatic.net/cover/060/711/06071116.jpg?type=m1&udate=20151031,"『소드 레전드』제 7권!「더 라스트」「초월자의 검」「제왕」「대천공」말이 필요 없는 작가, 장백산의 다섯 번째 이야기! 다시금 손에 땀을 쥐게 할 또 하나의 영웅 전기!",14
13282,9788926701997,소드 레전드 =장백산 퓨전 판타지 장편소설.Sword legend ,지은이: 장백산,디앤씨미디어,https://bookthumb-phinf.pstatic.net/cover/061/133/06113334.jpg?type=m1&udate=20151031,"『소드 레전드』제9권! 중간계는 물론이고 신계, 심지어 마계에서조차 존재치 않는 물질로 만들어진 백색 철궤! 이로 인해 모든 이야기가 시작되었다. 그리고― 지도상에 존재하지 않는 절해고도 최남단……다시금 손에 땀을 쥐게 할 또 하나의 영웅 전기! 검의 전설이 되어 라일랜드 대륙을 울릴 전사의 신화가... ",14
13283,9788926701478,소드 레전드 =장백산 퓨전 판타지 장편소설.Sword legend ,지은이: 장백산,디앤씨미디어,https://image.aladin.co.kr/product/469/98/cover/8926701476_1.jpg,"&lt;더 라스트&gt; &lt;초월자의 검&gt;의 작가 장백산의 퓨전 판타지 장편소설. 중간계는 물론이고 신계, 심지어 마계에서조차 존재치 않는 물질로 만들어진 백색 철궤. 이로 인해 모든 이야기가 시작되었다. 그리고, 지도상에 존재하지 않는 절해고도 최남단, 검의 전설이 되어 라일랜드 대륙을 울릴 전사의 신화가 시작된다.",14
13284,9788961458702,바케라노!,스기이 히카루 지음 ;김완 옮김,디앤씨미디어,https://image.aladin.co.kr/product/339/58/cover/8961458701_1.jpg,"모 라이트노벨 브랜드에서 데뷔한 신인 작가 스기이 히카루. 그의 주변 선배며 동기 작가들은 놀랍게도 모두 미소녀들이었다. 인간은 아니지만… 주식과 파친코에 푹 빠진 불량 늑대 작가 이즈나, 어린 소녀의 모습으로 야시시한 개그 연애물을 쓰는 자시키와라시 작가 츠바사 등 자극 넘치는 라이트노벨 작가 생활을 담았다.",38
13285,9788961458474,바케라노!,스기이 히카루 지음 ;김완 옮김,디앤씨미디어,https://image.aladin.co.kr/product/408/35/cover/8961458477_1.jpg,"GA 문고 편집부의 사악한 음모(에 수영복 삽화가 필요하다는 것)에 의해 갑작스럽게 오키나와 행이 결정된 괴물 작가들. 하지만 참가할 수 있는 것은 다섯 명이다. 여자 네 명을 제외하고 남은 자리를 차지할 수 있는 것은 히카루인가, 아니면 엠인가? 그것은 라면 대결에 달려 있다.",38
13286,9788974091989,변해 가는 북한 풍경 =대구포토비엔날레 특별전 /Changing social landscape : democratic people's Republic of Korea 1950-2008 ,임영균 엮음,눈빛출판사,http://image.aladin.co.kr/product/275/96/cover/8974091984_1.jpg,"『변해 가는 북한 풍경』. 미국 &lt;라이프&gt;지의 전설적인 사진가 마가렛 버크-화이트, 프랑스의 영상감독 크리스 마커, 한국을 대표하는 김희중 등이 기록한 사진집. 해방 후 1950년부터 2008년에 이르기까지의 북한 사회를 보여준다. 국적과 세대가 다른 12명의 사진가들이 10년의 간격을 두고 북한의... ",66
13287,9788974092009,검은 모살뜸 =육명심 사진집 /Gum'n mosaltm ,사진·글: 육명심 ;디자인: 홍동원,눈빛출판사,http://image.aladin.co.kr/product/311/25/cover/897409200x_1.jpg,『육명심 검은 모살뜸』. 육심명의 사진집. 검은 모살뜸은 제주도 사투리로 검은 모래찜질을 뜻한다. 이런 모래찜질은 이 섬에서만 볼 수 있는 아주 오랜 옛날부터 이어져 내려온 전통적 민간요법이라 한다. 이 사진집은 우리 땅에서 살아가는 기층민의 전통적인 삶을 다루고 있다. [양장본][표지글]검은... ,66
13288,9788974091996,(구와바라 시세이) 내가 바라본 격동의 한국 :桑原史成 韓國寫眞全集 1964-2007 ,구와바라 시세이 [著],눈빛출판사,http://image.aladin.co.kr/product/291/18/cover/8974091992_1.jpg,"『구와바라 시세이 | 내가 바라본 격동의 한국 1964 - 2007』. 구와바라 시세이의 한국사진전집. 1960년부터 현재까지 한국의 격동적인 모습을 담아낸 사진집이다. 한일회담 반대시위에서부터 베트남 파병, 청계천과 판잣집, 미군 기지촌, 민주화운동 등 격동의 세월을 살아온 한국의 모습을 일본 사진작가의... ",66
13289,9788991841833,"향수, 과학 혹은 예술 =Perfume, the art or science of scent ","저자: 김상진,간수연",훈민사,http://image.aladin.co.kr/product/316/8/cover/899184183x_1.jpg,"[머리말]이 책에는 향의 역사,향의 정의와 표현법,추출법 등과 향료의 분류,OLFACTION,향수의 제조 및 향료산업의 현황,세계적인 유명향수에 대한 소개,향료의 안정성 및 품질관리,향료의 응용과 후각 연습을 통한 조향 실습방법 등에 대하여 서술하였다.",53
13290,9788962245288,(총명한 아이로 키우는) 용변훈련 ,미국소아과학회 지음 ;최용재 외 8명 옮김,이퍼블릭,http://image.aladin.co.kr/product/304/58/cover/8962245280_1.jpg,[표지글]용변훈련은 가장 힘들면서도 가장 큰 기쁨을 가져다 주는 육아 활동 중 하나이다. 이 지침서는 용변훈련에 관한 최신 연구와 미국 소아과학회의 최신 권장 지침에 기반을 두고 만들어졌다. 용변훈련은 아이와 부모가 함께 직면하는 발달상의 중요한 지표이다. 이 지침서를 통해 아이와 부모는 용변훈련을... ,19
13291,9788996202653,던전 앤 파이터 =프리스트 /Dungeon & fighter ,만든사람: [유앤유커뮤니케이션] 단행본팀,유앤유커뮤니케이션,https://image.aladin.co.kr/product/348/5/cover/8996202657_1.jpg,"던전앤파이터 인기 캐릭터인 '거너'를 다룬 가이드북. 거너의 전직과 각성, 스킬 다양한 스킬트리 분석은 까다로운 캐릭터 육성을 보다 쉽게 도와준다. 결투장에서 승률을 높이고 싶은 유저라면 콤보 가이드와 상대의 직업에 따른 대처방안을 상세하게 다룬 PVP가이드를 통해 고수들의 노하우를 엿볼 수 있다.",132
13292,9788996168034,제너럴 닥터 :어느 이상한 동네병원 이야기 ,"김승범,정혜진 지음",이상미디어,http://image.aladin.co.kr/product/339/28/cover/8996168033_1.jpg,"홍대앞 놀이터 근처의 수상한 공간, “여기가 정말 병원 맞나요?”어디 내놔도 결코 뒤지지 않을 핸드드립 커피와 치즈케이크를 파는 동네병원. 그러나 간단히 한 줄로만 설명할 수 없는 오묘하고 수상한 공간, 제너럴 닥터. 이곳을 처음 찾아온 손님들은 대개 둘 중 하나다. 병원이란 이야기를 듣고 찾아왔지만... ",6
13293,9788958241782,작은 유혹 :짧은 글 긴 여운의 특별한 이야기 : 송양의 단편소설 ,송양의,정은출판,http://image.aladin.co.kr/product/344/28/cover/8958241780_1.jpg,긴 여운을 남기는 짧은 글『작은 유혹』. 순간의 작은 유혹들이 엄청난 파장을 일으킬 수 있다는 내용을 그린 에피소드 19편을 콩트 형식의 단편소설로 엮었다. 바쁘게 살아가는 현대인들에게 생생한 감동을 선사하고자 했다.,4
13294,9788956406657,(현대문학 교수 350명이 뽑은) 2009 올해의 문제소설 ,한국현대소설학회 엮음,푸른사상사,http://image.aladin.co.kr/product/328/93/cover/8956406650_1.jpg,현대문학 교수 350명이 뽑은『2009 올해의 문제소설』. &lt;올해의 문제소설&gt;은 전국의 대학에서 현대소설을 연구하고 가르치는 교수들이 주축이 된 '한국현대소설학회'에서 매년 문예지에 발표된 소설들을 대상으로 선정하는 것이다. 한 해 동안 발표된 중단편 소설 가운데 가장 주목할 만한 소설들을... ,28
13295,9788996093657,생각풍경 :전향규 산문집 : 전향규 감성 에스프리 ,지은이: 전향규,시디안,http://image.aladin.co.kr/product/363/13/cover/8996093653_1.jpg,"오랫동안 언론 현장에서 일선 기자로, 편집장으로 세상을 섭렵해온 전직 언론인이자 시인 전향규가 인생 3막을 열어가는 지천명을 넘기면서 펴낸 자전적 산문집. 어머니, 형, 아들, 그리움, 눈물 등 일상의 잔잔한 풍경들을 담은 33편의 이야기들을 묶었다.",4
13296,9788990220998,지로 이야기 :시모무라 고진 장편소설,지은이: 시모무라 고진 ;옮긴이: 김욱,양철북,http://image.aladin.co.kr/product/404/82/cover/8990220998_1.jpg,"일본의 저명한 교육자이자 작가인 시모무라 고진이 20년 가까운 세월에 걸쳐 쓴 장편소설. 작가의 문학적 열정과 교육자로서의 생생한 경험이 녹아 있다. 시대 배경은 1920년~1930년대로, 주인공 지로가 태어나서 유·소년기를 거쳐 청년에 이르기까지 자기 세계를 개척하며 한 인격체로 커나가는 과정을 담은 성장 소설이다.",13
13297,9788959255566,기원의 탑 :韓國詩話選 ,정진권 지음,수필과비평사,http://image.aladin.co.kr/product/364/56/cover/8959255564_1.jpg,"[표지글]양녕은 소년 시절부터 문장에 능했다. 그러나 세종에게 성인의 덕이 있는 줄을 알고, 거짓으로 글을 모르는 것처럼, 미친 것처럼 스스로 방자히 굴었다. 태종이 비록 아버지였으나 그 아들인 양녕이 글 잘한다는 것을 미처 알지 못했다.",4
13298,9788962283273,열미초당필기 ,기윤 지음 ;이민숙 옮김,지식을만드는지식,http://image.aladin.co.kr/product/346/49/cover/8962283271_1.jpg,"&lt;열미초당필기&gt;는 기윤이 만년에 창작한 편폭이 일정치 않은 필기체 소설집이다. 다양한 소재의 이야기가 있지만 그중에서도 주로 여우와 귀신 이야기가 주를 이루며, 이를 빌어 인과응보를 설명하고 봉건도덕을 선양함으로써 세상을 교화하는 데 목적을 두었다. 소박한 문체, 짜임새 있는 이야기, 다양한 묘사를 통해 청대 지괴소설의 재미를 느낄 수 있다.",141
13299,9788962283242,아녀영웅전 ,문강 지음 ;김명신 옮김,지식을만드는지식,http://image.aladin.co.kr/product/346/49/cover/8962283247_1.jpg,"문강의 협의소설(俠義小說) &lt;아녀영웅전&gt;을 국내에 최초로 소개한다. 작품에 등장하는 이야기꾼 설서인(說書人)의 통속적인 어조와 북경어는 물론 방언과 문언, 백화 등 다양한 문체가 담겨 어학교본으로 쓰이는 등 언어 면에서 비상한 관심을 모았다.",141
13300,9788962283235,찻집 ,라오서 지음 ;신진호 옮김,지식을만드는지식,http://image.aladin.co.kr/product/346/48/cover/8962283239_1.jpg,"중국의 역사적 운명을 함축적으로 보여주는 비극, 중국 현대 문단의 대표적 소설가이자 극작가 라오서의 대표적 작품이다. &lt;찻집&gt;의 등장인물은 50년에 걸쳐 중국의 파란만장한 근현대사와 그 속에서 살아가는 온갖 부류의 인간들의 모습을 보여주고 있다.",11
13301,9788990220967,지로 이야기 :시모무라 고진 장편소설,지은이: 시모무라 고진 ;옮긴이: 김욱,양철북,https://bookthumb-phinf.pstatic.net/cover/015/267/01526788.jpg?type=m1&udate=20090421,"일본의 저명한 교육자이자 작가인 시모무라 고진이 20년 가까운 세월에 걸쳐 쓴 장편소설. 시대 배경은 1920년~1930년대로, 주인공 지로가 태어나서 유·소년기를 거쳐 청년에 이르기까지 자기 세계를 개척하며 한 인격체로 커나가는 과정을 담았다. 총 3권으로 구성되었으며, 1권에서는 지로의 유년시절을 이야기한다.",13
13302,9788990220974,지로 이야기 :시모무라 고진 장편소설,지은이: 시모무라 고진 ;옮긴이: 김욱,양철북,https://bookthumb-phinf.pstatic.net/cover/015/267/01526789.jpg?type=m1&udate=20090421,"일본의 저명한 교육자이자 작가인 시모무라 고진이 20년 가까운 세월에 걸쳐 쓴 장편소설. 시대 배경은 1920년~1930년대로, 주인공 지로가 태어나서 유·소년기를 거쳐 청년에 이르기까지 자기 세계를 개척하며 한 인격체로 커나가는 과정을 담았다. 총 3권으로 구성되었으며, 2권에서는 지로의 청소년 시절이 펼쳐진다.",13
13303,9788990220981,지로 이야기 :시모무라 고진 장편소설,지은이: 시모무라 고진 ;옮긴이: 김욱,양철북,https://bookthumb-phinf.pstatic.net/cover/015/267/01526790.jpg?type=m1&udate=20090529,"일본의 저명한 교육자이자 작가인 시모무라 고진이 20년 가까운 세월에 걸쳐 쓴 장편소설. 시대 배경은 1920년~1930년대로, 주인공 지로가 태어나서 유·소년기를 거쳐 청년에 이르기까지 자기 세계를 개척하며 한 인격체로 커나가는 과정을 담았다. 총 3권으로 구성되었으며, 3권에서는 청년 지로의 삶이 펼쳐진다.",13
13304,9788984989078,허망과 진실 :이병주의 동서양 고전탐사,이병주 지음,생각의나무,http://image.aladin.co.kr/product/273/80/cover/898498907x_1.jpg,시대를 초월하는 동서양 최고의 지성!불세출의 작가 이병주가 찾아낸 살아 있는 고전의 향기!문자와 이미지가 소통하는 영상문화시대를 위한『우리가 아직 몰랐던 세계의 교양』시리즈. 여러 분야의 지식을 망라하여 화려한 컬러도판으로 깔끔하게 편집한 교양 인문서이다. 전문적이고 풍부한 내용과 엄선된... ,83
13305,9788984989085,허망과 진실 :이병주의 동서양 고전탐사,이병주 지음,생각의나무,http://image.aladin.co.kr/product/273/80/cover/8984989088_1.jpg,시대를 초월하는 동서양 최고의 지성!불세출의 작가 이병주가 찾아낸 살아 있는 고전의 향기!문자와 이미지가 소통하는 영상문화시대를 위한『우리가 아직 몰랐던 세계의 교양』시리즈. 여러 분야의 지식을 망라하여 화려한 컬러도판으로 깔끔하게 편집한 교양 인문서이다. 전문적이고 풍부한 내용과 엄선된... ,83
13306,9788925240213,도서관혁명 ,저자: Hiro Arikawa ;역자: 민용식,대원씨아이,https://bookthumb-phinf.pstatic.net/cover/053/333/05333385.jpg?type=m1&udate=20160408,책을 둘러싼 전쟁과 사랑의 이야기를 그린 아리카와 히로의 &lt;도서관 시리즈&gt; 네 번째 이야기『도서관 혁명』. 미디어의 검열을 강화하는 법률인 '미디어양화법'이 시행된 지 30년. 그 검열과 검열권의 무력에 대항하기 위해서 '도서관자유법'과 도서대가 등장하게 된다. 그 도서대의 정예부대인... ,38
13307,9788925256573,레진 캐스트 밀크 =플래그먼트.Resin cast milk ,저자: Yu Fujiwara ;역자: 최재한,대원씨아이,https://bookthumb-phinf.pstatic.net/cover/062/182/06218285.jpg?type=m1&udate=20100411,레진 캐스트 밀크 외전 제2탄. 캐스트와 관련된 일련의 사건이 모두 끝나고 하사마 학원에 평화로운 일상이 돌아왔다. 그리고 오늘은 다들 기다려온 하사마 학원의 축제날. 하지만 쇼코는 완전히 얌전해진 미츠의 상태가 마음에 걸리는데...,38
13308,9788925244419,레진 캐스트 밀크 =플래그먼트.Resin cast milk ,저자: Yu Fujiwara ;역자: 최재한,대원씨아이,https://image.aladin.co.kr/product/358/15/cover/8925244411_1.jpg,주말의 놀이공원. 고등학교 1학년인 키지마 쇼코는 표면적으로는 사촌오빠이자 선배인 아키라와 풋풋한 데이트를 하고 있었다. 하지만 그곳에는 또 한 명의 비밀스런 커플이 와 있었는데…. 조금 사연이 있는 특이한 소녀와 그 친구들이 보내는 포복절도한 일상이 펼쳐진다.,38
13309,9788956990835,"평생 뇌력 6살에 결정된다 :뇌력의 기초가 완성되는 0~6세, 엄마는 뭘 하면 좋을까? ",뇌과학과자녀교육연구회 지음 ;김경인 옮김,한문화멀티미디어,http://image.aladin.co.kr/product/351/83/cover/8956990832_1.jpg,"무한한 가능성을 지닌 우리 아이의 뇌를 언제, 어떻게 발달시켜 주어야 할까? &lt;평생뇌력, 6살에 결정된다&gt;는 이 질문에 답하는 책이다. 그동안 눈부시게 발전해온 뇌과학의 성과를 자녀교육과 접목하여 아이의 뇌가 어떤 과정을 거쳐 발달하는지를 보여준다. 또한 7장에 걸쳐 아이의 뇌력을 키우기 위해 생활 속에서 실천할 수 있는 구체적인 방법 81가지를 제시한다.",19
13310,9788925532318,연애사진 ,이치카와 다쿠지 지음 ;양윤옥 옮김,랜덤하우스코리아,http://image.aladin.co.kr/product/364/10/cover/892553231x_1.jpg,"의 작가 이치카와 다쿠지의 장편소설. 사람들과 늘 거리두기를 하는 남자 마코토와 사랑에 빠져서는 안 될 비밀을 간직한 여자 시즈루의, 떠난 뒤에야 깨닫게 되는 첫사랑 이야기를 담았다. 이 소설은 작가 이치카와 다쿠지가 영화 [연애사진]의 오마주로 집필한 작품이다.",41
13311,9788981727871,서예 미학과 기법 ,장이 지음 ;정현숙 옮김,교우사,http://image.aladin.co.kr/product/339/63/cover/8981727872_1.jpg,"『서예 미학과 기법』. 이 책은 중국 서예에 대한 최고의 개론서이다. 장이는 아홉 개의 장에서 풍부한 도판을 예로 제시하면서 리듬, 선, 구성이 완전하게 구체화된 중국 서예의 미학과 기법을 설명한다. [양장본]",16
13312,9788931549621,DSLR에 미쳐라 ,허석 지음 ;기획: 사람과사람,성안당.com,http://image.aladin.co.kr/product/96/37/cover/8931549628_1.jpg,"다양한 사진 촬영 환경과 상황에 적합한 여러 가지 테크닉을 수록했으며 20가지 에피소드별로 DSLR 사용자가 반드시 알아야 할 정보와 촬영 노하우, 사진 예제, 포토샵 후보정 테크닉을  함께 소개한다.",132
13313,9788980691968,연탄불 연가 :채천수 시조집 ,채천수,그루,http://image.aladin.co.kr/product/357/43/cover/8980691963_1.jpg,"1991년 「조선일보」 신춘문예를 통해 등단하였으며, 시조집 &lt;상다리 세 발에 얹힌 저녁밥&gt;, &lt;발품&gt;을 출간한 채천수 시인의 시조집. 시인은 우리 주위의 보통 사람, 평범한 이웃의 다양한 삶에 천착해서 당대 삶의 진정성을 살린다. 시조집은 총 6부로 구성되어 있다.",3
13314,9788996014058,한중 고전소설 연구자료의 새 지평 ,한중고전소설인명·지명대사전편찬연구팀 [편],채륜,http://image.aladin.co.kr/product/335/41/cover/8996014052_1.jpg,"▶책 소개 이 책은 자료적 가치가 높은 고전소설 작품이나 이본을 새롭게 발굴 연구한 글이다. 총 3부로 , 제1부에는 문성기&#8228;정와기몽&#8228;유장옥전 등 새롭게 발굴 소개한 몇몇 한국소설에 대한 작품론 성격의 글을 수록하였고, 2부에는 &#985172;화몽집&#985173;&#8228;토공전&#8228;강로전 등 자료적 가치가... ",72
13315,9788996014089,그대들이 거기 그렇게 :사는 바른 길 찾기 : 정현기 문학비평집 ,정현기,채륜,http://image.aladin.co.kr/product/337/4/cover/8996014087_1.jpg,1969년 「문학사상」에서 문학평론에 당선되면서 비평활동을 시작한 비평가 정현기의 평론집. 2005년도에 펴낸 에 이어 4년 만에 선보이는 평론집이다. 이번 평론집에서 저자는 '좋은 글이란 정말 어떤 것일까?'라고 여러 번 묻는다.,72
13316,9788925244471,토우도가는 강령사,저자: Hyosuke Takato ;역자: 김승현,대원씨아이,https://image.aladin.co.kr/product/358/15/cover/8925244470_1.jpg,"제14회 전격소설대상 은상 수상작. 신이치로와 미코토는 어떤 소년을 호위하라는 명령을 받고 인간계에 내려온다. 호위 대상인 토우도 슈지라는 소년과 그 쌍둥이 누나 하루나가 사는 토우도가(家)에 쳐들어가 우격다짐으로 눌러앉는 신이치로와 미코토. 점차 가족처럼 정이 들어가던 어느 날, 소년이 불의의 습격을 당하는데…",38
13317,9788925248660,토우도가는 강령사,저자: Hyosuke Takato ;역자: 김승현,대원씨아이,https://image.aladin.co.kr/product/439/24/cover/8925248662_1.jpg,토우도가에서 평온한 생활을 시작한 신이치로와 미코토 앞에 수상한 남자가 나타난다. 아프로 머리에 선글라스를 쓴 외모에 댄스가 특기라는 희한한 녀석. 게다가 신기한 힘을 보이는 일피니를 갖고 있는데…. 무심코 휘둘렀다가 터무니없는 사태를 맞이하게 된 것은… 토우도가의 하루나?,38
13318,9788925252599,토우도가는 강령사,저자: Hyosuke Takato ;역자: 김승현,대원씨아이,https://image.aladin.co.kr/product/473/79/cover/8925252597_1.jpg,"토우도 남매와 친구 사키와 함께 놀이공원에 놀러간 신이치로와 미코토. 그러나 그곳에서 하테비토의 습격을 받아 고전을 면치 못하는 두 사람의 앞에 나타난 것은 다름 아닌 북구 세력의 레테. 레테와 그 부하 미리카는 토우도가에 새 식구로 들어와 머물게 되는데, 과연 그 목적은?",38
13319,9788992179171,속마음 :쿠리수닭곰 카툰 ,글·그림: 쿠리수,리브리언,http://image.aladin.co.kr/product/246/38/cover/8992179170_1.jpg,"내가 겪고, 내가 느끼고, 그래서 내 마음 속에 담긴 말들을 예쁜 카툰과 함께 풀어 담은 카툰에세이. 저자가 네이버 블로그(blog.naver.com/koorisu)에 연재한 카툰들을 책으로 엮었다. 일생 생활에서 느낄 수 있는 잔잔한 감동들과 유머들을 귀엽고, 깜찍한 그림들로 표현하고, 감성이 넘치는 글로 채워넣은... ",4
