id,isbn,title,author,publisher,image_url,content,genre_detail_dict_id
1252,9788965743934,한강 :조정래 대하소설 ,저자: 조정래,해냄(해냄출판사),https://image.aladin.co.kr/product/25726/24/cover/8965743931_1.jpg,&lt;아리랑&gt;을 지나 &lt;태백산맥&gt;을 거쳐 우리 민족의 파란만장한 근현대사 1세기를 완성한 한국문학의 기념비 &lt;한강&gt;이 100쇄를 돌파하고 조정래 작가 등단 50주년을 맞이하여 개정판으로 출간되었다.,28
1253,9788965743941,한강 :조정래 대하소설 ,저자: 조정래,해냄(해냄출판사),https://image.aladin.co.kr/product/25726/25/cover/896574394x_1.jpg,&lt;아리랑&gt;을 지나 &lt;태백산맥&gt;을 거쳐 우리 민족의 파란만장한 근현대사 1세기를 완성한 한국문학의 기념비 &lt;한강&gt;이 100쇄를 돌파하고 조정래 작가 등단 50주년을 맞이하여 개정판으로 출간되었다.,28
1254,9788965743958,한강 :조정래 대하소설 ,저자: 조정래,해냄(해냄출판사),https://image.aladin.co.kr/product/25726/27/cover/8965743958_1.jpg,&lt;아리랑&gt;을 지나 &lt;태백산맥&gt;을 거쳐 우리 민족의 파란만장한 근현대사 1세기를 완성한 한국문학의 기념비 &lt;한강&gt;이 100쇄를 돌파하고 조정래 작가 등단 50주년을 맞이하여 개정판으로 출간되었다.,28
1255,9788965743965,한강 :조정래 대하소설 ,저자: 조정래,해냄(해냄출판사),https://image.aladin.co.kr/product/25726/28/cover/8965743966_1.jpg,&lt;아리랑&gt;을 지나 &lt;태백산맥&gt;을 거쳐 우리 민족의 파란만장한 근현대사 1세기를 완성한 한국문학의 기념비 &lt;한강&gt;이 100쇄를 돌파하고 조정래 작가 등단 50주년을 맞이하여 개정판으로 출간되었다.,28
1256,9788965743972,한강 :조정래 대하소설 ,저자: 조정래,해냄(해냄출판사),https://image.aladin.co.kr/product/25726/29/cover/8965743974_1.jpg,&lt;아리랑&gt;을 지나 &lt;태백산맥&gt;을 거쳐 우리 민족의 파란만장한 근현대사 1세기를 완성한 한국문학의 기념비 &lt;한강&gt;이 100쇄를 돌파하고 조정래 작가 등단 50주년을 맞이하여 개정판으로 출간되었다.,28
1257,9788965743989,한강 :조정래 대하소설 ,저자: 조정래,해냄(해냄출판사),https://image.aladin.co.kr/product/25726/30/cover/8965743982_1.jpg,&lt;아리랑&gt;을 지나 &lt;태백산맥&gt;을 거쳐 우리 민족의 파란만장한 근현대사 1세기를 완성한 한국문학의 기념비 &lt;한강&gt;이 100쇄를 돌파하고 조정래 작가 등단 50주년을 맞이하여 개정판으로 출간되었다.,28
1258,9788965743996,한강 :조정래 대하소설 ,저자: 조정래,해냄(해냄출판사),https://image.aladin.co.kr/product/25726/31/cover/8965743990_1.jpg,&lt;아리랑&gt;을 지나 &lt;태백산맥&gt;을 거쳐 우리 민족의 파란만장한 근현대사 1세기를 완성한 한국문학의 기념비 &lt;한강&gt;이 100쇄를 돌파하고 조정래 작가 등단 50주년을 맞이하여 개정판으로 출간되었다.,28
1259,9788965744009,한강 :조정래 대하소설 ,저자: 조정래,해냄(해냄출판사),https://image.aladin.co.kr/product/25726/31/cover/8965744008_1.jpg,&lt;아리랑&gt;을 지나 &lt;태백산맥&gt;을 거쳐 우리 민족의 파란만장한 근현대사 1세기를 완성한 한국문학의 기념비 &lt;한강&gt;이 100쇄를 돌파하고 조정래 작가 등단 50주년을 맞이하여 개정판으로 출간되었다.,28
1260,9791190901086,모빌리티와 영화 ,김희경 지음,앨피,https://image.aladin.co.kr/product/25710/54/cover/k552736773_1.jpg,"영화의 어원이 ‘모빌리티(mobility)’와 같은 ‘움직이다(movere)’임을 아는 사람은 드물다. 이 책은 말하고, 행동하고, 이동하는 움직임으로 이루어진 영화가 결국은 우리 인간의 이동 욕망과 그 표현의 산물임을 재확인한다.",2
1261,9791189129729,눈을 감고 순간을 채우다 ,"지은이: 정호준,오세하",꿈공장 플러스,https://image.aladin.co.kr/product/25467/72/cover/k362633820_1.jpg,"감성을 일깨우는 작품으로 SNS를 통해 독자들의 많은 호응을 받는 네 명의 시인이 모였다. &lt;눈을 감고 순간을 채우다&gt;는 시제 아래 저마다의 감성으로 독자들을 만난다. 치열하게 이 세상을 사는 우리에게 건네는 감성의 메시지. 계절이 깊어가는 시간, 당신을 감싸 줄 따뜻한 시 한 편을 만나보자.",3
1262,9791189129750,내 머리 위에 나무가 자란다 :임훈 시집 ,지은이: 임훈,꿈공장 플러스,https://image.aladin.co.kr/product/25835/30/cover/k142736436_1.jpg,임훈 시집. &lt;내 머리 위에 나무가 자란다&gt;는 지구 상에서 가장 오래 사는 4900년 된 므두셀라 같은 영적으로 성장하는 신성한 나무를 상징한다.,3
1263,9788925589749,초한지 ,이문열 지음,RHK(알에이치코리아),https://image.aladin.co.kr/product/25493/55/cover/8925589745_1.jpg,"한 시대를 대표한 거장 이문열 작가의 역사 소설 『이문열 초한지』가 초판 이후 10여 년이 지난 지금, 코로나라는 극명한 난세 앞에 다시 나타났다. 이번 개정 신판은 작가가 환골탈태의 마음으로 6개월 동안 시대 상황을 고려한 보완 및 수정 작업을 거듭해 탄생한 책이다.",121
1264,9788925589732,초한지 ,이문열 지음,RHK(알에이치코리아),https://image.aladin.co.kr/product/25493/56/cover/8925589737_1.jpg,"한 시대를 대표한 거장 이문열 작가의 역사 소설 『이문열 초한지』가 초판 이후 10여 년이 지난 지금, 코로나라는 극명한 난세 앞에 다시 나타났다. 이번 개정 신판은 작가가 환골탈태의 마음으로 6개월 동안 시대 상황을 고려한 보완 및 수정 작업을 거듭해 탄생한 책이다.",121
1265,9788925589725,초한지 ,이문열 지음,RHK(알에이치코리아),https://image.aladin.co.kr/product/25493/57/cover/8925589729_1.jpg,"한 시대를 대표한 거장 이문열 작가의 역사 소설 『이문열 초한지』가 초판 이후 10여 년이 지난 지금, 코로나라는 극명한 난세 앞에 다시 나타났다. 이번 개정 신판은 작가가 환골탈태의 마음으로 6개월 동안 시대 상황을 고려한 보완 및 수정 작업을 거듭해 탄생한 책이다.",121
1266,9788925589718,초한지 ,이문열 지음,RHK(알에이치코리아),https://image.aladin.co.kr/product/25493/66/cover/8925589710_1.jpg,"한 시대를 대표한 거장 이문열 작가의 역사 소설 『이문열 초한지』가 초판 이후 10여 년이 지난 지금, 코로나라는 극명한 난세 앞에 다시 나타났다. 이번 개정 신판은 작가가 환골탈태의 마음으로 6개월 동안 시대 상황을 고려한 보완 및 수정 작업을 거듭해 탄생한 책이다.",121
1267,9788925589701,초한지 ,이문열 지음,RHK(알에이치코리아),https://image.aladin.co.kr/product/25493/66/cover/8925589702_1.jpg,"한 시대를 대표한 거장 이문열 작가의 역사 소설 『이문열 초한지』가 초판 이후 10여 년이 지난 지금, 코로나라는 극명한 난세 앞에 다시 나타났다. 이번 개정 신판은 작가가 환골탈태의 마음으로 6개월 동안 시대 상황을 고려한 보완 및 수정 작업을 거듭해 탄생한 책이다.",121
1268,9788925589695,초한지 ,이문열 지음,RHK(알에이치코리아),https://image.aladin.co.kr/product/25493/66/cover/8925589699_1.jpg,"한 시대를 대표한 거장 이문열 작가의 역사 소설 『이문열 초한지』가 초판 이후 10여 년이 지난 지금, 코로나라는 극명한 난세 앞에 다시 나타났다. 이번 개정 신판은 작가가 환골탈태의 마음으로 6개월 동안 시대 상황을 고려한 보완 및 수정 작업을 거듭해 탄생한 책이다.",121
1269,9788925589688,초한지 ,이문열 지음,RHK(알에이치코리아),https://image.aladin.co.kr/product/25493/67/cover/8925589680_1.jpg,"한 시대를 대표한 거장 이문열 작가의 역사 소설 『이문열 초한지』가 초판 이후 10여 년이 지난 지금, 코로나라는 극명한 난세 앞에 다시 나타났다. 이번 개정 신판은 작가가 환골탈태의 마음으로 6개월 동안 시대 상황을 고려한 보완 및 수정 작업을 거듭해 탄생한 책이다.",121
1270,9788925589671,초한지 ,이문열 지음,RHK(알에이치코리아),https://image.aladin.co.kr/product/25493/67/cover/8925589672_1.jpg,"한 시대를 대표한 거장 이문열 작가의 역사 소설 『이문열 초한지』가 초판 이후 10여 년이 지난 지금, 코로나라는 극명한 난세 앞에 다시 나타났다. 이번 개정 신판은 작가가 환골탈태의 마음으로 6개월 동안 시대 상황을 고려한 보완 및 수정 작업을 거듭해 탄생한 책이다.",121
1271,9788925589664,초한지 ,이문열 지음,RHK(알에이치코리아),https://image.aladin.co.kr/product/25493/70/cover/8925589664_1.jpg,"한 시대를 대표한 거장 이문열 작가의 역사 소설 『이문열 초한지』가 초판 이후 10여 년이 지난 지금, 코로나라는 극명한 난세 앞에 다시 나타났다. 이번 개정 신판은 작가가 환골탈태의 마음으로 6개월 동안 시대 상황을 고려한 보완 및 수정 작업을 거듭해 탄생한 책이다.",121
1272,9788925589657,초한지 ,이문열 지음,RHK(알에이치코리아),https://image.aladin.co.kr/product/25493/73/cover/8925589656_1.jpg,세대를 거듭해도 여전히 사랑받고 있는 『이문열 초한지』세트(1∼0권)가&#x0D;새롭게 보완된 개정 신판으로 독자들을 다시 찾았다!&#x0D;&#x0D;그 어떤 『초한지』보다 역사적 디테일과 사료가 충실해&#x0D;이문열 작품 중 진정한 수작으로 평가받고 있는 바로 그 책!&#x0D;&#x0D;혼탁한 이 시대에 꼭 읽어야 할 인생... ,121
1273,9788925589640,초한지 ,이문열 지음,RHK(알에이치코리아),https://image.aladin.co.kr/product/25493/76/cover/8925589648_1.jpg,세대를 거듭해도 여전히 사랑받고 있는 『이문열 초한지』세트(1∼0권)가&#x0D;새롭게 보완된 개정 신판으로 독자들을 다시 찾았다!&#x0D;&#x0D;그 어떤 『초한지』보다 역사적 디테일과 사료가 충실해&#x0D;이문열 작품 중 진정한 수작으로 평가받고 있는 바로 그 책!&#x0D;&#x0D;혼탁한 이 시대에 꼭 읽어야 할 인생... ,121
1274,9788925589565,빨강 머리 앤 ,루시 모드 몽고메리 지음 ;박혜원 옮김,RHK(알에이치코리아),https://image.aladin.co.kr/product/25592/70/cover/8925589567_1.jpg,"앤처럼 상상하기를 좋아하고 자신만의 작품세계를 활발히 펼치고 있는 설찌 작가의 손에서, 놀라우리만큼 개성 넘치고 사랑스러운 앤으로 재탄생했다. 11살 꼬마 앤부터 어느새 마릴라보다 키가 커버린 앤의 모습까지, 따뜻한 색감으로 가득 찬 소설 속 세계로 풍덩 빠져보자.",86
1275,9791188678983,어린친구 :외손자 성장 에세이 ,지은이: 이영애,두손컴,https://bookthumb-phinf.pstatic.net/cover/175/834/17583499.jpg?type=m1&udate=20201207,오늘날은 손주를 할머니가 돌봐주는 집이 많다.존엄한 어린 생명의 성장을 지켜보면서 세상의 대지에 뿌리를 잘 내리도록 정성을 다한다. 이 글을 통해 가정과 사회가 더욱 따뜻해지기를 바라는 마음에서 수필집을 출간한다.인천공항은 사람들로 붐빈다. 딸과 사위는 짐을 탁송하려고 미국행 라인에 줄 서... ,4
1276,9791189129705,당신만 없는 그리움 :이태우 시집 ,지은이: 이태우,꿈공장 플러스,https://image.aladin.co.kr/product/25430/43/cover/k952633413_1.jpg,"이태우 시집 &lt;당신만 없는 그리움&gt;은 그리움의 대상이 늘 닿기 힘든 곳에 있음을 이야기한다. 그리움이란 곁에 없는 누군가 또는 무언가에 대한 마음이기 때문이다. 손에 닿지 않는 것이 사랑이든 꿈이든, 그래서 어떠한 감정을 품든 결국 오늘을 살게 한다. 때론 눈물에 젖어있다 해도.",3
1277,9791186809983,카라마조프 가의 형제들 ,도스토옙스키 지음 ;이길주 편역,아름다운 날,https://image.aladin.co.kr/product/25805/14/cover/k212736338_1.jpg,"도스토옙스키 최후의 작품으로 그의 모든 사상, 예술관, 종교관이 집대성된 걸작. 도스토옙스키의 사상과 미학의 주요 특징을 모두 아우르고 있으며, 주요 인물들과 스토리의 역동성, 내적 서사가 일반인의 상상을 뛰어넘는 무게와 깊이로 독자들에게 충격을 가하는 문제작이다.",125
1278,9791197224300,Betsy without 'S' :무면허 번역가의 번역 이야기 ,글·그림: 이어떤,어떤,https://image.aladin.co.kr/product/25708/61/cover/k042736771_1.jpg,"14살 중학생 시절 영미 청소년 작가 Betsy Byars의  원서를 번역한 것을 계기로 10년 동안 오직 한 작가, 한 소설을 10번도 넘게 번역했던 저자의 에세이다.",4
1279,9788989449775,붉은 눈동자 :이상문 장편소설 ,지은이: 이상문,인북스,https://image.aladin.co.kr/product/25629/22/cover/8989449774_1.jpg,"전쟁이 끝난 지 45년이 지난 이 시점에서 베트남전쟁을 조명하며 그 전쟁의 정신적, 신체적 후유증에 시달리는 참전군인들의 노년 삶을 다루고 있다. 그러면서 시대의 비극에 휩쓸려 좌절하고 상처 입은 인간들을 향해, 위로와 용서의 손길을 내밀어 화해와 치유를 모색하고 있다.",28
1280,9791197066924,"(소박하게 먹고, 적당히 자고,) 오늘부터 걷기 =Eat well, sleep well, and walking from today! ",김진영 지음,민리,https://bookthumb-phinf.pstatic.net/cover/174/671/17467187.jpg?type=m1&udate=20201119,2020년은 코로나로 인해 대부분의 사람들이 몸과 정신이 고통을 받고 지쳐가고 있다. 이러한 힘든 시기를 잘 헤쳐나가고앞으로 다가올 어떠한 위험에 있어 개인이 헤쳐나갈 수 있는 방법은 없을까?이 책에는 이비인후과 의사이자 다둥이 아빠인 김진영 의사는 '걷기'에 대한 철학과 소신을 고스란히 담고 있다.... ,4
1281,9791189129699,아무도 괜찮냐고 묻지 않았다 :고혜진 에세이 ,지은이: 고혜진 ;캘리그라피: 이종건,꿈공장 플러스,https://image.aladin.co.kr/product/25430/24/cover/k292633412_1.jpg,"가족이 아프면 겪게 되는 것들, 자꾸만 찾아와 모든 것을 뒤흔드는 장마와 그럼에도 불구하고 포기할 수 없는 소중한 삶에 대하여. 삶과 죽음 그리고 가족을 돌아보게 만드는 첫째나무 고혜진 에세이.",4
1282,9791189129743,익숙함을 지워가는 시간 ,"지은이: 차현주,정혜원",꿈공장 플러스,https://image.aladin.co.kr/product/25467/93/cover/k982633821_1.jpg,세상이 붉게 물들어가는 계절. 또 한 번 익숙함과 결별해야 하는 시간이다. 세상도 사람도 그렇게 흘러만 간다. 여기 다섯 시인의 마음을 고스란히 담았다. &lt;익숙함을 지워가는 시간&gt;은 다섯 가지 색을 담은 매력 시집이다.,3
1283,9791166031106,"포물선, 마주보기 :김애경(金愛鏡) 수필집 ",김애경,한국학술정보,https://image.aladin.co.kr/product/25353/83/cover/k432633603_1.jpg,"인생이란 전혀 예상하지 못한 길로 들어설 수 있다는 것을 실감한다. 하지만 전혀 새로운 길이 아닐 것이다. 언젠가 내가 품고 있던 생각이 발현된 것이라고 생각하니, 새삼 어떻게 무슨 생각을 하고 사느냐가 삶을 앞으로 나아가게 하는 힘이 된다는 생각이 든다.",4
1284,9791190844093,굿머니 :모금가 김효진의 돈과 사람 이야기 ,지은이: 김효진,이소노미아,https://image.aladin.co.kr/product/25494/38/cover/k912633028_1.jpg,"돈에 관한 책이다. 그러나 사람들이 잘 모르는 돈, 그리고 그 돈이 만들어내는 미지의 세계를 다룬다. 돈이 모이는 곳에는 사람들도 모인다. 그들은 어떤 사람들일까? 수많은 기부자를 만났고, 수많은 모금 캠페인에 관여했으며, 다양한 '지원받는자'를 만난 베테랑 모금가의 생각과 경험이 한 권의 책으로 묶였다.",4
1285,9788970124858,감염병과 사회 :페스트에서 코로나19까지 ,프랭크 M. 스노든 지음 ;홍수연 옮김,문학사상,https://image.aladin.co.kr/product/25702/28/cover/8970124853_1.jpg,"페스트 시대부터 오늘날까지 무수히 발생한 감염병이 어떻게 인간 사회를 형성했는지 눈여겨보며 감염병의 영향력을 두루 탐색한다. 저자 프랭크 M. 스노든은 질병이 의학과 공중보건에 영향을 미친 과정은 물론, 예술과 종교, 지성사, 전쟁에 변화를 가한 과정도 설명한다.",2
1286,9788932920665,"사냥꾼, 목동, 비평가 :디지털 거대 기업에 맞서 인간적 삶을 지키는 법 ",리하르트 다비트 프레히트 지음 ;박종대 옮김,열린책들,https://image.aladin.co.kr/product/25726/49/cover/8932920664_1.jpg,"슈피겔 베스트셀러 1위, 23만 부 판매!현대 독일 철학의 아이콘 프레히트가 본 디지털 사회독일에서 가장 주목받는 철학자이자 개성 넘치는 지성인으로 평가받는 리하르트 다비트 프레히트의 『사냥꾼, 목동, 비평가』가 열린책들에서 출간되었다. 프레히트는 이미 국내 출간된 〈철학하는 철학사〉 시리즈에서... ",8
1287,9791159923234,사랑을 말할 때 우리는 :김한아 소설집 ,지은이: 김한아,알마,https://image.aladin.co.kr/product/24790/62/cover/k692736773_1.jpg,"십 대의 시선으로 다양한 사랑의 형태를 편견 없이 따뜻하게 풀어내는 김한아의 소설집. 중학교 2학년인 ‘여름’과 ‘한나’의 ‘사랑, 그 설렘 가득한 풋풋함과 위태로움을 다룬 표제작 '사랑을 말할 때 우리는' 등 네 작품이 수록되었다.",28
1288,9791165120191,패엽경 :김도연 산문집 ,지은이: 김도연,북인,https://image.aladin.co.kr/product/25704/50/cover/k242736667_1.jpg,"1991년 강원일보 신춘문예, 1996년 경인일보 신춘문예, 2000년 여름 중앙일보 중앙신인문학상에 소설이 당선된 후 30년 동안 10여 권의 소설집, 장편소설, 산문집을 펴냈던 김도연 소설가가 페이스북에 올렸던 단상들을 모아 『패엽경』을 출간했다.",4
1289,9791158587260,니 누꼬? :한국 경제의 산업화 과정에 참여한 어느 무명 용사의 회고록 ,지은이: 정진태,밥북,https://image.aladin.co.kr/product/25508/87/cover/k192633124_1.jpg,"1인당 국민 소득이 67불에 불과했던 해에 세계 최빈국 태어나 후진국 중진국을 넘어 대한민국이 선진국에 다다르기까지, 일생을 수출 전선에서 좌충우돌해온 작가의 회고록이다.",4
1290,9791160946925,아직 오지 않은 나에게 :이정록 청춘 시집 ,지은이: 이정록 ;그린이: 최보윤,사계절(사계절출판사),https://image.aladin.co.kr/product/25684/5/cover/k172735341_1.jpg,"'청춘시집'으로 선보이는 이정록 시인의 신간으로, 한치 앞도 알 수 없는 미래 앞에서 잘될 거라는 막연한 믿음으로 불안한 하루를 보내는 청춘들에게 보내는 시인의 다정하고 명랑한 위로를 담았다.",3
1291,9788937475283,밤엔 더 용감하지 =Braver at Night ,지은이: 앤 섹스턴 ;옮긴이: 정은귀,민음사,https://image.aladin.co.kr/product/25711/24/cover/8937475286_1.jpg,20세기 미국 대표 시인 앤 섹스턴의 시선집 &lt;밤엔 더 용감하지&gt;가 '세계시인선' 28번으로 출간되었다. 시인의 대표작 여섯 권 중에서 특히 작품성과 대중성을 모두 갖춘 예순여덟 편을 모았다.,3
1292,9791163032014,된다! 맥북&아이맥 :맥OS 빅 서 2021판 ,"김기백,정다운 지음",이지스퍼블리싱,https://image.aladin.co.kr/product/25694/45/cover/k012736561_1.jpg,"‘맥북 분야 1위’를 차지한 《된다! 맥북&아이맥》이 맥OS 최신 버전인 빅 서에 맞춰 전면 개정되었다. 이번 개정판에서는 업데이트된 사파리의 다양한 기능과 아이폰, 아이패드와 연동 활용하는 방법을 추가했다.",123
1293,9791197208201,보수를 보수하라 :조용균 변호사의 대한민국 개조 프로젝트 ,조용균 지음,푸른솔,https://image.aladin.co.kr/product/25578/32/cover/k472735484_1.jpg,이 땅에 진정한 보수를 세우기 위해서는 무엇이 필요한지를 구체적으로 밝힌 책이다. ‘과연 대한민국에 보수주의라고 주장할 만한 어떤 정치적 정체성이 존재하는가’라는 저자의 근본적 질문에 따른 결과물이다.,115
1294,9791188768318,무위자연 휴선의 삶 :휴식과 힐링이 필요한 사람들을 위하여 ,조명상 지음,Book Star(북스타),https://image.aladin.co.kr/product/25755/1/cover/k612736108_1.jpg,"휴선 인문학 공부에 전념해 온 저자는 노자 무위자연의 개념 속에 『도덕경』을 접하게 되었고 휴를 덕으로, 선을 도로 이해하기 시작했으며 노자 무위자연의 사상과 명상(明祥)의 자연 물질 작용을 휴선문화로 접합하여 인류학 및 인문학으로 접근시키는 데 도움이 되었다.",47
1295,9788973275670,수사반장 :TV극본 ,글쓴이: 김상열 ;엮은이: 한보경,백산서당,https://image.aladin.co.kr/product/25262/19/cover/8973275674_1.jpg,고석만 (PD. 〈나는 드라마로 시대를 기록했다〉 저자)의 머리말“모짜르트를 만나다”1978년 MBC의 가을개편에서 간판 프로그램 〈수사반장〉의 연출을 맡게 되었다. 1971년에 시작했으니 이제 변곡점을 맞이한 프로그램이다. 그때 드라마 부장도 바뀌었다. 문화부 관료로 있다가 KBS 편성부를 거쳐... ,11
1296,9788973275687,수사반장 :TV극본 ,글쓴이: 김상열 ;엮은이: 한보경,백산서당,https://image.aladin.co.kr/product/25262/21/cover/8973275682_1.jpg,"고석만 (PD. 〈나는 드라마로 시대를 기록했다〉 저자)의 머리말“죽음을 향해 살다”파우더 스노우가 날리는 ‘삿포로’에서, 노벨문학상의 ‘가와바다’와 함께 탄 타워 열차.눈에서 시작하여 불에서 끝나는 소설 〈설국(雪國)〉을 배경으로, 일본의 ‘사무라이’ 이야기를 해보자 했다. 거기엔 만주... ",11
1297,9791166031687,가난 :학술연구-상담심리 ,박찬중 지음,한국학술정보,https://image.aladin.co.kr/product/25495/6/cover/k762633028_1.jpg,"가난과 죽음을 어떻게 연관 지을 수 있냐고 물었죠? 가난은 ‘원하는데 가질 수 없는 것입니다. 원치 않는데 잃어버리는 것입니다.’ 불안, 어둠, 분주함, 초조함, 속상함, 슬픔, 외로움, 화남, 소심함, 좌절, 자책, 술, 담배가 가난입니다. 가난의 또 다른 얼굴들이죠. 가난의 가면들이죠. 자격지심이라, 트라우마라.... ",67
1298,9788973275694,전쟁사와 무기체계론 =History of war and theory of the weapons system ,지은이: 김성진,백산서당,https://image.aladin.co.kr/product/25270/52/cover/8973275690_1.jpg,"군사학총서 전7권 가운데 제2권이다. 과학 기술의 발달과 무기체계를 연계시켜 전쟁 양상과 수행 방식의 변천 과정 등을 구체적으로 예시(例示)하고, 야전에서 필요한 소화기에서 화력ㆍ통신장비, 헬기 전력 등에 관한 기초 지식을 포함하고 있다.",20
1299,9791158138783,일러스트레이터(illustrator) 따라하기 ,저자: 박대진,구민사,https://image.aladin.co.kr/product/25506/78/cover/k882633128_1.jpg,단품 실습 등 프로젝트 실습 제작 위주로 구성하였다. 누구나 따라하기쉽게 구성하였으며 실제 제작한 샘플과 일러스트레이터 파일을 제공하여 쉽게 일러스트레이터 프로그램에 접근할 수 있다.,1
1300,9791189998332,고양이에게 물어봐 :발칙하고 도도한 고양이의 인생 해결법 ,"지은이: 테레사 바바,옮긴이: 김지연",별글,https://image.aladin.co.kr/product/25697/33/cover/k982736567_1.jpg,"고양이 멘토가 독자의 온갖 질문에 지혜로운 해답을 준다는 콘셉트의 ‘질문의 책’이다. 독자에게 일종의 ‘심리 상담소’ 역할을 해주는 작품으로, 특별한 점은 배꼽 빠지는 유머와 따스한 위로, 따끔한 조언이 완벽하게 어우러져 있다는 것이다.",49
1301,9791191187069,365 수학 :모든 사람을 위한 수학 다이어리 ,"지은이: 박부성,이철희",사이언스북스,https://image.aladin.co.kr/product/25702/16/cover/k392736662_1.jpg,"대한수학회의 수학 대중화 프로젝트로, 호기심을 자극하는 수학 퍼즐부터 몇백 년 동안 이어진 수학자들의 고군분투기, 정답이 없는 삶에 문제 해결의 쾌감을 주는 수학 증명, 아직도 도전자를 기다리는 난제까지 365+1개의 수학 이야기를 1년 동안 매일 1편씩 읽을 수 있도록 엮은 책이다.",71
1302,9788960215269,몸-주체와 상처받음의 윤리 :오민석 평론집 ,지은이: 오민석,천년의시작,https://image.aladin.co.kr/product/25709/73/cover/8960215260_1.jpg,"시작비평선 20권. 시인, 문학평론가인 오민석 평론집. 1부 '시와 문학에 대한 열다섯 개의 테제', 2부 '거기, 시인들이 있었네', 3부 '저 아픈 꽃밭들'로 구성되었다.",72
