id,isbn,title,author,publisher,image_url,content,genre_detail_dict_id
6516,9788958243571,너는 아름답고 ,"김종란,권남희",정은출판,http://image.aladin.co.kr/product/13718/5/cover/8958243570_1.jpg,14인의 글이 담긴 &lt;너는 아름답고&gt;. 5년의 시간이 쌓인 만큼 풋풋함을 넘어 세련미와 깊이를 더해 가는 글에 각자의 개성까지 오롯하다.,4
6517,9788970758732,나는 왜 니나 그리고르브나의 무덤을 찾아갔나 :송영 유고 소설집 ,지은이: 송영,문학세계사,http://image.aladin.co.kr/product/13852/64/cover/8970758739_1.jpg,"2016년 10월 14일 식도암으로 작고한 작가 송영의 유고 중.단편 소설집. 송영 작가는 70년대 당시 타고 난 단편작가이자, 소설로서 거의 완벽한 구성을 가진 뛰어난 감각을 보여 준 작가로 평가되었다. 그의 작품세계는 현실의 닫힘과, 인간이 욕망하는 열림을 주된 테마로 삼는다.",28
6518,9791130305608,"문화를 여행하다 =Travel, culture & people ",지은이: 연호탁,박영사,http://image.aladin.co.kr/product/13785/39/cover/k622532923_1.jpg,여행은 단순히 떠나는 것이 아니다. 목적 없는 방랑이 아닌 것이다. 그냥 아무 생각 없이 발길 닿는 대로 떠돌아다닌다 해도. 진정한 여행자는 소아적 자기애에서 벗어나 너그러운 시선으로 타인과 세상을 바라볼 줄 아는 사람이다.,4
6519,9788982182280,암스테르담행 완행열차 :박찬순 소설집 ,지은이: 박찬순,강,http://image.aladin.co.kr/product/13817/40/cover/8982182284_1.jpg,박찬순의 세번째 소설집. 2006년 「조선일보」 신춘문예에 '가리봉 양꼬치'가 당선되며 작품 활동을 시작한 박찬순 작가. 이번 소설집에서도 각자 자기 몫의 슬픔을 안고 살아가는 주인공들을 통해 그 안에서 희미하게 존재하는 생의 아름다움을 이야기한다.,28
6520,9788960903708,나무가 말하였네 :나무에 깃들어 살다 ,지은이: 고규홍,마음산책,http://image.aladin.co.kr/product/13946/43/cover/8960903701_1.jpg,"나무가 속삭이는 소리를 듣고 전한다 하여 '나무 대변인'이라고 불리는, 나무가 있는 곳이면 어디든 달려갔던 나무 칼럼니스트 고규홍의 새로운 책이 출간되었다. 이번에는 &lt;나무가 말하였네&gt; 출간 10년을 맞아, 특별하게도 다시 '나무-옛시'를 호명했다.",3
6521,9791159160820,강안남자 :1부,지은이: 이원호,한결미디어,https://bookthumb-phinf.pstatic.net/cover/134/581/13458106.jpg?type=m1&udate=20180328,「문화일보」 연재 당시 뜨거운 논쟁의 중심에 섰던 이원호 작가의 장편소설.,28
6522,9791159160813,강안남자 :1부,지은이: 이원호,한결미디어,https://bookthumb-phinf.pstatic.net/cover/134/581/13458105.jpg?type=m1&udate=20180328,「문화일보」 연재 당시 뜨거운 논쟁의 중심에 섰던 이원호 작가의 장편소설.,28
6523,9791159160806,강안남자 :1부,지은이: 이원호,한결미디어,https://bookthumb-phinf.pstatic.net/cover/134/581/13458104.jpg?type=m1&udate=20180328,「문화일보」 연재 당시 뜨거운 논쟁의 중심에 섰던 이원호 작가의 장편소설.,28
6524,9791159160837,강안남자 :1부,지은이: 이원호,한결미디어,https://bookthumb-phinf.pstatic.net/cover/134/581/13458107.jpg?type=m1&udate=20180328,「문화일보」 연재 당시 뜨거운 논쟁의 중심에 섰던 이원호 작가의 장편소설.,28
6525,9791159160844,강안남자 :1부,지은이: 이원호,한결미디어,https://bookthumb-phinf.pstatic.net/cover/134/581/13458108.jpg?type=m1&udate=20180328,「문화일보」 연재 당시 뜨거운 논쟁의 중심에 섰던 이원호 작가의 장편소설.,28
6526,9791162840016,그리움은 화려한 꽃이다 :시인 김단의 제2 감성 시집 ,지은이: 김단,시사랑음악사랑,http://image.aladin.co.kr/product/13552/42/cover/k722532915_1.jpg,자신이 가지고 있는 예술적 근성을 끄집어내어 세상 사람들과 소통하려는 김단 시인이 두 번째 작품집을 들고 메말라 버린 세상에 소리치고 있다. 시인이 그동안 열심히 노트에 저축했던 자산을 골라 김단 시인만의 독특한 어휘력과 문장의 흐름을 살려 시문학 작품집을 완성했다.,3
6527,9791156055150,나만 알고 남은 모르는 인생살이 :임동석 수필집 ,지은이: 임동석,신아출판사,http://image.aladin.co.kr/product/13939/57/cover/k982532730_1.jpg,"임동석 에세이. 공직에 평생을 바쳐 성실히 일했던 저자의 삶이 반영된 일상의 에세이로서 깊은 사색과 성찰로 인간관계에서의 배려와 소통을 이야기한다. 1부 '수필', 2부 '여행기'로 구성되었다.",4
6528,9791189040000,산촌일기 :솔밭을 거닐며 ,박유인 지음,바른북스,http://image.aladin.co.kr/product/13659/16/cover/k032532419_1.jpg,오늘날의 매스컴과 문학은 대부분 도시의 빛과 그림자를 조명하는 데 집중하고 있다. 현대인의 보편적인 삶의 가치가 정신적인 행복보다 물질적인 소유를 중요시하기 때문일 것이다. 농촌의 삶에도 도시에서와 마찬가지로 아픔과 슬픔이 존재하나 자연의 풍광에 가려 겉으로 드러나지 않고 속으로 곪아간다.... ,4
6529,9791188451159,아킬레우스의 노래 :매들린 밀러 장편소설 ,지은이: 매들린 밀러 ;옮긴이: 이은선,이봄,http://image.aladin.co.kr/product/13820/89/cover/k292532124_1.jpg,"미국 작가 매들린 밀러의 첫 소설로, 호메로스의 &lt;일리아스&gt;에 등장하는 파트로클로스를 화자로 하여 영웅 아킬레우스와의 사랑과 그들이 참전한 트로이아 전쟁을 섬새하게 그려낸 작품이다. '근래 호메로스의 작품을 각색한 소설 중 최고'라는 찬사를 받았다.",9
6530,9791196173647,망작들 :당신의 작품을 출간할 수 없는 이유 =Caro autore : come rifiutare un capolavoro ,리카르도 보치 지음 ;진영인 옮김,꿈꾼문고,https://bookthumb-phinf.pstatic.net/cover/134/405/13440577.jpg?type=m1&udate=20180505,"고전이라는 단어가 주는 근엄함이나 이해하기 어렵다는 선입견, 선뜻 책장을 펼치기에 적잖이 부담스러운 작품들이 줄줄이 능청스럽기 짝이 없는 편집자에게 대차게 퇴짜를 맞는다. &lt;망작들&gt;은 이런 엉큼한 상상을 그에 못지않게 엉큼하고 자못 진지하기까지 한 일러스트와 더불어 마음껏 풀어낸다.",68
6531,9791157953288,윤동주의 마음을 읽다 :윤동주 생애 속으로 윤동주 슬픔 속으로 ,지은이: 조명제,스타북스,http://image.aladin.co.kr/product/13681/41/cover/k392532517_1.jpg,"시인이자 문학평론가인 조명제가 새롭게 발견하고 찾아낸 윤동주의 문예비평적 산문. 윤동주 탄생 100년의 시점에서 윤동주의 문학을 재발견하는 비평문, 제1부록 본문에 인용한 윤동주의 시와 산문, 제2부록 윤동주 생전 사후 100년 생애를 정밀하게 들여다본 생애 연보 등으로 구성되어 있다.",4
6532,9788925562964,"이에야스, 에도를 세우다 ",가도이 요시노부 지음 ;임경화 옮김,RHK(알에이치코리아),http://image.aladin.co.kr/product/13364/65/cover/8925562960_1.jpg,"2018년 나오키상을 수상한 작가 가도이 요시노부의 정통 역사소설. 서점원들과 평론가들의 만장일치 호평 속에 입소문만으로 2016년 출간 이후 지금까지 아마존재팬에서 가장 많이 팔린 역사소설로 꼽히며, 독자들의 끊이지 않는 찬사를 받았다.",121
6533,9791156362241,나는 간호사를 선택했다 :아무도 알려주지 않는 간호사 이야기 ,박경애 지음,마음세상,http://image.aladin.co.kr/product/13657/46/cover/k312532316_1.jpg,간호의 삶이 얼마나 가치 있는 일임을 알아가고 배워가는 간호사의 이야기를 담았다. 평범한 간호사가 자신의 경험을 공유한다. 25년이라는 시간이 흘러도 어렵고 힘든 건 마찬가지임을 솔직하게 드러내 놓았다. 나만 힘든 것이 아님을 공감할 수 있는 다양한 병원 이야기들이 전개된다.,4
6534,9788925563480,뉴런하우스 :심리치료 소설 ,김정규 지음,RHK(알에이치코리아),http://image.aladin.co.kr/product/13790/96/cover/8925563487_1.jpg,"게슈탈트 심리학을 바탕으로, 남들에게 내보일 수 없는 상처, 너무 오래돼 나조차 인지하지 못하는 아픔을 치유해 진정한 나로 살아갈 수 있도록 안내하는 심리치료 소설이다. 개개인마다 정도의 차이는 있지만 누구나 해결되지 않은 상처와 아픔을 내면에 품고 있다.",40
6535,9791186828106,조선통신사의 길위에서 :한일관계의 미래를 읽다 ,손승철 지음,역사인,http://image.aladin.co.kr/product/13851/73/cover/k772532320_1.jpg,"손승철의 &lt;조선통신사의 길 위에서&gt;. 1부 '조선, 일본과 통신을 시작하다', 2부 '조선통신사의 옛길에서 미래를 읽다', 3부 '부록'으로 구성되었다. 저자는 10년 넘게 전국 교사 및 대학생들을 인솔하여 조선통신사의 옛 길을 답사하고 있다. 이 책은 그 성과를 집대성한 것이다.",37
6536,9788998274986,하필 그리움을 당신에게 엎질렀다 :무심코 스쳐 보낸 모든 것들이 그립습니다 ,신현택 지음,Book Plaza(북플라자),http://image.aladin.co.kr/product/13743/78/cover/8998274981_1.jpg,신현택 작가의 감성 에세이. 우리 곁에 있기에 소중함을 모르고 스쳐 보낸 모든 것들에 대한 그리움을 담고 있다. 특히 저자는 글이라는 것이 방향제가 되지 않았으면 좋겠다고 한다.,4
6537,9791160260731,구제의 게임 :가와이 간지 장편소설 ,지은이: 가와이 간지 ;옮긴이: 이규원,작가정신,http://image.aladin.co.kr/product/13911/9/cover/k352532423_1.jpg,2012년 &lt;데드맨&gt;으로 제32회 요코미조 세이시 미스터리 대상을 수상하며 '새로운 천재 작가의 탄생'이라는 찬사를 받은 가와의 간지의 장편소설. 골프장에서 일어난 엽기적 살인사건 뒤에 도사린 복잡한 진상과 비밀을 파헤쳐나간다.,12
6538,9791185501109,스토리텔링의 이해 =Understanding storytelling ,이선희 저,사람들,http://image.aladin.co.kr/product/13678/46/cover/k152532513_1.jpg,"초보자들이 쉽게 스토리텔링의 의미를 이해하고, 기본기를 익히고, 전략을 세워 경쟁력 있는 작품을 쓸 수 있도록 실례 중심으로 차근차근 설명해 준다. 아울러, 필자가 직접 집필에 참가한 창작 스토리텔링 작품 &lt;천의소감&gt;(이선희 김선숙 공동 집필)을 말미에 수록했다.",46
6539,9791195669127,로꾸거 :창의성 전문가 류진한 교수의 인생반전 프로젝트 ,글: 류진한 ;그림: 안민지,가람과 뫼,http://image.aladin.co.kr/product/13829/84/cover/k662532223_1.jpg,"'거꾸로 발상'을 키워드로 제시하며, 꼭 창의적인 학습이나 직업에서만 필요로 하는 것이 아니라, 우리의 일상생활 속 희로애락과 함께 존재하면서도 쉽게 느껴지거나 발견되지 못했던 재미있고 의미 있는 소재들을 창의적으로 재해석하여 다루고 있다.",6
6540,9791196181819,젊은 베르테르의 슬픔 ,지은이: 요한 볼프강 폰 괴테 ;편역: 뉴트랜스레이션,다상출판,https://image.aladin.co.kr/product/13927/95/cover/k942532527_1.jpg,"클래식 오디세이 시리즈 6권. 괴테의 대표작으로, 25세에 격정적인 사랑에 빠졌던 괴테가 누구나 어렴풋이 감지하지만 분명하게 이름 지어 부를 수 없는 사랑의 열정과 감각을 선명하게 펼쳐 보이고 있다.",22
6541,9791158911034,지금은 나의 봄날 :문두리 수필집 ,지은이: 문두리,소소리,http://image.aladin.co.kr/product/13928/96/cover/k792532628_1.jpg,문두리의 수필집 『지금은 나의 봄날』. 이 수필집은 문두리의 작품을 엮은 책이다. 크게 3부로 나뉘어 있으며 책에 담긴 주옥같은 글을 통해 독자를 수필 세계로 안내한다.,4
6542,9791127234683,이해의 범주 밖에서 :박이응 단편선 ,저자: 박이응,부크크,http://image.aladin.co.kr/product/13678/24/cover/k582532512_1.jpg,"[이해의 범주 밖에서]는 유쾌한 소설이 아닙니다. 대부분이 어둡고, 더러운 내용입니다. 하지만, 현실에서 일어나는 일들을 주제를 선택했기에 친숙한 내용이기도 합니다. 부디 독자분의 마음에 닿을 수 있기를 바랍니다.",28
6543,9791188783199,루쉰 =루쉰의 정신세계를 분석한 평론집 /노신 ,손위 지음 ;전영매 옮김,경지출판사,http://image.aladin.co.kr/product/13791/88/cover/k352532020_1.jpg,"루쉰은 작품을 통해 처참하리만큼 중국민족의 약점과 치부를 들춰내어 그 당시 중화사상과 한민족 우월주의에 푹 빠져서 ‘자기만족’의 꿈을 꾸고 있던 중국 지도층, 지식인과 4억 인민의 심혼을 맹렬히 흔들어 중국인의 정신 문화혁명을 불러일으켰다.",130
6544,9788959726134,소논문 작성 가즈아~!! ,"저자: 황정훈,박찬흥",청람,http://image.aladin.co.kr/product/13543/56/cover/8959726133_1.jpg,"『소논문 작성 가즈아~!!』는 소논문 작성방법과 참고문헌 인용하기, 연구방법, 연구주제 정하기, 소논문 틀 잡기, 연구계획서 작성하기 등 소논문 쓰기에 대한 내용이 수록되어 있다.",46
6545,9788954650298,세상이 잠든 동안 :커트 보니것 소설 ,지은이: 커트 보니것 ;옮긴이: 이원열,문학동네,http://image.aladin.co.kr/product/13738/76/cover/8954650295_1.jpg,"우리 시대를 대표하는 휴머니스트이자 유머리스트, 하루키가 존경하고 박찬욱이 사랑한 작가 커트 보니것의 미발표 초기 단편소설집. 보니것의 미발표 초기 단편소설 중에서도 보니것식 휴머니즘의 시원을 볼 수 있는 작품들을 선별해 묶었다.",9
6546,9788954650557,레이디 조커 =다카무라 가오루 장편소설 /Lady joker ,지은이: 다카무라 가오루 ;옮긴이: 이규원,문학동네,https://bookthumb-phinf.pstatic.net/cover/134/386/13438619.jpg?type=m1&udate=20180315,"다카무라 가오루의 대작 장편소설. 전작 &lt;마크스의 산&gt;, &lt;조시&gt;로 국내 독자들에게도 익숙한 '고다 형사 시리즈' 세번째 작품으로, 1997년 일본 출간 이후 총 100만 부 넘게 팔리며 시리즈 최고 히트작이 되었다.",12
6547,9788954650571,레이디 조커 =다카무라 가오루 장편소설 /Lady joker ,지은이: 다카무라 가오루 ;옮긴이: 이규원,문학동네,https://bookthumb-phinf.pstatic.net/cover/134/386/13438621.jpg?type=m1&udate=20180315,"다카무라 가오루의 대작 장편소설. 전작 &lt;마크스의 산&gt;, &lt;조시&gt;로 국내 독자들에게도 익숙한 '고다 형사 시리즈' 세번째 작품으로, 1997년 일본 출간 이후 총 100만 부 넘게 팔리며 시리즈 최고 히트작이 되었다.",12
6548,9788954650564,레이디 조커 =다카무라 가오루 장편소설 /Lady joker ,지은이: 다카무라 가오루 ;옮긴이: 이규원,문학동네,https://bookthumb-phinf.pstatic.net/cover/134/386/13438620.jpg?type=m1&udate=20180315,"다카무라 가오루의 대작 장편소설. 전작 &lt;마크스의 산&gt;, &lt;조시&gt;로 국내 독자들에게도 익숙한 '고다 형사 시리즈' 세번째 작품으로, 1997년 일본 출간 이후 총 100만 부 넘게 팔리며 시리즈 최고 히트작이 되었다.",12
6549,9791157782697,아궁이에 불 지피고 ,지은이: 한덕수,맑은샘,http://image.aladin.co.kr/product/13714/82/cover/k342532724_1.jpg,"한덕수 시집. 1부 '쓸데없이 분주하네', 2부 '어이없어라', 3부 '꾸벅꾸벅 할머니', 4부 '순리대로', 5부 '겨울 결혼식', 6부 '가벼이 가려네', 7부 '부평초 같은 인생', 8부 '눈 덮인 계곡', 9부 '진정한 나의 것', 10부 '내가 있어 네가 있네'로 구성되었다.",3
6550,9788971998441,귀환 ,히샴 마타르 지음 ;김병순 옮김,돌베개,http://image.aladin.co.kr/product/14025/46/cover/897199844x_2.jpg,"2017년 퓰리처상(논픽션 부문), 펜/진 스타인 도서상, 폴리오상 수상작. 아버지의 실종과 운명에 얽힌 시대의 진실을 찾아 나선 아들의 머나먼 여정을 그린 작품으로, 「뉴욕타임스」, 「워싱턴포스트」, 「가디언」, 「파이낸셜 타임스」 올해의 책에 선정되었다.",49
6551,9791157782710,풀 뽑는 남자 ,지은이: 신상현,맑은샘,http://image.aladin.co.kr/product/13792/15/cover/k682532020_1.jpg,"누가 어디에서 쳐다보았건 하늘이 둘은 아니라는, 그래서 나의 존재가치에 감사하다는 저자 신상현. 그가 제목에서 느껴지듯 소소한 일상에서의 하루 일과를 담담히 써내려간 글이다.",4
6552,9791187413899,연화장 손님들 :김석일 시집 ,지은이: 김석일,bookin(북인),http://image.aladin.co.kr/product/13784/62/cover/k052532923_1.jpg,현대시세계 시인선 89권. 계간 「한국작가」 신인상으로 등단한 김석일 시인의 세 번째 시집. 김석일 시인은 시집 &lt;연화장 손님들&gt;을 통해 '시의 영원한 과제는 인생이다'라고 강변하고 있다.,3
6553,9788946070622,손문의 혁명 =Sun Yat-sen's revolution ,이승휘 지음,한울엠플러스,http://image.aladin.co.kr/product/13852/52/cover/8946070625_1.jpg,"'원칙'과 '왜곡' 사이를 오가며 전개된 손문의 혁명. 기존 연구의 문제점을 10여 년의 세월을 녹여 방대한 사료로 풀어낸 책으로, 손문 혁명의 전 과정을 신화나 폄훼가 아닌 본연의 모습으로 되살려냈다.",27
6554,9791186668184,시 한 구절의 힘 ,지은이: 이규식,포엠포엠,http://image.aladin.co.kr/product/13371/0/cover/k512532004_1.jpg,"2018년 새해에 펴낸 이규식 교수의 시론집. 한국 현대시에서 찾아낸 충만한 힘과 긍정의 감성, 인간-시간-공간의 씨줄과 날줄로 직조한 따뜻한 서정, 김소월에서 오은까지, 삶에서 피워 올린 앤솔로지 70선. 우리 시를 다시 읽는다.",72
6555,9791186104835,어느 날의 소묘 :채재현 시집 ,지은이: 채재현,코드미디어,http://image.aladin.co.kr/product/13559/3/cover/k412532019_1.jpg,"시는 한 호흡의 꽃향기처럼 오래 독자의 가슴에 머물 수 있어야 한다. 단 한마디의 언어일지라도 신선한 생명력으로 감성을 흔드는 충격이어야 한다. 채재현의 시는 그와 같은 언어의 미학美學을 향한 고뇌의 몸짓이 돋보인다. 마치 풍경화 한 폭을 그려내는 듯한 채재현 언어의 질서, 눈부시도록 하얀 생명의... ",3
6556,9788990944535,현대소설의 역사의식과 기억투쟁 ,지은이: 황국명,신생,http://image.aladin.co.kr/product/13213/58/cover/8990944538_1.jpg,"현대소설이 담아낸 개인의 초상과 사회의 풍경을 역사의식과 기억투쟁이라는 맥락에서 해석했다. 현대소설이 드러낸 이 의식적인 싸움은 작중인물들이 당대를 살기 위해 펼친 고투일 뿐만 아니라, 누가 기억하고 무엇을 기록할 것인가의 문제를 둘러싸고 현대작가들이 뛰어든 군비경쟁이기도 하다.",72
6557,9788990944528,유목의 피 :김희정 시집 ,지은이: 김희정,신생,http://image.aladin.co.kr/product/12842/89/cover/899094452x_1.jpg,"신생시선 48권. 김희정 시집. 자신의 욕망을 이미지 없이 누군가에게 전달하는 것은 야만적인 일이다. 또한 '자신의 이미지를 욕망 없이 누군가에게 전달하는 것은 무척 지루하다.'(아감벤, &lt;세속화 예찬&gt;) 이미지와 욕망 사이에 김희정 시인의 시들이 위치하고 있다. 그의 시는 읽기가 매우 쉽다.",3
6558,9788994606514,만주족 이야기 :만주의 눈으로 청 제국사를 새로 읽다 ,이훈 지음,너머북스,http://image.aladin.co.kr/product/13178/24/cover/8994606513_1.jpg,"14세기 부족 시기의 이동과 충돌, 그리고 융합부터 17세기 초 만주의 탄생을 거쳐, 18세기 청 제국의 극성기까지 만주족의 역사와 생활 모습, 문명적 특질을 생생하게 살펴본다. 만주족이 남긴 기록을 최대한 활용하여 그들의 이야기를 그들의 입장에서 서술했다는 점이 가장 큰 특징이다.",27
6559,9791188765096,아랍과 이슬람 :그 문명의 역사와 사상 ,"지은이: 임병필,이성수",모시는사람들,http://image.aladin.co.kr/product/13710/60/cover/k652532721_1.jpg,"아랍과 이슬람 세계에 대한 이해를 쉽게 하기 위하여 역사는 물론 정치, 경제, 사회, 문화, 예술 등 각 분야별 특성을 서술한 기본 입문서이다.",35
6560,9791159052576,리드미카 :장은석 평론집 ,지은이: 장은석,소명출판,http://image.aladin.co.kr/product/13787/59/cover/k682532926_1.jpg,"문학평론가 장은석의 첫 평론집. 2000년대 시단의 아방가르드였던 '미래파' 이후의 시단의 변화와 추이를 속속들이 비평적 체험으로 쫓아가며, '리듬'이라는 키워드로 더욱 다각화되고 다양화된 근래의 발표된 내밀한 시들을 소개하고 있다.",72
6561,9791188903016,소설의 본질 ,지은이: 조남현,서정시학,http://image.aladin.co.kr/product/13671/65/cover/k082532415_1.jpg,"『소설의 본질』의 저술 동기는 서울대학교 인문대학의 “인문학의 새로운 패러다임”이란 기획에 참여할 때 싹이 텄다고 할 수 있지만, 어찌 보면 이 책에 대한 구상은 1980년대로 소급시킬 수도 있다. 여러 논저들을 작성하면서 혹은 단순한 아이디어의 형식으로 혹은 동서양 이론의 수용을 통해 씨를 뿌리고 그... ",72
6562,9791188903047,불빛으로 집을 짓다 :전숙경 시집 ,지은이: 전숙경,서정시학,http://image.aladin.co.kr/product/13710/77/cover/k852532721_1.jpg,전숙경의 시집 『불빛으로 집을 짓다』. 이 시집은 전숙경의 시 작품을 엮은 책이다. 크게 4부로 나뉘어 있으며 책에 담긴 주옥같은 시편을 통해 독자를 시인의 시 세계로 안내한다.,3
6563,9791159052675,조운 문학 전집 =The complete works of Cho Un ,지은이: 조운 ;엮은이: 이동순,소명출판,https://image.aladin.co.kr/product/13828/85/cover/k892532222_1.jpg,"시인 조운은 가람 이병기와의 교류를 통해 시조에 관심을 갖고, 관념적인 투의 시조 대신 생활 밀착형 시조를 썼다. 기존에 출간된 전집의 서지가 불분명하거나 오류가 많았고, 특히 새롭게 발굴된 작품들을 한데 묶을 필요가 있어 새롭게 조운의 작품을 망라하게 되었다.",3
6564,9791159052682,조남령 문학 전집 =The complete works of Cho Nam-Ryeong ,지은이: 조남령 ;엮은이: 이동순,소명출판,https://image.aladin.co.kr/product/13828/88/cover/k962532223_1.jpg,"영광문학총서 2권. 가람 이병기의 시조 36수와 조운의 시조 29수, 조남령의 시조 15수가 실려 있다. 현대시조를 창작하고 현대시조의 수록된 작품들은 모두 발표 당시의 표기법을 그대로 살려 원문의 맛을 그대로 재현했으며, 컬러 화보와 작품?생애 연보와 해설을 덧붙여 문학가로서의 면모와 영광에서의 삶을 엿볼 수 있는 기회를 제공한다.",72
6565,9788936473655,100℃ :최규석 만화 ,지은이: 최규석,창비,http://image.aladin.co.kr/product/12770/37/cover/8936473654_1.jpg,"&lt;송곳&gt;의 최규석이 그린 1987년 6월민주항쟁, &lt;100℃&gt;가 개정 출간되었다. 대학에 입학해 5.18 광주민주항쟁에 대해 알게 된 고지식한 대학생 영호가 박종철 고문치사사건을 겪으면서 학생운동에 뛰어들게 되는 과정을 그린다.",45
6566,9791195879410,"뉴욕, 어퍼 이스트사이드 :티에리 코엔 장편소설 ",지은이: 티에리 코엔 ;옮긴이: 박아르마,희담,http://image.aladin.co.kr/product/13545/34/cover/k572532918_1.jpg,"티에리 코엔 장편소설. 사무엘 샌더슨은 20년간 각고의 노력 끝에 베스트셀러 작가로 대박을 터트리며, 뉴욕, 어퍼 이스트사이드에 입성한다. 어퍼 이스트사이드는 뉴욕 최고의 부촌이자 미국의 상류층과 유명 인사들이 대거 거주하는 곳으로, 미드 [가십걸]이나 [섹스앤더시티]의 주요 배경이기도 한 곳이다.",10
6567,9791188363926,꽃무릇 :붉게 핀 꽃무릇 내 누이 삶에도 활짝 피어라 ,지은이: 장병길,바른북스,http://image.aladin.co.kr/product/13419/23/cover/k282532401_1.jpg,"장병길 시집. '감태', '갯버들', '러셀', '달리는 열차는 기착지에 서지 않는다', '눈빛', '보이지 않는 길', '꾼들의 눈동자', '두 번째 문턱을 넘다', '꿈은 닮아가는 것', '부리' 등의 시편이 수록되어 있다.",3
6568,9788975551895,독도를 지키는 법 ,김신 지음,지영사,http://image.aladin.co.kr/product/13912/61/cover/897555189x_1.jpg,"저자가 40년이 넘게 독도주권에 대해 수집한 자료를 바탕으로, 국내외 연구를 통해 독도갈등의 진실에 다가가기 위한 연구 성과의 결과물이다. 지금까지 공개되지 않은 자료들을 이론적 기반을 위해 인용했고, 가설을 덧붙였으며, 가능한 한 원문과 번역문을 첨부했다.",85
