id,isbn,title,author,publisher,image_url,content,genre_1,genre_2
937,9791190357425,시간이 멈춘 방 :유품정리인이 미니어처로 전하는 삶의 마지막 이야기들 ,지은이: 고지마 미유 ;옮긴이: 정문주,더숲,https://image.aladin.co.kr/product/24989/52/cover/k832632705_1.jpg,"미니어처에 쓸쓸한 죽음 그 뒤편의 이야기를 담아 묵직한 울림을 전해주는 &lt;시간이 멈춘 방&gt;. 미니어처로 고독사 문제를 환기하면서, 죽음의 현장을 둘러싸고 작가가 마주했던 이야기들을 담담한 필체로 전한다.",문학,외국에세이
938,9791189888145,스마트폰으로 유튜브 정복하기 :유튜브를 시작하는 이들을 위해 기초부터 응용까지 담은 필독서 ,"공저: 최재용,한금실",미디어북,https://image.aladin.co.kr/product/24258/52/cover/k152630571_1.jpg,한국1인미디어산업협회에서는 「스마트폰으로 유튜브 정복하기」를 통해 유튜브를 시작하는 이들에게 도움을 주고자 실무 위주의 교과서를 만들었다. 이 책은 초보자를 위한 필독서이며 특별히 시니어 유튜버들이 늘어나는 추세에 부응해 판형이나 본문 폰트도 크게 해서 가독성을 높였다.,IT,스마트폰/태블릿/SNS
939,9791166030123,생각이 크는 언어치료 :기초언어능력부터 사회적 의사소통까지!,"김정완,박성현 지음",한국학술정보,https://image.aladin.co.kr/product/24824/17/cover/k992631037_1.jpg,"재미있게 놀면서 배우는 언어발달 프로그램. 이번 개정판에는 다양한 활동들이 풍성히 추가되었고, 스티커와 그림카드가 포함된 부록과 귀여운 일러스트가 추가되어 입학 전 아동들이 더욱 재미있게 놀면서 사회적 의사소통과 정확한 발음을 배울 수 있다.",사회과학,교육학
940,9791197145100,열다섯 마리 개 ,앙드레 알렉시스 지음 ;김경연 옮김,삐삐북스,https://image.aladin.co.kr/product/25037/8/cover/k982632922_1.jpg,인간의 지능을 가지게 된 개를 통해 의식의 아름다움과 그 위험성에 관해 철학적 메시지를 전한다. 소설은 개성과 개인의 자유와 같은 인간의 가치를 중요시하는 인간 사회에 이제 막 사유를 시작한 개를 등장시키면서 기존의 계층적 사회 질서를 향해 질문을 던진다.,문학,세계의 소설
941,9791166030147,생각이 크는 언어치료 :기초언어능력부터 사회적 의사소통까지!,"김정완,박성현 지음",한국학술정보,https://image.aladin.co.kr/product/24823/81/cover/k462631036_1.jpg,"&lt;생각이 크는 언어치료&gt; 개정판. 다양한 활동들이 풍성히 추가되었고, 스티커와 그림카드가 포함된 부록과 귀여운 일러스트가 추가되어 입학 전 아동들이 더욱 재미있게 놀면서 사회적 의사소통과 정확한 발음을 배울 수 있다.",사회과학,교육학
942,9791166030130,생각이 크는 언어치료 :기초언어능력부터 사회적 의사소통까지!,"김정완,박성현 지음",한국학술정보,https://image.aladin.co.kr/product/24823/58/cover/k662631035_1.jpg,"다양한 활동들이 풍성히 추가되었고, 스티커와 그림카드가 포함된 부록과 귀여운 일러스트가 추가되어 입학 전 아동들이 더욱 재미있게 놀면서 사회적 의사소통과 정확한 발음을 배울 수 있다.",사회과학,교육학
943,9791188912872,우주를 만지다 :삶이 물리학을 만나는 순간들 ,권재술 지음,특별한서재,https://image.aladin.co.kr/product/25173/5/cover/k172633592_1.jpg,"지구의 모든 모래알을 합친 것보다 훨씬 더 세밀하고 작은 원자 단계의 미시세계부터 감히 그 끝을 가늠할 수 없는 우주 너머의 거시세계까지, 우리가 발을 딛고 살고 있는 세상을 물리학자의 시선으로 바라본 과학 에세이다.",과학,물리학
944,9791190727198,창와집 ,曺禧奎 지음 ;곽진 옮김,태학사,https://image.aladin.co.kr/product/25214/26/cover/k262633706_1.jpg,태학명문 2권. 창와 조희규는 조선왕조의 국운이 기울어가던 시대를 살았던 선비다. &lt;창와집&gt;은 어렵게 수습해놓은 창와의 글을 대를 넘겨 손자 학영이 간행한 문집이다.,문학,우리나라 옛글
945,9788936478292,스노볼 :박소영 장편소설 ,지은이: 박소영,창비,https://image.aladin.co.kr/product/24790/61/cover/893647829x_1.jpg,한국 영어덜트 소설의 최전선 창비와 장르문학 No.1 플랫폼 카카오페이지가 공동 주최하면서 화제를 불러일으킨 제1회 창비x카카오페이지 영어덜트 장르문학상 대상 수상작 박소영 장편소설 &lt;스노볼&gt;.,문학,한국소설
946,9791197162336,(마음으로 읽어내는) 名文人畵 :미학코드로 보다,권윤희 지음,유니랩,https://image.aladin.co.kr/product/25240/24/cover/k762633005_1.jpg,예술의 세계는 끝이 없다. 그러나 보는 이의 가슴 속에 전해져야 가치가 있다. 보통의 문인예술은 깊은 철학과 학문이 전제되어 성립된다. 그러나 이에 대한 방법과 접근이 없으면 진정에 다다르기가 어렵다. 본 책은 우리 문인 예술의 미학을 가치 부여 측면에서 접근한 책이다. 우리 선인들의 예술세계와 학문... ,예술,미술
947,9791197162343,(마음으로 읽어내는) 名文人畵 :미학코드로 보다,권윤희 지음,유니랩,https://image.aladin.co.kr/product/25701/57/cover/k652736669_1.jpg,예술의 세계는 끝이 없다. 그러나 보는 이의 가슴 속에 전해져야 가치가 있다. 보통의 문인예술은 깊은 철학과 학문이 전제되어 성립된다. 그러나 이에 대한 방법과 접근이 없으면 진정에 다다르기가 어렵다. 본 책은 우리 문인 예술의 미학을 가치 부여 측면에서 접근한 책이다. 우리 선인들의 예술세계와 학문... ,예술,미술
948,9788937479946,"실례지만, 이 책이 시급합니다 ",지은이: 이수은,민음사,https://image.aladin.co.kr/product/25365/97/cover/893747994x_1.jpg,"베테랑 외국문학 편집자로 20여 년 넘게 일하면서 세계적 거장들을 국내에 소개해 온 편집자이자 번역가, 작가 이수은의 독서 에세이. 저자는 책을 만드는 편집자인 동시에 열혈 독자로 살아오면서 읽은 수많은 책들 중 52권을 엄선하여 독자가 다가가기 쉽도록 유머러스하고 위트 넘치는 문장과 구성으로 소개한다.",문학,독서에세이
949,9791127853211,모험가가 되고 싶다며 도시로 떠났던 딸이 S랭크가 되었다 =흑발의 여검사.My daughter grew up to 'rank S' adventurer ,원작: 모지 카키야 ;옮긴이: 김성래,디앤씨미디어,https://image.aladin.co.kr/product/21573/31/cover/k162636495_2.jpg,고향 마을에서 평온한 삶을 보내던 은퇴 모험가 벨그리프는 어느 날 숲에서 한 소녀를 주워 안젤린이라 이름 붙이고 친딸처럼 키웠다. 세월이 흘러 아버지의 모습을 동경하며 도시로 떠난 안젤린은 어느새 모험가로서 최고위인 『S랭크』가 되었는데……?!,만화,본격장르만화
950,9791196434649,상상이 현실이 되는 순간 :시대를 앞서간 SF가 만든 과학 이야기 ,조엘 레비 지음 ;엄성수 옮김,행북,https://image.aladin.co.kr/product/25380/54/cover/k742633814_1.jpg,"누군가에게는 취향의 하나로 또는 여가의 일부로 비칠 수 있는 SF가 사실은 미래를 창조하는 데 실질적인 도움을 주었고, 지금도 새로운 기술의 탄생에 지대한 영향을 주고 있다는 사실을 알고 있는가? 오늘날 어디서나 볼 수 있는 아주 중요한 기술 중에는 SF에서 먼저 예견했을 뿐 아니라, 많은 경우... ",과학,기초과학/교양과학
951,9788959967551,조선이 남긴 그림들,경진출판 편집부 기획,경진출판,https://image.aladin.co.kr/product/25447/71/cover/8959967556_1.jpg,"25명의 조선시대 화가와 360여 점의 그림들을 만나볼 수 있는 책이다. 조선시대 미술 작품들을 통해 조선사람들의 삶을 엿볼 수 있다. 인물들의 간단한 정보를 통해 이 시대의 정치, 사회, 문화 등을 엿볼 수 있다.",예술,미술
952,9791127856526,모험가가 되고 싶다며 도시로 떠났던 딸이 S랭크가 되었다 =흑발의 여검사.My daughter grew up to 'rank S' adventurer ,원작: 모지 카키야 ;옮긴이: 김성래,디앤씨미디어,https://image.aladin.co.kr/product/24919/23/cover/k632632475_1.jpg,"고향 마을 톨네라에서 귀성을 기다리고 있을 사랑하는 아빠, 벨그리프를 그리워하는 마음이 날마다 점점 더 고조되는 안젤린. 그러나 S랭크 모험가라는 입장 때문에 온갖 의뢰가 끊임없이 밀려든다. 심지어는 「마수 대량 발생의 원인」이 안젤린 및 모험가들의 앞에 나타나는데─?!",만화,본격장르만화
953,9788959967889,조선이 남긴 그림들,경진출판 편집부 기획,경진출판,https://image.aladin.co.kr/product/25686/13/cover/8959967882_1.jpg,앞서 발행된 15~17세기 조선시대 화가 25명과 360여 점의 그림을 소개한 &lt;조선이 남긴 그림들 1&gt;을 이은 이번 책 &lt;조선이 남긴 그림들 2&gt;에서는 출생년도를 기준으로 하여 1600년대 화가들을 중심으로 그림의 정보와 출처(소장처 등)를 밝히고자 하였다.,예술,미술
954,9791127857448,모험가가 되고 싶다며 도시로 떠났던 딸이 S랭크가 되었다 =흑발의 여검사.My daughter grew up to 'rank S' adventurer ,원작: 모지 카키야 ;옮긴이: 김성래,디앤씨미디어,https://image.aladin.co.kr/product/25635/97/cover/k922735319_1.jpg,고향 톨네라로 마침내 귀성해서 사랑하는 아빠 벨그리프와 평온한 나날을 즐기는 안젤린. 한편 올펜에서는 「마왕」을 만들어 냈던 대마도사 솔로몬을 신봉하는 인물들이 나타나는데─?!,만화,본격장르만화
955,9791162243541,"(처음 배우는) 딥러닝 챗봇 :챗봇 엔진부터 NLP, 딥러닝, 파이썬, REST API, 카카오톡 연동까지 ",조경래 지음,한빛미디어,https://image.aladin.co.kr/product/25460/82/cover/k622633723_1.jpg,"챗봇 엔진부터 NLP, 딥러닝, REST API, 카카오톡 연동에 이르기까지 챗봇에 필요한 기술을 한 권으로 만나볼 수 있는 챗봇 개발 입문서. 어려운 개념은 직관적인 그림과 도식을 활용해서 설명했으며, 책에서 담고자 하는 수준에서 벗어나는 개념은 과감하게 생략하여 기본에 더 충실했다.",IT,컴퓨터 공학
956,9788984946507,경계를 넘어서는 고구려·발해사 연구 ,"鄭京日,이인재 엮음",혜안,https://image.aladin.co.kr/product/25574/94/cover/8984946508_1.jpg,"연세근대한국학총서 140권. 한국과 중국, 일본, 북한 등의 고구려사 연구자들이 서로 지속적이고 적극적으로 교류하고 소통할 필요가 있다는 데에 대한 공감으로 시작된 연구모임 '고구려 주니어포럼'의 학술연구 성과를 모아 책으로 만든 것이다.",역사,한국고대~고려시대
957,9788963032085,불온한 데이터 =Vertiginous data ,국립현대미술관 [편] ;Yes More Translation,국립현대미술관,https://image.aladin.co.kr/product/21172/40/cover/8963032086_1.jpg,"국립현대미술관 서울관에서 개최한 융복합국제미술 기획전 &lt;&lt;불온한 데이터&gt;&gt;의 도록으로 전시를 기획한 박덕선 학예연구사, 히토 슈타이얼(Hito Steyerl), 자크 블라스(Zach Blas), 전희경(Wendy Hui Kyong Chun), 마틴 자일링거(Martin Zeilinger), 마테오 파스퀴넬리(Matteo Pasquinelli)가 필자로... ",예술,미술
958,9788965642589,공기와 물 :양혜규에 관한 글 모음 2001~2020 ,"글쓴이: 김성원,Artrans",현실문화연구,https://image.aladin.co.kr/product/25329/7/cover/8965642582_1.jpg,"양혜규는 지난 25년간 국내보다는 국제 무대를 중심으로 활발한 전시 활동을 펼쳐왔으며, 세계적인 설치 미술가로서의 입지를 확실하게 다졌다. 비평 선집 &lt;공기와 물&gt;은 그간 해외 출판물에 소개된 방대한 양의 비평 텍스트와 에세이에서 36편을 엄선해 우리말로 옮긴 책이다.",예술,미술
959,9788996743149,"아빠, 오늘은 어디 가? ",황인철 지음,알피코프,http://image.aladin.co.kr/product/2711/91/cover/8996743143_1.jpg,최근 젊은 부모들 사이에서 '스칸디대디'가 멋진 아빠로 등극하고 있다. 스칸디 육아법이란 아이와 많은 시간을 보내며 소통하는 자상한 아빠 중심의 교육법. 자연 친화적이며 엄마와 아빠가 함께 육아를 하는 북유럽 국가의 자녀 양육법이다.,취미,국내 여행가이드
960,9788950983819,사브리나 ,지은이: 닉 드르나소 ;옮긴이: 박산호,아르테,https://image.aladin.co.kr/product/22218/7/cover/8950983818_1.jpg,"그래픽노블 최초로 맨부커상 후보에 오르면서 전 세계적으로 뜨거운 화제를 몰고 온 작품으로, 평범한 여성 사브리나가 아무 이유 없이 끔찍한 일을 당한 후 그 사건이 미디어와 SNS를 통해서 퍼져나가면서, 남겨진 주위 사람들의 삶 또한 파괴돼가는 과정에 대한 이야기를 담았다.",만화,그래픽노블
961,9791189430580,(하버드 시대의 종말과) 학습 혁명 ,오강선 지음,클라우드나인,https://image.aladin.co.kr/product/23284/19/cover/k922637608_1.jpg,산업혁명 이후 경제 성장과 함께 발전해온 하버드대로 대표되는 현대 미국 대학 교육 시스템이 디지털 혁명을 맞아 어떤 변화에 직면해 있고 그래서 어떻게 혁신해나가야 할지에 대한 논의와 방향을 모색한 책이다.,사회과학,교육학
962,9791196745127,마음이 머무는 곳 :유창섭 제16시집 ,지은이: 유창섭,정윤컴퍼니,https://image.aladin.co.kr/product/21439/12/cover/k722636198_1.jpg,모던포엠작가선 152편. 저자 유창섭의 제 16번째 시집이다.,문학,시
963,9788994146294,(토리토리) 다중지능 미술,저자: 지의홍 ;장한나,아이스쿨,https://bookthumb-phinf.pstatic.net/cover/073/783/07378318.jpg?type=m1&udate=20161006,스케치는 다양한 사물의 형태를 제 모양과 가깝게 형태를 정리하여 그린 그림을 뜻하며 이에 비해 크로키는 움직이는 동물이나 사람의 동세에 대해 순간적 이미지를 캡쳐해서 빠르게 그리는 그림이다. 본 책에서는 이러한 스케치와 크로키의 개념을 보다 폭넓게 적용하여 사람과 동물 및 사물의 표현에 있어 쉽게... ,예술,미술
964,9791189385163,"쉬운 천국 =뉴욕, 런던, 파리, 베를린, 비엔나 잊을 수 없는 시절의 여행들 /Simple heaven ",유지혜 지음,어떤책,https://image.aladin.co.kr/product/25590/27/cover/k512735580_1.jpg,"《조용한 흥분》, 《나와의 연락》 유지혜 작가 신작두 번의 뉴욕, 다섯 번의 런던, 네 번의 파리, 세 번의 베를린, 그리고 비엔나이제 조금 알 것 같다는, 혹은 아직도 잘 모르겠다는너와 나, 우리 청춘들에게 바치는몇만 번 다시 사랑하게 될 순간들의 기록2015년 《조용한 흥분》 출간으로, 독자들을... ",문학,여행에세이
965,9791186963456,그림책의 책 :100개의 주제로 엮은 그림책 북큐레이션 북 ,제님 지음,헤르츠나인,https://image.aladin.co.kr/product/25611/51/cover/k752735116_1.jpg,"15년간 기록한 1만여 권의 목록에서 1300여 권의 그림책을 엄선하여 100개의 주제로 엮었다. 천편일률적인 그림책 목록과는 다른 제님씨 만의 폭과 깊이가 담겨있다. 그림책을 중심으로 동화, 청소년책, 성인 단행본까지 아우른, 그림책과 책을 사랑하는 사람들을 위한 북큐레이션 도서이다.",문학,독서에세이
966,9791160050950,행복하고 달콤한 기적들 :별에서 바다까지 세상에서 벌어지는 사랑스러운 이야기 ,이정 지음,북카라반,https://image.aladin.co.kr/product/25679/96/cover/k082735349_1.jpg,사탕 한 조각을 입에 넣으면 금세 행복해진다. 책도 그럴 수 있지 않을까? 마음이 지친 사람들을 위해 한 페이지만 읽어도 마음이 화사해질 글을 모았다. 별에서부터 시작되어 수천 년 동안 사라지지 않고 이어져 오늘의 내가 되었다. 달콤한 사탕처럼 우리를 행복하게 해줄 사랑스럽고 신비한 88가지 이야기를 담았다.,문학,한국에세이
967,9791191071191,"입식의 시대, 좌식의 집 ",조재모 지음,은행나무,https://image.aladin.co.kr/product/25662/86/cover/k782735241_1.jpg,'국학진흥원 교양학술 총서­고전에서 오늘의 답을 찾다' 세 번째 책. 오늘날 입식과 좌식이라는 복합적인 문화로 형성된 ‘집’을 살펴본다.,역사,한국사 일반
968,9791191071207,영화 춘향전과 한옥 ,"김민옥,조관연 지음",은행나무,https://image.aladin.co.kr/product/25662/89/cover/k792735241_1.jpg,"1961년 작 「춘향전」과 「성춘향」 그리고 2000년 「춘향뎐」까지 세 편의 영화들을 소환한다. 이 영화들 안에서 전통 한옥 공간들은 각기 다르게 재현되었고, 그에 따른 등장인물의 사회적 위치와 역할도 차이를 보인다. 이런 차이가 의미하는 문화적인 함의는 무엇인지 알아본다.",역사,한국사 일반
969,9791190893336,공황장애가 시작되었습니다 :어느 중학교 도덕 교사의 두 번째 삶을 위한 기록 ,정윤진 지음,서해문집,https://image.aladin.co.kr/product/25646/95/cover/k162735042_1.jpg,"마흔이 된 14년 차 중학교 도덕 교사가 쓴 현재진행형의 공황장애 투병 기록이다. 공황장애의 발병 원인과 진행, 그 극복을 위한 치열한 자기 싸움을 고스란히 담았다.",인문학,인문 에세이
970,9791160711035,(국역) 일제강점기 경성부윤 자료집 ,"번역: 이은희,김경호",서울역사편찬원,https://bookthumb-phinf.pstatic.net/cover/176/986/17698674.jpg?type=m1&udate=20210121,"『일제강점기 경성부윤 자료집』 은 〈가나야 주〉, 〈사이토 레이조〉, 〈요시마쓰 노리오〉, 〈다니 다키마〉, 〈우마노 세이이치〉, 〈마쓰이 후사지로〉 등을 수록하고 있는 책이다.",역사,한국근현대사
971,9791186012673,"『삼국사기』 초기 기록, 어디까지 믿을 수 있나 ","집필자: 노중국,박현숙",한성백제박물관,https://bookthumb-phinf.pstatic.net/cover/176/986/17698678.jpg?type=m1&udate=20210121,"『삼국사기 초기기록, 이디까지 믿을 수 있나』 는 〈고림동 원삼국·백제 취락〉, 〈고림동 원삼국시대 생활유적〉, 〈공세리 유적〉, 〈두창리 유적〉, 〈마북동 425-14번지 유적〉, 〈마북동 441번지 유적〉 등을 수록하고 있는 책이다.",역사,한국고대~고려시대
972,9791161619903,서울의 문장들 :서울꿈새김판 글 모음(2013-2020) ,서울특별시 [편],서울특별시,https://image.aladin.co.kr/product/24891/23/cover/k182632478_1.jpg,서울시가 7년간의 '서울꿈새김판' 계절별 공모를 통해 그동안 꼭꼭 모아왔던 따스한 위로의 문안들을 책으로 엮었다. 서울을 사랑하는 이들에게 전하는 총 153개의 희망과 응원의 문장들이 수록되어 있다.,문학,한국에세이
973,9791164325559,홍하후궁 이야기 :소옥전,원작: 유키무라 카나 ;캐릭터 원작: 키리야 타카시,조은세상,https://image.aladin.co.kr/product/21832/98/cover/k972636207_1.jpg,"제국 최강의 장군 관소옥은 옛 부관이자 현 황제인 문림의 부탁을 받고, 어느날 갑자기 후궁의 정점인 황후가 되는데..?! 여자의 자존심과 욕망이 불꽃 튀는 홍하궁에서 벌어지는 군인 황후, 소옥의 전쟁 개막.",만화,순정만화
974,9791164325566,홍하후궁 이야기 :소옥전,원작: 유키무라 카나 ;캐릭터 원작: 키리야 타카시,조은세상,https://image.aladin.co.kr/product/21833/48/cover/k942636207_1.jpg,황제 문림의 암살 계획은 소옥이 몸을 던져 막아 실패로 돌아간다. 주모자들의 반란 계획을 깨부수기 위해 군인 황후 소옥이 일어서는데…. 소옥이 후궁에 들어가 황후가 될 때까지를 그린 보너스 페이지도 게재하였다.,만화,순정만화
975,9791164327270,홍하후궁 이야기 :소옥전,원작: 유키무라 카나 ;캐릭터 원작: 키리야 타카시,조은세상,https://image.aladin.co.kr/product/23296/15/cover/k872637715_1.jpg,옛 부관 문림에 의해 황후가 된지 1년. 고귀비의 사건 이후 평화를 되찾은 대신제국에 새로운 사건의 예감이? 선황제의 자식이 나타나 황궁에 폭풍이 불어닥친다..!!,만화,순정만화
976,9791164328819,홍하후궁 이야기 :소옥전,원작: 유키무라 카나 ;캐릭터 원작: 키리야 타카시,조은세상,https://image.aladin.co.kr/product/23828/44/cover/k512639282_1.jpg,"12년 전, 이제 막 만났던 두 사람의 이야기. 소옥과 문림은 장군과 부관이라는 위치에서 인연을 쌓아가는데 어느날 밤, 술을 마시던 중 하룻밤 실수를 저지르고 마는데.",만화,순정만화
977,9791165910082,홍하후궁 이야기 :소옥전,원작: 유키무라 카나 ;캐릭터 원작: 키리야 타카시,조은세상,https://image.aladin.co.kr/product/24224/58/cover/k592630260_1.jpg,"나의용의 모반도 진압되고 황궁에 평온이 찾아왔다. 평화로운 한때를 즐기던 것도 잠시 문림이 직접 새로운 총희로 사월지를 지명하면서 후궁이 소란스러워진다. 한편, 불온한 그림자가 점점 제국으로 다가오는데.",만화,순정만화
978,9791165911805,홍하후궁 이야기 :소옥전,원작: 유키무라 카나 ;캐릭터 원작: 키리야 타카시,조은세상,https://image.aladin.co.kr/product/24974/81/cover/k322632700_1.jpg,추왕 섭의 반란으로 점령당한 풍왕령. 왕태비의 아들 풍왕을 구출하기 위해 성내에 침입한 소옥에게 큰 시련이 기다린다. 상실과 비극의 끝에 소옥이 찾은 것은?!,만화,순정만화
979,9791165913212,홍하후궁 이야기 :소옥전,원작: 유키무라 카나 ;캐릭터 원작: 키리야 타카시,조은세상,https://image.aladin.co.kr/product/25430/46/cover/k932633413_1.jpg,명혜가 죽은 충격으로부터 일어나지 못하는 소옥에게 문림은 호서로의 행계를 명한다. 하지만 행계의 진짜 목적은 반란의 주모자인 추왕 섭의 흑막을 밝히는 것이었다. ‘진교위’로 현지에서 조사를 시작한 소옥은 마을의 동태에 크게 위화감을 느낀다.,만화,순정만화
980,9791164325580,Rosen blood :배덕의 저택,저자: Kachiru Ishizue,조은세상,https://image.aladin.co.kr/product/21832/12/cover/k602636206_1.jpg,"아름다운 남자들이 살고 있는 어느 저택에서 일하게 된 소녀 스텔라. 결정을 먹으며, 식사를 하지 않는 그들이 스텔라에게 보내는 시선은..?! 발을 들이면 그것으로 마지막. 인간이 아닌 자들에게 홀린 소녀의 공포와 배덕의 나날이 시작된다.",만화,순정만화
981,9791165910389,Rosen blood :배덕의 저택,저자: Kachiru Ishizue,조은세상,https://image.aladin.co.kr/product/24324/24/cover/k502630697_1.jpg,"사람을 결정으롤 바꾸어 먹는 레비 일행의 굶주림을 막기위해 그들의 식량이 될 것을 결심한 스텔라. 그러던 어느 날 레비가 쓰러지고, 스텔라는 레비를 구하기 위해 그의 마음속으로 들어가는데...?!",만화,순정만화
982,9791164325481,방과 후 찻집에서 :coffee shop Anemone,저자: Kina Azusa,조은세상,https://image.aladin.co.kr/product/21688/12/cover/k352636804_1.jpg,오래된 찻집을 매우 좋아하는 복고풍 취향을 가진 고등학생 야나기 리쿠는 보통 여자애들과는 조금 다른 취미를 매일 혼자서 즐기고 있다. 그러던 어느 날 우연히 방문한 정통 찻집 ‘아네모네’의 마스터가 놀랍게도 은근히 신경 쓰이던 같은 반 친구 후시미 에이토인데……,만화,순정만화
983,9791165913380,방과 후 찻집에서 :coffee shop Anemone,저자: Kina Azusa,조은세상,https://image.aladin.co.kr/product/25430/49/cover/k072633413_1.jpg,같은 반 친구이자 정통 찻집 ‘아네모네’의 마스터인 에이토를 짝사랑 중인 리쿠. 데이트 중에 들른 찻집에서 에이토의 소꿉친구인 모모야마 코코로를 만난다. 두 사람의 관계에 동요하는 마음을 숨기지 못해 기운이 없는 리쿠를 위로해 주는 라이조. 그리고 에이토도 리쿠에 대해서 좀 더 알고 싶다고 생각하는데...,만화,순정만화
984,9791197151408,프랑스 언어학의 이해 =Comprendre la linguistique française ,"김이정,최내경 지음",봄싹,https://image.aladin.co.kr/product/25014/14/cover/k272632828_1.jpg,"언어란 무엇인가 쉽게 이해할 수 있는 일반적 내용으로 시작해서 프랑스어의 소리와 어휘를 거쳐, 그 모양과 뜻을 헤아리고 다른 학문 분야와 연계해 나간다.",인문학,기호학/언어학
