id,isbn,title,author,publisher,image_url,content,genre_1,genre_2
1466,9788979661996,마르크스주의에서 본 영국 노동당의 역사 :창당부터 코빈의 부상과 좌절까지 ,"토니 클리프,이수현 옮김",책갈피,https://image.aladin.co.kr/product/25725/88/cover/8979661991_1.jpg,노동당의 탄생부터 코빈의 부상과 좌절까지 120년의 역사를 돌아보며 오늘날 노동계급이 자본주의와 우파에 맞서 승리할 수 있는 방안을 모색한 책이다.,사회과학,사회문제
1467,9791190313599,새드엔딩은 없다 :인생의 삑사리를 블랙코미디로 바꾸기 ,강이슬 지음,Whale Books(웨일북),https://image.aladin.co.kr/product/25690/67/cover/k802736465_1.jpg,서른이 되어도 느끼하지 않을 수 있을까. 《안 느끼한 산문집》으로 강렬한 인상을 남긴 강이슬 작가가 더 강력한 긍정 바이러스로 돌아왔다. 서른. 그 숫자가 뭐라고 이렇게 마음을 싱숭생숭하게 하는 것인지. 서른의 앞과 뒤 그 어느 즈음에서 그녀는 외친다. 준비되지 않은 어른의 심정을.,문학,한국에세이
1468,9788991518087,"여보, 나 여기 있어 ","지은이: 김실,이영휘",우와,https://image.aladin.co.kr/product/62/32/cover/8991518087_1.jpg,2005년 1월 KBS 아침마당에 아름다운 부부 이야기로 출연한 김실 부부의 인생과 사랑이 담긴 에세이. 행복한 부부란 기쁨과 슬픔의 잔을 함께 나누며 역경의 토양조차 함께 먹고 성숙하는 세상에서 가장 아름다운 축복이라는 것을 알려준다.,문학,한국에세이
1469,9791156121763,"체르노빌 생존 지침서 :지구적 핵재난, 국가의 대응 실패, 피폭된 사람들 ",케이트 브라운 지음 ;우동현 옮김,푸른역사,https://image.aladin.co.kr/product/25661/7/cover/k262735240_1.jpg,“대부분의 방사능은 소멸되었습니다. 지역에서 재배한 농산물을 예전처럼 소비해도 됩니다.” 발전소 폭발 후 몇 달 사이에 참사의 규모가 명백해지자 소비에트 관료들은 재난 이후를 살아가는 시민들을 위해 많은 생존 지침서Manual for Survival를 만들었다. 하지만 이 생존 지침서들은 저자들이 말할 수... ,역사,유럽사
1470,9791186827888,어른의 무게 :장한이 에세이 ,지은이: 장한이,이다books(이다북스),https://image.aladin.co.kr/product/25711/36/cover/k532736774_1.jpg,다음 브런치 작가 장한이의 에세이집. 그는 이 책에서 누구나 어른이 되지만 모두가 어른이 되는 건 아니라는 사실을 끊임없이 실감한다. 어른이 되면 대범하고 단단해질 줄 알았다. 그렇지 않았다. 카카오페이지에 &lt;이제는 롱런이다&gt;를 연재했던 그가 이제 어른이 어른으로 살아야 하는 이유를 묻는다.,문학,한국에세이
1471,9791189576707,덕립선언서 :일본발 서드 임팩트에 맞닥뜨린 우리의 현재 기록 ,서찬휘 지음,생각비행,https://image.aladin.co.kr/product/25732/73/cover/k552736875_1.jpg,2017년 《키워드 오덕학》(세종도서 교양부문 선정도서)이란 책으로 ‘자생형 한국산 2세대 오덕의 현재 기록’을 정리했던 저자가 2020년 현재 한국의 오덕 문화를 다시 진단하고 정리하는 책을 펴냈다.,인문학,교양 인문학
1472,9791156121794,개경에서 한양까지 :권력투쟁으로 본 조선 탄생기 ,이승한 지음,푸른역사,https://image.aladin.co.kr/product/25727/24/cover/k072736871_1.jpg,조선왕조가 개창한 지 10년도 훨씬 지난 1405년 도읍을 개경에서 한양(서울)으로 옮긴다. 새 왕조 개창의 완성을 알리는 상징적 조치였다. 개경에 근거를 둔 고려왕조 시절 기득권층의 반발은 얼마나 심했을까. 천도 과정만 다뤄도 책 한 권 분량의 이야기는 충분히 나올 것이다.,역사,조선사
1473,9791156121787,개경에서 한양까지 :권력투쟁으로 본 조선 탄생기 ,이승한 지음,푸른역사,https://image.aladin.co.kr/product/25727/15/cover/k882736870_1.jpg,조선왕조가 개창한 지 10년도 훨씬 지난 1405년 도읍을 개경에서 한양(서울)으로 옮긴다. 새 왕조 개창의 완성을 알리는 상징적 조치였다. 개경에 근거를 둔 고려왕조 시절 기득권층의 반발은 얼마나 심했을까. 천도 과정만 다뤄도 책 한 권 분량의 이야기는 충분히 나올 것이다.,역사,조선사
1474,9788936477950,생각하는 여자 :일상에 도전하는 철학을 위하여 ,줄리엔 반 룬 지음 ;박종주 옮김,창비,https://image.aladin.co.kr/product/23842/54/cover/8936477951_1.jpg,"줄리아 크리스떼바부터 로지 브라이도티까지, 동시대 여성 사상가들에게 사랑, 놀이, 일, 두려움, 경이, 우정이라는 여섯가지 주제를 질문한 줄리엔 반 룬의 철학 에세이다.",인문학,철학 일반
1475,9788958271253,책과 노는 아이 :창의력이 폭발하는 책놀이 ,필립 브라쇠르 지음 ;박언주 옮김,한울림,https://image.aladin.co.kr/product/23988/14/cover/8958271256_1.jpg,"아이들을 책과 친해지게 만들고 싶은 부모와 교사, 도서관 사서, 독서지도사들에게 꼭 필요한 책이다. 집에 있는 책이나 도서관에서 빌린 책을 이용해 누구나 쉽고 재미있게 따라 할 수 있는 책놀이를 담았다.",육아,교육/학습
1476,9791185415376,기억의 과학 :뇌과학이 말하는 기억의 비밀 ,찰스 퍼니휴 지음 ;장호연 옮김,에이도스,https://image.aladin.co.kr/product/23996/49/cover/k702639218_1.jpg,"심리학자인 지은이는 기억에 관한 최신 뇌과학 연구뿐만 아니라 프루스트, 보르헤스, 나보코프, 버지니아 울프 등의 문학작품 그리고 중세 수도사들의 기억술에 이르기까지 기억과 관련한 다양하고 흥미로운 이야기들로 기억의 미스터리를 하나하나 파헤친다.",과학,기초과학/교양과학
1477,9791188041305,(아이의 속마음이 한눈에 보이는) 마법의 카드 :하루 5분! 집에서 하는 아동심리상담 ,하라 준이치로 지음 ;권혜미 옮김,책이있는풍경,https://image.aladin.co.kr/product/24075/23/cover/k422639033_1.jpg,"어린이 코칭 전문가가 개발한 ‘마법의 피트인 카드’를 소개하는 책이다. 어린 자녀가 자신의 마음을 잘 표현하지 못하거나, 대화에 어려움을 느낄 때 피트인 카드를 이용하면 보다 쉽게, 그리고 순식간에 아이의 진짜 마음을 파악할 수 있다. 일상적인 대화를 나눌 때나 특별한 문제상황이 있을 때 모두 유용하다.",육아,육아
1478,9788979191844,울랄라 가족 :김상하 장편소설 ,지은이: 김상하,창해,https://image.aladin.co.kr/product/23776/40/cover/8979191847_1.jpg,"김상하 작가의 세 번째 장편소설로, 웃픈(웃기면서도 슬픈) 소설이다. 시종 웃음을 주면서 묘한 슬픔이 스미게 하는 것이 김상하 작가 특유의 소설 작법이라고 할 수 있는데, 이 소설에서 더더욱 그 장점을 잘 살리고 있다.",문학,한국소설
1479,9791170430773,우리 아이를 위한 글쓰기 연습 :아이의 공부머리 키우는 엄마표 글쓰기 ,여상미 지음,믹스커피,https://image.aladin.co.kr/product/23800/66/cover/k822639085_1.jpg,"뜬구름 잡는 글쓰기 노하우가 아닌 엄마의 삶과 아주 밀접한 글쓰기 방법을 소개한다. 아이를 위해 기록하는 수유일지, 아이와 함께 쓰는 관찰일지, 가족일기 등 아이를 키울 때 도움이 되는 글쓰기부터, 사소한 일상에서 소재 찾는 법, SNS 글쓰기, 리뷰 작성하기 등 실용적으로 필요한 글쓰기 비법이 가득하다.",육아,교육/학습
1480,9788990629548,(당신의 인생을 이끌어 줄) 긍정 비타민 ,데이비드 시버리 지음 ;김연희 옮김,뜻이있는사람들,https://image.aladin.co.kr/product/24076/80/cover/8990629543_1.jpg,"자신이 어디로 가려 하는지, 무엇을 하려 하는지, 누가 자신을 병들게 하고 있는지를 찾아내기 위해서는 자주 뒤를 돌아봐야 한다. 자신의 입장을 음미하기만 하는 단순 작업은 그리 재미있는 일은 아니지만, 이성적으로 살아가기 위해서는 반드시 필요한 것이 긍정이다.",문학,외국에세이
1481,9788932036311,그리운 문학 그리운 이름들 :김주연 비평집 ,지은이: 김주연,문학과지성사,https://image.aladin.co.kr/product/24079/54/cover/8932036314_1.jpg,『문학과지성』 동인이자 1세대 문학평론가로서 지난 55년간 활발한 비평 활동을 펼쳐온 김주연의 비평집. 32편의 비평문과 한 편의 대담이 담긴 이번 비평집 또한 문학의 가치에 대한 신실한 믿음으로 높은 성취를 이룬 문학작품들을 치열하게 분석한 결과물을 한데 묶었다.,문학,문학의 이해
1482,9788982182570,옛이야기의 귀환 :한국문학에서 스토리텔링까지 ,김만수 지음,강,https://image.aladin.co.kr/product/24146/94/cover/8982182578_1.jpg,"신화, 민담, 전설, 설화, 야사 등으로 전승되어오던 옛이야기들이 판타지, SF 등의 이름으로 최근 영화, 게임, 만화, 드라마, 문학 분야에서 재활용되고 있다. 이러한 변화의 양상을 정리하고 ‘옛이야기의 귀환’이 갖는 의미를 다각도로 조명하고자 한 책이다.",문학,문학의 이해
1483,9788954671545,탑 ,지은이: 황석영,문학동네,https://image.aladin.co.kr/product/24075/11/cover/8954671543_1.jpg,"한국문학의 살아 있는 거장 황석영의 중단편전집이 새로이 출간되었다. 처음 출간된 지 20년이 지난 중단편전집의 체재와 표기 등을 가다듬고, 장정을 새롭게 하고, 신작 「만각 스님」까지 포함해 완전한 중단편전집으로 개비한 것이다.",문학,한국소설
1484,9788954671552,삼포 가는 길 ,지은이: 황석영,문학동네,https://image.aladin.co.kr/product/24075/12/cover/8954671551_1.jpg,"한국문학의 살아 있는 거장 황석영의 중단편전집이 새로이 출간되었다. 처음 출간된 지 20년이 지난 중단편전집의 체재와 표기 등을 가다듬고, 장정을 새롭게 하고, 신작 「만각 스님」까지 포함해 완전한 중단편전집으로 개비한 것이다.",문학,한국소설
1485,9791161570990,황금별자리 :이재운 장편소설 ,지은이: 이재운,나무옆의자,https://image.aladin.co.kr/product/24011/86/cover/k852639213_2.jpg,"&lt;소설 토정비결&gt;의 작가 이재운의 화제작 &lt;황금부적&gt;이 2020년 새로이 개정되었다. 120년 전 증산 강일순이 선언한 후천 개벽이 21세기의 어느 날 부산에서 시작되어, 마침내 새 하늘 새 땅이 열리고 새 사람이 탄생한다는 이른바 근미래소설이다.",문학,한국소설
1486,9788954671569,만각 스님 ,지은이: 황석영,문학동네,https://image.aladin.co.kr/product/24075/10/cover/895467156x_1.jpg,"한국문학의 살아 있는 거장 황석영의 중단편전집이 새로이 출간되었다. 처음 출간된 지 20년이 지난 중단편전집의 체재와 표기 등을 가다듬고, 장정을 새롭게 하고, 신작 「만각 스님」까지 포함해 완전한 중단편전집으로 개비한 것이다.",문학,한국소설
1487,9788954671576,객지 :황석영 소설 ,지은이: 황석영,문학동네,https://image.aladin.co.kr/product/24075/21/cover/8954671578_1.jpg,"1960년대 후반 바닷가 간척공사 현장을 배경으로 저임금과 부당한 처우에 시달리던 떠돌이 노동자들이 쟁의를 일으키는 과정을 그린 작품으로, 해방 이후 한국사회에서 노동자 쟁의의 현장을 최초로 형상화해 1970, 80년대 노동소설의 선구로 평가받는 소설이다.",문학,한국소설
1488,9788954671583,한씨연대기 :황석영 소설 ,지은이: 황석영,문학동네,https://image.aladin.co.kr/product/24075/22/cover/8954671586_1.jpg,한국문학의 살아 있는 거장 황석영의 중단편전집이 새로이 출간되었다. 대표작으로 손꼽히는 중편 「객지」와 「한씨연대기」는 온전한 주목을 요하는 작품인 만큼 각각 독립된 단행본으로 엮었다.,문학,한국소설
1489,9791190174770,선샤인의 완벽한 죽음 :범유진 장편소설 ,지은이: 범유진,안전가옥,https://image.aladin.co.kr/product/23869/56/cover/k492639581_1.jpg,"안전가옥 오리지널 4권. 범유진 장편소설. 모두의 낙원을 꿈꾸며 '기회의 평등'이 보장된 환경에서 '선하고 아름다운' 엘리트를 양성하기 위해 설립된 사립 학교, 무아교. 보랏빛 용담꽃이 흐드러지게 핀 8월 1일, 무아교의 여신 선샤인이 시체로 발견된다.",문학,추리/미스터리소설
1490,9791190456111,광주 아리랑 :정찬주 장편소설 ,지은이: 정찬주,다연,https://image.aladin.co.kr/product/23994/78/cover/k472639117_1.jpg,광주민중항쟁 40주년 회심작. 1980년 5월 광주민중항쟁 14일간을 옴니버스 형식으로 다룬 다큐소설이다. 그때 광주에서 벌어진 사건들과 그 안에 얽힌 수많은 인물은 40년이 지난 오늘날 리얼리티라는 타임머신을 타고 부활하여 우리의 가슴을 먹먹하게 때린다.,문학,한국소설
1491,9791190456128,광주 아리랑 :정찬주 장편소설 ,지은이: 정찬주,다연,https://image.aladin.co.kr/product/23994/83/cover/k442639117_1.jpg,광주민중항쟁 40주년 회심작. 1980년 5월 광주민중항쟁 14일간을 옴니버스 형식으로 다룬 다큐소설이다. 그때 광주에서 벌어진 사건들과 그 안에 얽힌 수많은 인물은 40년이 지난 오늘날 리얼리티라는 타임머신을 타고 부활하여 우리의 가슴을 먹먹하게 때린다.,문학,한국소설
1492,9788927809319,유쾌한 회전목마의 서랍 :박성현 시집 ,지은이: 박성현,중앙일보플러스,https://bookthumb-phinf.pstatic.net/cover/135/450/13545050.jpg?type=m1&udate=20180619,도발적이며 새로운 레이어들2009년 중앙신인문학상으로 등단한 박성현 시인의 첫 시집 『유쾌한 회전목마의 서랍』이 문예중앙에서 출간되었다. 박성현의 첫 시집은 여러 겹의 레이어를 지닌 다면체와도 같은 시집이다. 여러 각도에서 대상을 바라보는 숱한 시선들은 시를 하나의 의미로 고정시키려 하지... ,문학,시
1493,9791188798094,봄의 스타카토 :박만진 포켓시집 ,지은이: 박만진,세줄,https://image.aladin.co.kr/product/16367/49/cover/k152533546_1.jpg,"박만진 포켓시집. 비교적 짧은 시를 선정하여 283쪽에 이른다. 그야말로 맑고 청순한 시, 마치 서치라이트로 사물을 비추는 듯하면서도 그 사물들이 섬세하게 약동하며 즐거움으로 빛날 수 있는 시편들이 수록되어 있다.",문학,시
1494,9791157283156,발바닥 지도 :김은수 시집 ,지은이: 김은수,애지,https://image.aladin.co.kr/product/17926/65/cover/k212534132_1.jpg,"지혜사랑 시인선 198권. &lt;모래꽃의 꿈&gt;, &lt;하늘 연못&gt; 등을 출간한 김은수 시인의 네 번째 시집. 이번 시집은 '발바닥의 힘'으로 살아온 시인 자신의 삶의 기록이자 낮은 곳에서 삶의 진실을 파헤치는 노력의 소산이라고 할 수가 있다.",문학,시
1495,9791157283545,(이혜선의) 시가 있는 저녁 ,지은이: 이혜선,애지,https://image.aladin.co.kr/product/19305/45/cover/k062635302_1.jpg,"이혜선 시인의 &lt;시가 있는 저녁&gt;. 서정주, 정현종, 함민복, 김사인, 김행숙에서부터 나희덕, 임영조, 정일근, 문정희, 공광규까지 총 88명 시인의 주옥같은 시의 찬가이다.",문학,문학의 이해
1496,9788991535466,한국 현대시 =Koreanische moderne gedichte ,지은이: 유한나,고요아침,http://image.aladin.co.kr/product/58/87/cover/8991535461_1.jpg,2005년 독일에서의 ‘한국의 해’를 기념해 현대 한국시인 25인의 시 50편을 독일어로 엮었다. ‘문학과 창작지’에 &lt;독일어로 읽는 한국시&gt; 코너에 실린 시인들의 작품이 중점적으로 담겨져 있다.,문학,시
1497,9791156623182,고은 깊은 곳 ,"고은,김형수 대담",아시아,https://image.aladin.co.kr/product/11789/33/cover/k332531220_2.jpg,"시(詩)력 60년을 앞둔 '시인 고은' 삶과 시의 깊은 곳을 들여다본 대담집. 시인이자 소설가 김형수와 함께 했다. 무엇을 따라서, 누군가와 함께 아닌 '자신의 그림자'와 함께 걸어온 고은. 그 시적 근원부터 2017년 함께 숨 쉬고 취하며 절망하면서 살아가는 지금의 행성 위까지 오롯이 담았다.",문학,한국에세이
1498,9788995834992,"루스, 발렌타인 그리고 홀리 =Luth valentine and holly ",고솜이 지음 ;강모림 그림,돌풍,https://bookthumb-phinf.pstatic.net/cover/054/345/05434516.jpg?type=m1&udate=20151113,"의 작가 고솜이의 두 번째 소설. 잊었던 사랑의 의미와 현대인의 정신적 단절감을 이야기한다. 소설은 뉴욕과 서울이라는 서로 다른 공간에서 두 주인공의 관점으로 진행된다. 주인공 홀리는 인간의 순수하고 완벽한 얼굴을 가진 상징적 존재로서, 통념에 얽매인 작가 이진을 완전한 사랑의 세계로 인도한다.",문학,한국소설
1499,9788991127715,(프랑스 국립 퐁피두센터 특별展 천국의 이미지) 화가들의 천국 ,"기획편집: 전승원,포토: 편정화",지앤씨미디어,http://image.aladin.co.kr/product/283/10/cover/8991127711_1.jpg,"대중들에게 가장 친근하고 편안한 지휘자로 알려진 금난새의 교향곡 이야기. 저자 본인이 직접 고른 교향곡 10곡에 얽힌 비하인드 스토리, 작곡가의 특성, 곡의 구성에 대한 기초적인 해설까지를 꼼꼼히 담고 있다.",예술,미술
1500,9791189282097,층층나무편의점 :이정오 시집 ,지은이: 이정오,시와정신사,https://image.aladin.co.kr/product/19657/41/cover/k452635730_1.jpg,그들은 나의 전부였다내가 나를내가 그들을죽도록사랑하지 않으면 안 되었다여기는 365일만 있으므로 모든 요일은 지운다내 시가 조금이나마 서로의 마음을어루만져줄 수 있기를                                                                 ----- ‘시인의 말’,문학,시
1501,9791197041815,맑스주의와 무정부주의 =Marxism & anarchism ,전국노동자정치협회 [편],전국노동자정치협회,https://image.aladin.co.kr/product/25646/38/cover/k872735040_1.jpg,"맑스주의 관점으로 무정부주의와 유사 무정부주의에 대한 최고의, 다방면에 걸친 치열한 논쟁서다. 이 책이 자본주의를 변혁하고 새로운 사회를 위해 싸우는 동지들에게 굳센 사상의 무기가 되기를 기대한다.",인문학,서양철학
1502,9791187716501,초저출산 터널을 탈출하는 법 :ultra-low birthrate Q&A 5 ,남충우 지음,글나무,https://image.aladin.co.kr/product/25975/32/cover/k582737225_1.jpg,"『초저출산 터널을 탈출하는 법』 은 〈초超저출산은 얼마나 심각한 일인가〉, 〈초超저출산, 누가 죄인인가〉, 〈저출산을 극복한 국가는 없는가〉, 〈초超저출산, 정말 대책이 없을까〉, 〈2020년 저출산 예산 32조원으로도 부족한가〉 를 수록하고 있는 책이다.",사회과학,비평/칼럼
1503,9791197230806,안녕하세요 동물변호사 대표입니다 ,글쓴이: 문경복,알,https://image.aladin.co.kr/product/25784/11/cover/k392736715_1.jpg,"저자는 유기견 눈빛에서 자신이 보인다고 했다. 여덟 살, 엄마에게 버려진 때부터. 저자의 어린 시절부터, 동물의 슬픔에 감응하고, 동물변호사를 설립하고, 자신을 철장에 가두는 데까지 이야기를 일기 문학 형식으로 담담하게 풀어놓은 책이다.",문학,한국에세이
1504,9788946069855,"청소년을 위한 매체 이야기 =유튜브, SNS, 게임, 영화 등 Z세대의 미디어 길라잡이 /Introduction to media for teens ",한국방송학회 엮음 ;최진호 지음,한울(한울엠플러스),https://image.aladin.co.kr/product/26411/57/cover/8946069856_1.jpg,"한국방송학회가 기획하고, 7인의 미디어 커뮤니케이션 학자들이 집필한 이 책은 매체의 개념과 특성·기능·효과뿐 아니라 뉴스 프레임, 게임의 함정, 유튜브 알고리즘, SNS상의 관계, 매체 윤리 등 다양한 시각으로 비판적 사고 능력을 향상시킬 수 있는 내용을 균형감 있게 담아냈다.",사회과학,언론/미디어
1505,9791190635080,유르스나르의 구두 :스가 아쓰코 에세이 ,지은이: 스가 아쓰코 ;옮긴이: 송태욱,한뼘책방,https://image.aladin.co.kr/product/25754/80/cover/k522736108_1.jpg,"61세에 낸 첫 책 『밀라노, 안개의 풍경』으로 여류문학상과 고단샤 에세이상을 동시에 수상하며  데뷔한 스가 아쓰코. 뒤늦게 에세이스트의 길을 걷기 시작해 활발히 글을 썼으나 69세에 세상을 떠나고 만다. 『유르스나르의 구두』는 스가 아쓰코가 생전에 펴낸 마지막 에세이다.",문학,외국에세이
1506,9791187756224,분홍의 시작 :남길순 시집 ,지은이: 남길순,함께하는출판그룹파란,https://bookthumb-phinf.pstatic.net/cover/139/875/13987588.jpg?type=m1&udate=20180901,"남길순의 첫 시집에는 ‘분홍’의 감각이 도처에 널려 있다. 그러나 남길순 시의 ‘분홍’은 소녀취미는 물론 산뜻하고 당당한 분홍과도 거리가 멀다. 그것은 생명의 절정을 품은 말랑말랑함과 당도, 물기를 지닌 잘 익은 복숭아의 분홍빛을 연상시키면서 동시에 그런 생명에 필연적으로 꼬이는 벌레마저 한 몸에 품은 분홍에 가깝다.",문학,시
1507,9788988164099,滿月紅顔 :經洲 柳赫仁 遺稿集 ,엮은이: 유석춘,전통과현대사,http://image.aladin.co.kr/product/24/71/cover/6000014968_1.gif,"책은  '경제적 성공'에 관한 논의를 넘어, 태국, 베트남, 싱가포르 등 동남아시아 6개국 화인사회의 변화와 다양성을 역사적 맥락에서 자세히 그려낸다. 또한 토착사회로의 '동화'와 '중국적인 정체성'간의 갈등을 겪고 있는 오늘날 화인사회를 객관적으로 분석하고 경제의 중심에 있는 화인사회의 미래에 대해 전망을 제시한다.",역사,아시아사
1508,9788989324003,양반 동네 소동기 =A riot in the Yangban village ,尹學準 著,효리,http://image.aladin.co.kr/product/25/50/cover/8983324007_1.gif,자신들이 양반의 후예라는 특권의식에 사로잡혀 살고 있는 우리 국민 대다수에게 재출간된 이 책은 매우 불편한 느낌을 줄 수 있다. 하지만 저자가 태어나고 자란 경북 안동을 대상으로 양반문화를 비판적으로 리뷰한 내용들은 새천년을 맞은 지금까지 우리 사회에 상당한 영향력을 미치고 있는 양반문화와 유교 이데올로기를 이해하는데 도움을 준다. -문화일보,인문학,문화/문화이론
1509,9791196137045,어떤 새는 모음으로만 운다 :차주일 시집 ,지은이: 차주일,포지션,https://bookthumb-phinf.pstatic.net/cover/129/835/12983519.jpg?type=m1&udate=20180104,차주일이라는 사람은 시에 있어서만큼은 매우 진지하다. 요즘 젊은이들의 말투로 하자면 ‘궁서체’다. 이때 그것은 ‘옛날 사람’을 대표하는 말이다. 어딘지 꼿꼿하고 타협이 없으며 모든 것을 진지하게 받아들이는 것이 우리 시대와 어울리지 않을 때 ‘궁서체’라고 한다. 또한 그는 “마음을 척추 삼은”... ,문학,시
1510,9791158964245,우리는 점점 모르는 사이가 되어가고 :송영희 시집 ,지은이: 송영희,문학의전당,https://image.aladin.co.kr/product/19390/8/cover/k432635117_1.jpg,서울에서 태어나 1968년 「여원」 신인문학상을 수상하며 작품 활동을 시작한 송영희 시인의 시집. 눈앞의 거리에서 '감응(感應)'을 요청하는 진실한 신호로 언어를 써내려 온 송영희 시인의 이번 신작 시집은 담담한 어조로 우리에게 '이후'를 내미는 현재에 대해 이야기한다.,문학,시
1511,9788936463052,문학의 귀환 :최원식 평론집 ,지은이: 최원식,창작과비평사,http://image.aladin.co.kr/product/28/90/cover/8936463055_1.gif,계간  주간으로 있는 최원식 교수가  이후 4년만에 출간한 평론집. 주로 90년대 후반에 씌어진 글들을 5부로 구획지어 묶었다. 저자는 '문'학과 문'학'을 넘어 '문학'으로! 라는 캐치프레이즈를 내걸고 있다.,문학,문학의 이해
1512,9788965112792,八八의 노래 :미수기념최승범단시집 ,저자: 최승범,시간의물레,https://image.aladin.co.kr/product/19339/99/cover/8965112796_1.jpg,고하 최승범 시백의 미수 기념 시집. 시조는 최승범 시인이 일생을 두고 짓고 연구한 시가로 시조시의 정수인 단시조(평시조) 형식을 취하고 있다. 八八에 읊는 노래들은 인간의 원초적인 욕망인 먹거리를 새삼스럽게 노래하고 일생동안 고락을 같이 한 안해를 끔직이 생각하는 상념이 녹아 있다.,문학,시
